OWMNAAM;OWL;ESF1;ESF2;ESF3;ESF4;ESF5;ESF6;ESF7;ESF8;Karakterschets;Doelen;Toestand;Oorzaken;Maatregelen;MonitoringAnalyseWensen;ESF1;ESF2;ESF3;ESF4;ESF5;ESF6;ESF7;ESF8;MotiveringBegrenzing;Gemeenten;Provincies;Eigenaren;Status;Literatuurverwijzing;Gebiedspartners;aangepast;Opmerking
Vaarten Westeramstel;NL11_2_6;2;2;3;3;1;2;2;3;;;;De oorzaak van deze kwaliteit zijn de geringe waterdiepte en hoge voedselrijkdom van het waterlichaam. ;;;"De ESF productiviteit water is in verschillende delen van het waterlichaam een probleem: Niet te veel kroos/flab. Chl-a in voorjaar hoog, in de hoofdwatergangen/waterlichaam. Vegetatie voedselrijk. Dus een (te) voedselrijk systeem. (Zeer) hoog P-tot en plaatselijk ook hoog orthoP. P-belasting net op of onder Pcrit,; Productiviteit is niet het grote knelpunt. Wel in de Middelpolder. O.a. het flexibelpeilgebied levert veel nutrienten. De stuwen in dit gebied staan ook te hoog (-1.23 ipv -1.25) waardoor er water op het maaiveld komt.";De ESF lichtklimaat voldoet op sommige plekken wel en op andere plekken niet.  Lokaal, waar water dieper is,  is lichtklimaat beperkt door algen Opwervelend en bezinkend veenslib bedekt planten;De ESF productiviteit bodem vormt een probleem. Op veel plaatsen veel (40-50 cm) bagger aanwezig. Bodemmetingen laten zien dat dit in de Middelpolder voedselrijk is.Aangenomen kan wordendat de samenstelling elders ook niet gunstig is voor de aanwezigheid en/of de samenstelling van waterplanten.;De ESF habitatgeschiktheid vormt een probleem. Op veel plaatsen is het water zo ondiep dat er geen planten verwacht worden of zal de bedekking beperkt zijn. Zeer vaak zijn de oevers te steil of zelfs beschoeid, vooral Noorderlegmeer en Bovenkerker, dat beperkt de emerse vegetatie, stedelijk en landelijk.;De ESF verspreiding voldoet: de doelsoorten zijn in de omgeving aanwezig en kunnen er ook komen.; De lage bedekking met emerse planten duidt op te intensief onderhoud.;De ESF organische belasting voldoet mogelijk niet. In het stedelijk gebied zijn bladinval van bomen en organisch materiaal uit overstorten bronnen van organisch materiaal (in de Middelpolder ligt een gemengd stelsel met overstorten).; In stedelijk gebied door bomen en overstorten. In kassengebied mogelijk effect op macrofauna door gebruik van gwbsm. SIMONI slaat aan in stedelijk gebied en kassengebied.;"Het herbegrenzen van dit waterlichaam is gewenst omdat de toestandsbepaling bij de huidige begrenzing geen representatief beeld geeft van de ecologische kwaliteit; Er wordt nu gerapporteerd over het minst represetatieve gedeelt van de polder. Het belangrijkste argument voor de voorgestelde wijzigingen is vergroten van de transparantie: wanneer er over de toestand in de gehele polder wordt gerapporteerd zijn verbetering of achteruitgang beter te zien. De inspanning qua monitoring hoeft niet gewijzigd te worden, in ieder geval niet voor wat betreft de verplichte monitoring. De inspanning voor de wat betreft maatregelen wordt ook niet anders. ";Amstelveen en Uithoorn;Noord-Holland;;;WGP Westeramstel;;LM_20190916;
Vaarten Groot Mijdrecht;NL11_2_7;1;1;3;3;1;2;1;2;;;;De oorzaak van deze kwaliteit zijn de hoge ammoniumconcentraties en dikke sliblagen in het waterlichaam. ;;;"De ESF productiviteit water voldoet:  Geen grote hoeveelheden algen, flab/kroos. Submerse vegetatie matig eutroof. Verblijftijf extreem kort: 2 dagen. P-belasting ook zeer hoog. P-krit lager dan belasting, maar onbetrouwbaar; systeem zit in uitersten van model.. Productie dus niet te hoog";De ESF lichtklimaat vormt geen probleem:  Weinig algen en geringe diepte, dus licht niet beperkend;De ESF productiviteit bodem vormt een probleem. Plaatselijk 20-30 cm tot 60 cm bagger aanwezig. Aangenomen kan wordendat de samenstelling niet gunstig is voor de aanwezigheid en/of de samenstelling van waterplanten. Relatief ammoniumrijk grondwater.;"De ESF habitatgeschiktheid vormt een probleem. Op zeer veel plaatsen is het water erg ondiep (behalve waterlichaam en Waverhoek)  zodat er weinig of geen planten verwacht worden. Steile oevers 13 van de 31 waarnemingen >40o. Vooral in landelijk gebied. Vaak ook weinig EMERS. Zeer veel kwel, die zuurstofloos is, Geen tijd om zuurstof uit lucht op te nemen, weinig primaire productie, grote zuurstofvraag. Lage zuurtofconcentraties; kan effect hebben op (macro)fauna.";De ESF verspreiding voldoet: de doelsoorten zijn in de omgeving aanwezig en kunnen er ook komen.; De plaatselijk lage bedekking met emerse planten kan duiden op te intensief onderhoud, check morfologie.; Geen aanwijzingen;" In zuiden waterlichaam opvallend slechte macrofauna. Gebieden met potentiële bronen toxische stoffen; bij de RWZI met een persleiding plus overstort die regelmatig loost (7xjaar zegt de wandelgang); industriegebied met autosloperijen, stedelijk gebied.";"Het herbegrenzen van dit waterlichaam is gewenst omdat de toestandsbepaling bij de huidige begrenzing geen representatief beeld geeft van de ecologische kwaliteit; Er wordt nu gerapporteerd over het minst represetatieve gedeelt van de polder. Het belangrijkste argument voor de voorgestelde wijzigingen is vergroten van de transparantie: wanneer er over de toestand in de gehele polder wordt gerapporteerd zijn verbetering of achteruitgang beter te zien. De inspanning qua monitoring hoeft niet gewijzigd te worden, in ieder geval niet voor wat betreft de verplichte monitoring. De inspanning voor de wat betreft maatregelen wordt ook niet anders. ";De Ronde Venen;Utrecht;;;;;LM_20190916;
Sloterplas;NL11_3_1;3;3;2;3;3;1;3;1;;;;De oorzaak van deze kwaliteit is de hoge voedselrijkdom van het waterlichaam. De Sloterplas is zeer hoog belast met voedingstoffen en heeft een kleine draagkracht, omdat het een diepe plas is. Er komen regelmatig blauwalgenbloeien voor. De belasting kan gereduceerd worden door de plas te isoleren of het systeem kan versterkt worden door te verondiepen en habitat voor mossels te creeeren.;;;"De ESF productiviteit water vormt een probleem: Lage chlorofyl concentraties midden op plas, aan de rand van de plas wel hoge chlorofyl concentraties en veel hoog belast. Zeer soortenarme vegetatie: alleen waterpest.  zeer hoge belasting uit de omliggende SBP; door lange belastinghistorie is de bodem in de diepe plas en op slibrijke ondiepe plekken ook zeer voedselrijk en een grote bron. , extreem veel periphyton";"De ESF lichtklimaat vormt een probleem. Lichtuitdoving is in het voorjaar laag. Het lichtklimaat wordt bepaald door grote periphytongroei.  In de zomer is zicht veelal laag als blauwalg toeneemt (vooral in de jaren na 2016); vestigingsdiepte >4m, evenwel at risk omdat het afhankelijk is van mosselen";"De ESF voedselrijkdom van de waterbodem vormt lokaal een probleem:  Wisselende slibgehalten; bladeren bij bomenrijke oever en slibrijke diepe delen";De ESF habitatgeschiktheid vormt een probleem. Op sommige plekken bomenrijke oevers, het areaal ondiep water is onvoldoende;De ESF verspreiding voldoet: de doelsoorten zijn in de omgeving aanwezig en kunnen er ook komen.; ; ; ;Geen herbegrenzing nodig.;Amsterdam;Noord-Holland;;;Factsheet Sloterplas, Stroom 2018;;LM_20190916;
Gaasperplas;NL11_3_2;3;1;1;3;3;1;2;1;;;;De oorzaak van deze kwaliteit is de slecht ontwikkelde soortensamenstelling van onderwaterplanten in het waterlichaam. De plas is een heldere diepe plas, met een redelijk diverse onderwaterplantengemeenschap, maar de biodiversiteit is relatief laag. De matige soortensamenstelling is het gevolg van te hoge voedselrijkdom in de plas. Er zijn maatregelen uitgevoerd om voedselrijkdom te verlagen (Gaaspersingel) hebben wel effect op de hoeveelheid algen in de plas, maar (tot nu toe) geen effect op [P], [PO4], [Chlf-a] en soortensamenstelling submers. Waarschijnlijk zijn er aanvullende bronmaatregelen nodig om de soortensamenstelling van onderwaterplanten te verbeteren. Ook de emerse vegetatie is slecht ontwikkeld en de plas heeft een beperkt ondiep oppervlak wat geschikt is voor emerse vegetatie. Er bevinden zich veel bomen- en struiken langs de oevers en een natuurlijk verloop oevers van land naar water ontbreekt door toepassing harde beschoeiing. De plas is gevoelig voor fosforrijkgrondwater en concentraties fosfor nemen toe in het grondwater. ;;"Opmerkingen: maar 70 ha teveel onverhard in de waterbalans. Update waterbalans nodig, o.a. EAG Gaaspersingel, toenemende [Cl] in de plas sinds isolatie, invloed grondwater. Aandacht [Cl] en [P] in grondwater, zie GGP057; chlorideconcentratie van kwel moet hoger, onverhard oppervlak moet kleiner.";"De ESF productiviteit water is onvoldoende en staat onder druk. Algenconcentraties liggen wel altijd onder de detectiegrens. In 2018 komt tot 4,5 m submerse vegetatie voor, deze diepte is toegenomen tov 2013. 
Score overige waterflora is matig (2007, 2013, 2015), maar de situatie is in 2018 verbeterd. In 2018 dominantie van lidsteng, hoge bedekkingen. De fosforbelasting is volgens waterbalans hoger dan de toelaatbare belasting (Vollenweider), in het verleden was de fosforbelasting nog vele malen hoger. Verassend genoeg zien we de zeer hoge belasting niet terug in de ecologische toestand in het verleden. Er zijn altijd relatief weinig algen gemeten in de plas.  
<br> De voornaamste bron van fosfor is de uitspoeling uit het park ten noorden van plas. De plas is wel gevoelig voor grondwater en fosforconcentraties in het grondwater nemen toe. Er zijn ook opvallende hoge en toenemende winterpieken in ortho- fosfaat concentraties te zien nabij de waterbodem van de plas. IJzerrijk grondwater bindt fosfor wel in de waterbodem, maar niet al het fosfaat wordt gebonden in de bodem. Er zijn ook vrij hoge concentraties ortho-fosforconcentraties te zien bovenin de plas (vooral in januari). Ook het inlaatwater in de zomer heeft een behoorlijk aandeel in de fosofrbelasting van de plas. De locatie van de inlaat zit nu op een wat ongelukkige locatie; Al het water dat voor de gehele polder Zuid Bijlmer wordt ingelaten stroomt door het park en de plas heen.
De waterbodem vormt op de lange termijn een risico wanneer de waterbodem zuurstofloos wordt. Om het operationeel waterbeheer te optimaliseren moeten we weten welke bron van inlaatwater voorkeur heeft (stedelijk gebied, Gaasp). ";De ESF lichtklimaat vormt geen probleem:  Submerse vegetatie op diepte goed in 2018, was matig in 2013 en 2015. Veel boom- en struikopslag langs de oevers. Lichtklimaat is op orde. Er valt meer dan 4% licht op 4 meter waterdiepte. Op 7 meter waterdiepte valt minder dan 4% licht.;De ESF voedselrijkdom van de waterbodem vormt geen probleem. Zandbodem zichtbaar zonder organische sliblaag. Sinds 2018 dominantie van lidsteng (submers). Op grote diepte is de bodem matig voedselrijk (900-2000mg/kg ds). Gegevens voedselrijkdom bodem ondiepe zone (< 6m) ontbreken, zandbodem is wel zichtbaar dus er is geen aanleiding om er vanuit te gaan dat de waterbodem een risico is voor woekerende waterplanten. ;De ESF habitatgeschiktheid vormt een probleem. Emerse vegetatie lijkt qua bedekking achteruit te gaan. (Te) lage bedekking volgens KRW-maatlat al voldoende (5-10%). Veel boom- en struikopslag langs de oevers. Natuurlijk verloop oevers van land naar water ontbreekt door toepassing harde beschoeiing.;Vissen kunnen de plas niet uit, ze worden vermalen in het gemaal. Gemaal is (zeer) visonvriendelijk. Metingen nog in uitvoering in 2019.;Maatlat bedekking submers niet geschikt om effect maaibeheer te beoordelen.  Maaibeheer GGA evalueren. ;Lokaal algenbloei door bladinval. Organische belasting vanuit park, hondenzwemplek, HWA Nellestein, veel boom- en struikopslag langs de oevers.; ;Nu is het gehele EAG de begrenzing. Het achterland, het park, staat in open verbinding en vormt een schuilplaatst voor fauna. Het achterland heeft echter geen eigenschappen van een diepe plas.;Amsterdam;Noord-Holland;;;;;LM_20190916;
Ouderkerkerplas;NL11_3_3;2;1;3;3;2;1;1;1;;;;Deze kwaliteit is herstellend na maatregelen. Sinds 2018 wordt er weer vegetatie gevonden in de plas. De plas is een heldere diepe plas geworden. De emerse vegetatiegemeenschap is niet goed ontwikkeld. De plas blijft gevoelig voor fosforrijkgrondwater en zal weer omslaan wanneer er wordt gestopt met het toedienen van zuurstof in de waterbodem.;;Het waterpeil in de plas en grondwaterpeil rond de plas zou continu bemeten moeten worden: om te zien hoeveer de plas uitzakt en wanneer er aanvoer is van voedselrijk grondwater. Jaarlijkse evaluatie van zuurstoftoediening met NUON. Wie is hier contactpersoon?;De ESF productiviteit water is nu goed, maar staat onder druk:  Belasting is hoog geweest in 1988/89 doordat toplaag ontwikkeling recr.plas in de plas is gegooid. Dit leverde een bodemnalevering op, waar nu een deksel op ligt door zuurstof Nuon. Risico is de toename voedselrijke kwel bij peil uitzakken. Voedselrijke kwel komt binnen in het hypolimnion en wordt vastgelegd aan ijzer, dus mogelijk wordt de P belasting uit kwel overschat. Ook in droge tijd, als het waterpeil ver uitzakt, verdient kwel de voorkeur als waterbron. Fosfor wordt nu vastgelegd in de waterbodem, maar zodra de zuurtoftoediening uit gaat loopt de plas weer risico. De vraag is of de zuurstoftoediening door iets duurzamers vervangen kan worden, dat fosfor permanent vastlegt. ;De ESF lichtklimaat vormt geen probleem: Doorzicht is toegenomen in de laatste jaren door een afname van algen. De afname van algen wordt veroorzaakt door de vastlegging aan ijzer onder de zuurstofrijke condities. Fosfor en ortho-fosfor concentraties zijn nu vergelijkbaar met die in andere diepe plassen, zoals de Gaasperplas. Het risico op epifyten (die het licht uitdoven) is daarmee klein.;De ESF voedselrijkdom van de waterbodem vormt een probleem:  De bodem was een probleem vanwege zuurstofloosheid (eigenlijk meer esf3).;De ESF habitatgeschiktheid vormt een probleem. Brasemgedomineerde visstand: herstel verwacht als vegetatie zich herstelt. ;De ESF verspreiding staat onder druk: De plas is volledig geisoleerd, wat een probleem kan zijn voor aal. Voor andere soorten wordt verwacht dat verspreiding geen probleem is in de Ouderkerkerplas.; ;De ESF organische belasting vormt geen knelpunt voor de kwaliteit van het watersysteem. ; Koper overschreed in eerdere jaren, maar laat sinds 2016 geen overscheidingen meer zien.;Geen herbegrenzing nodig.;Ouder-Amstel;Noord-Holland;;;Evaluatie maatregel koudewinning en O2 toedienen, Bware.;;LM_20190916;
Vinkeveense plassen;NL11_3_4;2;1;1;3;3;1;1;1;;;;De oorzaak van deze kwaliteit is PM.;;;"De ESF productiviteit water is nu goed, maar staat onder druk: Chlorofyl-A concentraties liggen praktisch altijd onder de detectiegrens. Alleen in de kleine plas zijn nog algenbloeien te meten. In 2018 zijn dit blauwalgen. In de jaren hiervoor lijken het vooral diatomeeen. Nog te hoge fosforbelasting in de kleine plas; optimalisatie (onderhoud en winterdefosfateren) van waterstromen en defosfatering nodig. Toename van fosforbelasting door lozing van ongezuiverde (illegale ) afvalwater is een risico door de nieuwe bestemming van legakkers.";De ESF lichtklimaat vormt geen probleem:  Er valt in een groot deel van het areaal tot 7 meter diep voldoende licht op de bodem. In de kleine plas is er lokaal onvoldoende licht door algen in combinatie met grote waterdiepte.;De ESF voedselrijkdom van de waterbodem vormt geen probleem. Lokaal wel hoge bedekking van bronmos. Het grootste areaal van de plassen heeft een matig voedselrijke waterbodem (800 mg/kgdg). Alleen lokaal in het westen is er sprake van een mogelijk voedselrijke waterbodem.;De ESF habitatgeschiktheid vormt een een probleem: De bedekking met oever en emerse planten is laag in de Zuid- en Kleine plas en de plassen hebben slechts een klein areaal tussen 0 en 1 meter waterdiepte, waar emerse vegetatie zich goed kan ontwikkelen. Schaduw door bomen, het type beschoeiing en afkalving van oevers in combinatie met een zeer beperkt ondiep areaal beperkt de ontwikkeling van emergente (riet, egelskop) vegetatie. Goed beheer van legakkers en bescherming van oevers/legakkers is belangrijk. Het dumpen van tuinafval in de oevers van de legakkers vormt een risico voor ESF 4. Soms gebeurt dit met de bedoeling om afslag tegen te gaan. Handhaving hierop is mogelijk, maar handhavers moeten er wel ‘oog voor hebben’.;Kwabaal komt voor in Vinkeveen. Voor de paling vormt gemaal de Ruijter een migratieknelpunt. Voor kwabaal is het van belang dat er voldoende verbinding is tussen ondiep water in de tussenboezem en het diepe water van de plas.; Vraat door ganzen kan een mogelijk knelpunt vormen voor de ontwikkeling van oevervegetatie.; Geen overstorten, bomen rond de plas, voldoende zuurstof nabij de waterbodem.; Mogelijk lokaal risico nabij jachthaven.;Geen herbegrenzing nodig.;De Ronde Venen;Utrecht;;;Evaluatie maatregelen tussenboezem Vinkeveen, 6 januari 2017;;LM_20190916;
Spiegelplas;NL11_3_6;3;3;2;3;3;3;3;1;;;;De oorzaak van deze kwaliteit is de hoge voedselrijkdom van het waterlichaam. De toestand van de waternatuur is de afgelopen jaren achteruit gegaan. De achteruitgang is met name toe te schrijven aan de emerse planten en de soortensamenstelling van onderwaterplanten. Uit de analyse blijkt dat de Spiegelplas op dit moment nog helder is, maar een zeer hoge fosfaatbelasting heeft. Een grote hoeveelheid quagga-mosselen filtert het water en dat verklaart de helderheid. De plas is aan het ‘opladen’ en de verwachting is dat het water in de komende jaren zal omslaan van helder naar troebel. Om dat te voorkomen blijkt uit de analyse dat het nodig is alle grote fosfaatbronnen (inlaatwater, water uit het landbouwgebied in de Spiegelpolder, water uit stedelijk gebied van Nederhorst den Berg, lozingen uit recreatievaart)  aan te pakken. ;;;"De ESF productiviteit water vormt een probleem. Het overheersende probleem voor de natuur in de Spiegel- en Blijkpolder is de hoeveelheid voedingsstoffen, met name fosfaat, die het gebied binnenkomt. Diepe plassen zijn hiervoor zeer gevoelig. De belangrijkste bronnen van fosfaat in de Spiegelplas zijn: het water vanuit het land dat aan de plas grenst, de inlaat uit de Blijkpolder en de inlaat vanuit de Vecht, via de Zanderijsluis.
Dat de plas nog steeds helder is komt door een enorme hoeveelheid quagga-mosselen in de plas: naar schatting ca. 11 miljard (Lit.1). Zij filteren de algen uit het water. Toch loopt de Spiegelplas een groot risico om binnenkort ‘om te slaan’ van helder naar troebel. Het is niet duidelijk hoe lang de mosselen de algen nog ‘aankunnen’. Zeker omdat er in slib in de luwte aan de westzijde, in de jachthavens en in de diepe delen van de plas veel voedingstoffen zitten die naar verwachting vrij gaan komen. ";De ESF lichtklimaat vormt een probleem. Op grote delen van het begroeibaar areaal is de bedekking met submerse waterplanten laag. De biodiveristeit van waterplanten is laag in de Spiegelplas omdat veel korstvormige algen (perifyton) het lichtklimaat voor waterplanten belemmeren. Er zijn weinig algen en het doorzicht is groot in de plas (er valt meer dan 4% licht op de waterbodem).  De pH is hoog in de plas en bicarbonaat vrij laag (122 mg/l): dit indiceert een hoge primaire productie. Deze productie komt niet door zwevende algen, maar door kortsvormige algen op de waterbodem en waterplanten. ;De ESF voedselrijkdom van de waterbodem vormt lokaal een probleem. Plaatselijk in het westen komen woekerende planten (waterpest) voor. Dit is een indicatie van een te voedselrijke waterbodem. In diepere delen van de plas is de waterbodem voedselrijk, maar in de ondiepe zone vormt de waterbodem geen aanleiding om woekerende waterplanten te verwachten.;De ESF habitatgeschiktheid vormt een probleem: In de Spiegelplas is er weinig rietvegetatie door weinig onderhoud aan de oevers. Daardoor is er veel boomopslag. Dit geeft veel bladval en beschaduwing en daardoor groeit het riet niet goed. Bij weinig riet treedt makkelijk oevererosie op en ontbreekt een belangrijke habitat voor fauna. Macrofauna scoort wel goed op de KRW maatlat, maar de emerse vegetatiebedekking neemt mogelijk af. Door de hoge productie van algen en woekerende planten blijft er te weinig koolstof over voor planten van schoon water, zoals kranswieren. ;Kwabaal is verdwenen en er wordt weinig schieraal gevangen. Gemaal Spiegelpolder vormt een bedreiging voor uittrekkende vis, in het bijzonder voor de volwassen aal die naar zee wil trekken. Een deel van de aal en overige vis overleeft het gemaal niet. Voor dispersie van andere soorten  is verbinding tussen Spiegelplas en boezem of Ankeveen niet noodzakelijk. Gebieden zijn voldoende groot voor stabiele populaties.;Sporen van vraat en onvoldoene ontwikkelde emerse vegetatie. Ganzen, meerkoeten zitten herstel in de weg. ; Geen overstorten, niet bijzonder veel bomen met bladinval.; Geen risicogebied voor lozingen. Wel scheepvaart.;Geen herbegrenzing nodig.;Wijde meren;Noord-Holland;;;invullen obv WGP NVP;;LM_20190916;
Wijde Blik;NL11_3_7;2;1;1;2;1;1;1;1;;;;"De oorzaak van deze kwaliteit is de iets te hoge belasting met voedingsstoffen. Na een aantal jaren waarin de fosfaatbelasting sterk is gedaald (waarschijnlijk vooral door het baggeren en daarmee schoner worden de Vecht) lijkt er nu weer een trend zichtbaar van toename van de fosfaatbelasting. Scheepvaart heeft ook een negatief effect op de ecologische toestand. Als de fosfor in het inlaatwater van de Wijde Blik blijft stijgen en het aantal vaarbewegingen boven de ondiepere zones toeneemt dan komt de ecologische toestand van de plas in de gevarenzone.  
Naast KRW doelstellingen gelden er voor het Wijde Blik ook aquatische N2000 doelstellingen, waarbij wordt gestreefd naar de uitbreiding van het oppervlakte en verbetering kwaliteit van de habitattypen kranswierwateren, meren met krabbenscheer en fonteinkruiden en voldoende waterriet voor vogels als de Grote Karekiet en Woudaap. (winnie klopt dit ??)";;;De ESF productiviteit water staat onder druk. Chlorofyl-a neemt sinds 2014 af en scoort de laatste jaren voldoende op de KRW maatlat. Toch bloeien (blauw)algen nog steeds af en toe in de zomer.  De plas is sinds 2014 lager belast door de verbeteringen in kwaliteit van de Vecht. De fosforbelasting ligt nog net iets boven de toelaatbare fosforbelasting. Deze belasting wordt voornamelijk veroorzaakt door de inlaat van Vechtwater (35%) en water uit het oostelijk deel van het Hilversums kanaal (65% - Kerkelanden/Haven Hilversum/ 't Hol). De kwaliteit van de Vecht is de afgelopen jaren verbeterd, maar laat vanaf 2017 weer een lichte stijging zien in fosfor. Een aandachtspunt is ook de potentiele extra belasting vanuit de Vecht door de vispassage tussen het Hilversums kanaal en de Vecht. De waterbodem levert alleen lokaal na in diepere delen van de plas. Deze voedingstoffen blijven in de zomer onder de spronglaag en zijn daarmee niet beschikbaar voor algen. In het Hilversums kanaal is het niet duidelijk wat de waterbodem doet, mogelijk levert deze na. ;De ESF lichtklimaat vormt geen probleem: Er staan onderwaterplanten tot 6.5 meter in 2016 en 2017 en 4.5 in 2018. Er valt voldoende licht op de bodem voor waterplanten. Concentraties ortho-fosfaat zijn laag in de plas en de biodiversiteit hoog, dus het lichtklimaat voor vegetatie wordt niet belemmerd door perifyton.;De ESF voedselrijkdom van de waterbodem vormt geen probleem: Er worden nergens woekerende waterplanten waargenomen. De waterbodem vormt nergens een risico voor woekerende waterplanten, omdat deze niet voedselrijk is. Er is geen sprake van sulfide of ammonium toxiciteit.;De ESF habitatgeschiktheid is nu goed, maar staat onder druk: Emergente vegetatie is vooral goed ontwikkeld in het zuidwesten van de plas en is erg gevoelig voor een verhoogd aantal vaarbewegingen. Meer vaarbeweging betekent meer golfslag en een groter risico op vernieling wanneer er door de vegetatie wordt gevaren. In de MER wordt het effect van meer vaarbewegingen beoordeeld.;De ESF verspreiding voldoet omdat de doelsoorten in de omgeving aanwezig zijn en er ook kunnen komen. ;De ESF verwijdering is geen probleem: Er wordt niet op grote schaal gemaaid in de plas en graas door ganzen of kreeft is geen probleem in de plas.;De ESF organische belasting vormt geen knelpunt voor de kwaliteit van het watersysteem. ;"Macrofauna scoort goed; ook soorten die gevoelig zijn voor toxines. Er is geen reden om aan te nemen dat de plas te hoog belast is met toxines. ";Geen herbegrenzing nodig.;Stichtse Vecht en Wijdemeren;Noord-Holland en Utrecht;;;18-10-22 Hoofdlijnen en conclusies systeemanalyse Wijde Blik.docx;Natuurmonumenten.;LM_20190916;
