OWMNAAM;OWL;ESF1;ESF2;ESF3;ESF4;ESF5;ESF6;ESF7;ESF8;Karakterschets;Doelen;Toestand;Oorzaken;Maatregelen;MonitoringAnalyseWensen;ESF1;ESF2;ESF3;ESF4;ESF5;ESF6;ESF7;ESF8;MotiveringBegrenzing;Gemeenten;Provincies;Eigenaren;Status;Literatuurverwijzing;Gebiedspartners;aangepast;Opmerking
Grote Maarsseveense plas;NL11_3_8;2;2;1;3;1;1;2;1;;;;De oorzaak van deze kwaliteit is PM.;;Mogelijk bodemonderzoek om te kijken hoe zuurstof en fosfor zich gedraagd nabij de waterbodem en in te schatten of het afdekken of baggeren zinvolle maatregelen kunnen zijn.;De ESF productiviteit water is nu goed, maar staat onder druk:  Chlorofyl-A concentraties liggen praktisch altijd onder de detectiegrens. Achteruitgang in KRW score op de vegetatiemaatlat. In 2005-2008 en 2017 zijn pieken te zien in het fosforgehalte in de plas. De actuele belasting is laag 0.8 mg/m2/d. De zuurstofconcentraties nabij de waterbodem zijn zeer laag, waardoor de waterbodem fosfor nalevert. De belasting vanuit de kwel is vele malen hoger dan de belasting vanuit de Maarsseveense zodden.;De ESF lichtklimaat voldoet, maar staat onder druk. Vertical extinctie neemt iets toe, doorzicht neemt zichtbaar af tussen 2014 en 2019. Er valt wel meer dan 4% licht op 4+ meter waterdiepte. De vestigingsdiepte van waterplanten is groot > 7 meter. Het lichtklimaat is op dit moment op orde: er valt voldoende licht op diepte en er is weinig aangroei van epifyten. ;De ESF voedselrijkdom van de waterbodem vormt geen probleem;De ESF habitatgeschiktheid vormt een probleem: Oevers zijn beschoeid of stijl, veel struiken langs de oever.;Vis kan er komen (vispasseerbare stuw tussen zodden en kl. Plas).; ; Geen signalen voor zuurtsofgebrek in epilimnion, wel in hypolimnion.; ;Geen herbegrenzing nodig.;Stichtse Vecht;Utrecht;;;;;LM_20190916;
Waterleidingplas;NL11_3_9;1;1;1;1;1;1;1;1;;;;De oorzaak van deze kwaliteit is PM.;;;De ESF productiviteit water voldoet:  Chlorofyl-A concentraties liggen praktisch altijd onder de detectiegrens. Belasting < kP. De meting van effluent is niet representatief voor inkomende fosforconcentraties, omdat veel van het totaal-P in de plas aan ijzergebonden is en bezinkt.;De ESF lichtklimaat vormt geen probleem: Doorzicht is 6 meter. Er staat tot 6.5 m waterplanten. Er valt voldoende licht tot 6.4 meter meer dan 4% licht op de bodem, dat is 60% van het oppervlak van de plas.;De ESF voedselrijkdom van de waterbodem vormt geen probleem. Soms wel hoge vegetatiebedekking, met een hoge alfa diversiteit. O.a. van kranswieren en fonteinkruiden. ;De ESF habitatgeschiktheid vormt geen probleem: Emerse vegetatie scoort goed op de maatlat, dankzij verjagen ganzen. ;Geen kwabaal en paling aanwezig. Alle soorten kunnen er komen. Weg van en naar de Vecht is voor vis passeerbaar. Gebieden voldoende groot voor stabiele populaties.;Emerse vegetatie scoort goed op de maatlat, dankzij verjagen ganzen. Vrij veel basen aanwezig in het water, omdat de Bethunepolder een belangrijke bron is. Ganzen zijn een probleem en dit is te zien door vraatsporen, meerkoeten en kreeften zitten herstel mogelijk in de weg. ;Zuurstofdynamiek ok, veel van het stikstof is aanwezig in de vorm van nitraat. Geen overstorten, bomen rond de plas, voldoende zuurstof nabij de waterbodem.;SIMONI score < 1 (0.3), dus er is geen toxisch risico voor flora en fauna. Geen probleem.;Geen herbegrenzing nodig.;Wijdemeren;Noord-Holland;;;Stand van zake ESFs, 2018;;LM_20190916;
Naardermeer;NL11_4_1;2;2;1;3;2;3;1;1;Het Naardermeer is een ondiepe plas: de enige in het beheergebied van AGV die van nature is ontstaan. Het is het oudste beschermde Nederlandse natuurreservaat. Het Naardermeer ligt op de overgang van de Utrechtse Heuvelrug (zand) naar het lager gelegen veenweidegebied (klei en veen). Het bestaat uit een plassengebied met riet, veenmosrietlanden, trilveen, hooiland en moerasbos. Kwel vanuit de Utrechtse Heuvelrug draagt bij aan het bijzondere karakter van de natuur. Molen De Onrust in het noordwesten van het gebied zorgt voor de bemaling van het Naardermeer. De bemaling is hierdoor windafhankelijk. Water wordt voornamelijk in het zomerhalfjaar ingelaten via een defosfateringsintsallatie. ;Het KRW-doel is het realiseren van een goede ecologische toestand voor Grote ondiepe gebufferde plassen (M14), met scores voor fytoplankton, macrofauna, waterflora en vis in het groen. De Natura2000-doelen zijn gericht op waardevolle onderwatervegetaties in de plassen en zeldzame moerasvogels. ;De actuele toestand in het Naardermeer is niet overal stabiel en verschilt tussen de verschillende deelgebieden in het meer. In het Bovenste Blik is de toestand minder goed dan in de rest van het Naardermeer en in het gehele meer scoort de vegetatie daardoor minder goed in de laatste drie meetjaren (2016, 2017 en 2018). De ecologische toestand van het Bovenste Blik verschilt per jaar en varieert tussen een (blauw)algen gedomineerd systeem zonder planten en een systeem met woekerende waterplanten en zeer lokaal kranswieren. De bedekking en ruimtelijke spreiding van kranswieren en fonteinkruiden laten in het hele meer een afname zien van het areaal waar deze voorkomen. De hoeveelheid algen is toegenomen, en de biodiversiteit en aantal individuen van macrofauna is afgenomen gedurende de afgelopen 10 jaar.  Het grootste deel van het Naardermeer is helder en rijk aan kranswieren, maar de vegetatie is vaak bedekt is met een laag perifyton, die de lichtuitdoving voor waterplanten in het meer verdubbeld. Ook is de biomassa van brasem hoog en zijn dikke, zwavelrijke sliblagen aanwezig in het meer. Hoewel de brasembiomassa afneemt en het slib redelijk voedselarm is maken deze factoren het systeem kwetsbaar voor een verhoging van de fosforbelasting door droogte, de hoeveelheid en voedselrijkdom van het inlaatwater, hoge temperaturen en verhoogde uitspoeling van voedingstoffen uit de percelen. ;"De oorzaak van de matige kwaliteit is met name een te hoge belasting met voedingsstoffen en de waterbodem in het Bovenste Blik. Het voedselrijke water uit het voormalig agrarisch gebied de Meerlanden (Naardermeer-oost) watert af via het Bovenste Blik en vormt daarmee een grote bron van voedingstoffen. Ten Noorden van het spoor vorm inlaatwater een aanzienlijk deel van de belasting. Het rendement van de defosfateringsinstallatie is de afgelopen jaren laag geweest en de inlaatcapaciteit onvoldoende in droge zomers. Hierdoor is de belasting vanuit het inlaatwater ten Noorden van het Spoor hoger geweest de afgelopen jaren. Ook is de biomassa van brasem hoog en zijn dikke, zwavelrijke sliblagen aanwezig in het meer. 
Mogelijk leveren ruiende en broedende ganzen ook een bijdrage aan de fosforbelasting in het Bovenste Blik. 
Een mogelijke bedreiging voor de goede ecologische toestand is de rode Amerikaanse rivierkreeft die in het Naardermeer voorkomt.";Veel maatregelen zijn gericht op het verlagen van de fosforbelasting, bijvoorbeeld  door Het afkoppelen van de Meerlanden, waarbij het water uit de Meerlanden via de Hilversumse Bovenmeent wordt afgevoerd. Ook het baggeren van de waterbodem (in opdracht van Natuurmonumenten) draagt bij aan het verbeteren van de ecologische toestand in het Bovenste Blik. Voor het gebied ten Noorden van het spoor is het vooral van belang de volledige peilmarges optimaal te benutten en te zorgen  dat de defosfateringsinstallatie optimaal functioneert. ;;"Productiviteit water staat onder druk: (blauw)algen bloeien af en toe in de zomer in het Bovenste Blik. De oorzaak van een slechte biologische toestand in het Bovenste Blik is een te hoge belasting met voedingsstoffen en de waterbodem. Het voedselrijke water uit het voormalig agrarisch gebied de Meerlanden watert af via het Bovenste Blik en vormt daarmee een grote bron van voedingstoffen. In de overige deelgebieden is het water helder, maar is er risico op een omslag van naar een troebele toestand. De ecologische toestand laat op dit moment al signalen zien van achteruitgang in biodiversiteit. 
Ten Noorden van het spoor vorm inlaatwater een aanzienlijk deel van de belasting. In Veertigmorgen en het Bovenste Blik zijn ook de percelen een grote bron van voedingstoffen. Er bestaat er een potentieel risico op uitspoeling van fosfor uit percelen bij het verhogen van waterpeilen in de omgeving ten behoeve van terrestrische natuur. Poep van aalscholvers en ganzen zijn ook een fosforbron. Deze vogels rusten en nestelen steeds meer in het gehele gebied.";Lichtklimaat vormt nog geen probleem, maar staat onder druk. Er valt voldoende licht op de bodem voor waterplanten. De vegetatie is vaak bedekt is met een laag perifyton, die de lichtuitdoving voor waterplanten in het meer verdubbeld. Ook is de biomassa van brasem hoog. Dit zijn factoren die het lichtklimaat kunnen belemmeren en een aandachtspunt in het Naardermeer. Ook bestaat er een potentieel risico op uitspoeling van humuszuren uit percelen bij het verhogen van waterpeilen in de omgeving ten behoeve van terrestrische natuur.;Voedselrijkdom van de waterbodem vormt geen probleem. De waterbodem vormt alleen in het Spookgat een risico voor woekerende waterplanten, omdat deze voedselrijk is. Er zijn geen hoge sulfide en ammoniumgehalte gemeten, maar wel hoge gehalte zwavelgehalten in het poriewater. ;"Habitatgeschiktheid vormt een probleem. Emergente vegetatie is de afgelopen jaren minder dicht (zie ESF verwijdering). Bovendien is weinig koolstof aanwezig in de plas. De toenemende hoeveelheid algen leidt bovendien tot een hoge pH in het meer en dit resulteert weer in een geringe beschikbaarheid van koolstof in de vorm van CO2, wat de soortensamenstelling van waterplanten nadelig kan beïnvloeden. Soorten van voedselrijk water kunnen daardoor beter groeien dan indifferente soorten (zoals de kranswieren). Ook is het systeem gevoelig voor een verdere afname van habitatkwaliteit wanneer de hoeveelheid voor planten beschikbaar koolstof en calcium verder afnemen. 
Door een verhoging van het maximum peil met 10 cm en het beperken van de oppervlaktewateraanvoer naar de kern van het Naardermeer zou het aandeel regenwater in deze gebieden kunnen toenemen. Dit kan ertoe leiden dat de concentraties aan calcium en bicarbonaat (basen) in het oppervlaktewater afneemt als gevolg van verdunning. ";Verspreiding staat onder druk: er zit behoorlijk wat schieraal (geslachtsrijpe aal) in het Naardermeer, die uit wil trekken naar zee. De molen is visveilig, maar vormt wel een migratiebarrière voor vis. Het geringe lek van het scheprad is voor vislarven (in het bijzonder glasaal) die het Naardermeer in willen trekken een belangrijke passeermogelijkheid. De defosfatering is niet visveilig voor vis die het Naardermeer in wil trekken. Voor de visstand in het Naardermeer zijn intrekmogelijkheden vooralsnog niet vereist en voor volwassen bodemwoelers (brasem/ karper) zijn ze ook niet gewenst, in verband met de KRW-visdoelen.;Verwijdering is een probleem: Vraat van riet door, met name, grauwe ganzen vormt een urgent probleem in het Naardermeer. Ganzenvraat is een belangrijke oorzaak van de achteruitgang van riet dat als (mogelijk) broedgebied dient voor onder andere purperreiger, snor en grote karekiet. ;"Organische belasting vormt geen knelpunt voor de kwaliteit van het watersysteem. Er zijn geen lozingen aanwezig van organisch materiaal en het beheer- en onderhoud in het Naardermeer wordt op een voldoende natuurvriendelijke wijze uitgevoerd.
";"Toxiciteit vormt geen probleem. Macrofauna scoort goed; ook soorten die gevoelig zijn voor toxines.  Bioassays laten geen effect zien.";Geen herbegrenzing nodig.;Gooise Meren, Hilversum en Weesp;Noord-Holland;Natuurmonumenten;Natura2000-gebied ;Ecologische waterkwaliteit Naardermeer, Moria en Diek, 2019;;LM_20192611;
Loosdrechtse plassen;NL11_5_1;3;3;3;3;2;3;1;2;Het hele Naardermeer heeft de status Natura2000-gebied en is in eigendom van Natuurmonumenten. Molen De Onrust in het noordwesten van het gebied zorgt voor de bemaling van het Naardermeer. De bemaling is hierdoor windafhankelijk. ;Het KRW doel is het realiseren van een goede ecologische toestand voor Matig grote, ondiepe laagveenplassen (M27), met scores voor fytoplankton, macrofauna, waterflora en vis in het groen. De Natura2000-doelen zijn gericht op uitbreiding van het oppervlakte en verbetering kwaliteit van de habitattypen kranswierwateren, meren met krabbenscheer en fonteinkruiden en voldoende waterriet voor moerasvogels zoals de Grote Karekiet en Woudaap. Ook leveren de Loosdrechtse plassen water aan Natura2000 gebieden met een doelstelling voor mesotrofe verlanding, zoals trilveen en veenmosrietland. ;Dit komt met name vanwege een overmaat aan brasem. De emerse vegetatie gaat de laatste jaren achteruit in bedekking laat een achteruitgang zien in aantallen en soortenrijkdom. De hoeveelheid en soortenrijkdom van onderwaterplanten neemt toe vanaf 2010. Alleen in de Tienhovense plassen gaat de soortensamenstelling van waterplanten achteruit. ;Mogelijk leveren ruiende en broedende ganzen ook een bijdrage aan de fosforbelasting in het Bovenste Blik.;Veel maatregelen zijn gericht op het reduceren van de fosforbelasting om de algenbloei te voorkomen, bijvoorbeeld: het defosfateren van overschotwater uit de Bethunepolder dat via de Waterleidingplas en de Loenderveenseplas Oost naar de Loosdrechtse plassen stroomt. Ook bouwt AGV verschillende defosfateringsinstallaties in het Ster- en Zoddengebied, waardoor er voedselarmer water vanuit het oostelijk gebied naar de Breukeleveense plas en de Loosdrechtse plassen gaat stromen. Naar verwachting komt de fosforbelasting daarmee dicht bij de kritische grens te liggen. Daarnaast zijn er ook maatregelen om de dynamische sliblaag op de overgang van bodem naar water te beteugelen en opwerveling te voorkomen. Ook zijn er maatregelen gericht op het vergroten van de invloed van de resterende kwel, om de effecten van verzuring door neerslag en stikstofdepositie te compenseren.;Jaarrond monitoren van fosfor en algen in t Achteraf.;Productiviteit water vormt een probleem. Door een te hoge fosforbelasting vindt er algenbloei plaats in alle plassen (Kievitsbuurt, Vuntus, Breukeleveen, 1 tot 5e plas en Tienhovense plassen). Deze fosforbelasting komt zowel vanuit de bodem als van buitenaf. Zo spoelt er veel fosfor vanuit (voormalige) landbouwpercelen en vanaf verhard oppervlak het water in. Door verschillende processen kan fosfor vanuit de waterbodem beschikbaar komen in het oppervlaktewater (P-nalevering).  De actuele P-nalevering (datgene wat momenteel vrijkomt) en potentiële nalevering (datgene wat vrij kan komen) kan worden geschat op basis van metingen van fosfor, ijzer en zwavel in het poriewater en de toplaag van de waterbodem. In de Vuntus wordt een beperkte actuele nalevering vanuit de bodem berekend, maar wel een zeer hoge (10 mg/m2/dag) potentiële nalevering. De waterbodem van de Vuntus vormt dus een risico voor nalevering van fosfor. De fosforbelasting is hoger dan de draagkracht van het systeem. ;Lichtklimaat vormt een probleem in alle deelgebieden. Er zijn bijna geen ondergedoken waterplanten. De oorzaak van de troebelheid van het water is in zwevende deeltjes. Dit bestaat uit algen en door wind en bodemwoelende vissen opgewerveld bodemmateriaal. De opwerveling door boten blijkt in vergelijking met de opwerveling door wind gering te zijn. In de zomermaanden is de concentratie zwevend stof hoger dan in de winter. Dit blijkt niet het gevolg te zijn van een hogere algengroei, maar van actievere bodemwoelende vis (brasem). In Tienhoven zorgen ook drijfbladplanten dat er minder licht op de bodem valt. In de wat ondiepere zones van de Loosdrechtse plassen is het lichtklimaat bijna voldoende voor de ontwikkeling van waterplanten.  ;Productiviteit bodem vormt een probleem, met name in de Vuntus en de Tienhovense plassen.  De waterbodem in plas 1 t/m 5 en Breukeleveen is voedselarm. In de Vuntus bestaat dus kans op woekerende waterplanten en kan worden overwogen om te gebaggeren vanuit waterkwaliteitsoverweging. ;Habitatgeschiktheid vormt een probleem. De (deels) ondergedoken vegetatie is vooral in het westelijke gedeelte van de plassen en de Kievitsbuurt minder goed ontwikkeld. Er is meer stevig waterriet nodig voor moerasvogels zoals grote Karekiet en Woudaap. De structuur (vegetatie) in de ondiepe zone en zone tot 2 meter waterdiepte is van groot belang voor vis, vogels en macrofauna. De 1e t/m 5e plas en Kievitsbuurt zijn vrij diep en grote oeverlengten zijn bedekt met steigers, waardoor het areaal dat geschikt is voor (deels) ondergedoken vegetatie relatief klein is. Bij aanleg van oevers is een flauw talud van 1:15 van belang voor een goede rietontwikkeling. De huidige taluds zijn vaak veel te steil. Ook zijn vooroevers waarschijnlijk minder geschikt in deze plas, omdat zij veel slib invangen en daardoor niet altijd een goed habitat zijn voor half-ondergedoken vegetatie, maar wel voor onderwaterplanten. ;Verspreiding staat onder druk. Doelsoorten zijn in de omgeving aanwezig en kunnen er ook komen. Schieraal (geslachtsrijpe aal) kan de plas niet veilig uit komen om naar zee te trekken. De vijzel van gemaal Loosdrecht is niet 100% visveilig, maar de schade van dit type pomp is minder groot dan bij centrifugaalpompen. Glasaal (jonge aal) kan alleen via de Kraaienestersluis, Weersluis en Mijndense sluis naar de plassen migreren, maar het is niet bekend of er aanbod van glasaal is bij de verschillende inlaten van de plas. Waarschijnlijk is dat aanbod in de huidige situatie zeer gering, maar ook iets oudere aal uit de Vecht zou via de sluizen de plassen op kunnen trekken.  ;"Verwijdering vormt een probleem. Vraat door ganzen is een knelpunt voor de ontwikkeling van oever- en emerse vegetatie. In de toekomst kan het maaien van de onderwatervegetatie ten behoeve van de vaarrecreatie een probleem gaan geven.  
";Organische belasting vormt geen probleem. ;Toxiciteit vormt lokaal een probleem. In havens en nabij het legakkerherstel in de Kievietsbuurt is een hoge toxische druk gemeten. Bij het zwemstrand in de Loosdrechtse plassen is de toxische druk niet te hoog.  ;Het opsplitsen van dit waterlichaam is gewenst omdat ze eigenlijk bestaan uit meer systemen. Deze deelgebieden functioneren anders en hebben vaak verschillende watertypen. Om de huidige toestand en de verbetering of achteruitgang hierin te zien zijn nu kunstgrepen nodig (analyse en toetsing), die tijd kosten en om uitleg vragen. De inspanning qua monitoring hoeft niet gewijzigd te worden, in ieder geval niet voor wat betreft de verplichte monitoring. De inspanning voor de wat betreft maatregelen wordt ook niet anders. De richtlijn stelt: “Oppervlaktewateren kleiner dan 50 ha worden in principe niet als waterlichaam aangewezen, tenzij het waterlichaam onderdeel uitmaakt van waterafhankelijke beschermde gebieden, of onderdeel uitmaakt van het specifieke gebiedsgerichte beleid (een reden om gebieden van verschillende terreinbeheerders niet samen te voegen).” En “ Kleine wateren met een aantoonbare ecologische betekenis, hetzij van belang voor omliggende waterlichamen, hetzij van belang als onderdeel van beschermde gebieden, zouden wel als aparte waterlichamen moet worden onderkend.” Loosdrecht is een Natura2000 gebied met aantoonbare ecologische betekenis. ;Stichtse Vecht en Wijdemeren;Noord-Holland en Utrecht;Natuurmonumenten en privaat;Natura2000-gebied;Consequenties gedefosfateerd surplus Bethunewater via Loenderveense Plas (Schep, 2018), Memo waterkwaliteit en ecologie (van Alphen, 2016);;LM_20191126;"Er zijn op dit moment delen van het achterland (weerslootgebied) bij Breukeleveen die actief worden vernat, mogelijk spoelen hier veel voedingstoffen uit en is dit een druk voor de plassen. Ook het uitspoelen van fosfor uit bagger(depots) en is een risico voor de plassen. 
Baggeren kan ook de lokale kwel richting het Hol vergroten, maar er bestaat wel een risico voor dat dit leidt tot extra waterinlaat en fosforbelasting van de Loosdrechtse plassen zelf.
"
Loenderveen oost;NL11_5_3;2;2;1;2;1;1;1;1;;;;Een mogelijke bedreiging voor de goede ecologische toestand is de rode Amerikaanse rivierkreeft die in het Naardermeer voorkomt.;;;"De ESF productiviteit water is nu goed, maar staat onder druk: Incidentele bloeien van blauwalgen. Zoals chroococalen en microcysitis. Er is maar een klein areaal van de plas begroeid en de deelmaatlat bedekking submers gaat achteruit, evenals 'soorten van schoon water'. Draagkracht is zeer laag omdat het ondiep oppervlak van de plas vrij klein is; de verblijftijd van het water in de plas is heel lang.";De ESF lichtklimaat voldoet, maar staat onder druk.  Verticale extinctie is relatief laag. Op 2.3 meter valt <4% licht op de bodem. Zowel de soortensamenstelling als hoeveelheid vegetatie scoren ook onvoldoende.;De ESF voedselrijkdom van de waterbodem vormt geen probleem. Geen woekerende waterplanten. Bodemmetingen zijn matig voedselrijk in de diepte.;De ESF habitatgeschiktheid is nu goed, maar staat onder druk: Vis heeft in de winter emerse vegetatie nodig om te schuilen, omdat er dan geen ondergedoken vegetatie zit. Weinig ondiepe zone voor emerse vegetatie. Weinig calcium en bicarbonaat.; Alle soorten kunnen er komen. ;Emerse vegetatie gaat achteruit sinds 2006. Vraat door ganzen kan een mogelijk knelpunt vormen voor de ontwikkeling van riet.; Geen overstorten, niet bijzonder veel bomen.; Geen risicogebied.;Geen herbegrenzing nodig.;Wijdemeren;Noord-Holland;;;Analyse Wi+Bo voor Defosfateren Bethuneoverschot, ;;LM_20190916;
Terra Nova;NL11_5_4;3;3;0;3;3;1;3;1;;;;De oorzaak van deze kwaliteit is PM.;;;De ESF productiviteit water vormt een probleem. Te veel algen, te hoog belast tov Pk. Water en stoffenbalans bijwerken. Bron uit landbouw lijkt onderschat. Fe-suppletie waarschijnlijk uitgewerkt. Klopt de belasting door ganzen.?;De ESF lichtklimaat vormt een probleem. uitdoving fytobenthos en algen samen is laatste loodje. Nogal veel PO4 (ook een aanwijzing dat P-belasting aan de hoge kant is.vormt veel drijfblad niet ook een licht-ding?  Perifyton rapport opzoeken, kaart drijfblad;Het is onbekend of de ESF productiviteit bodem voldoet.  Is de slib-bodem niet heel geschikt voor gele plomp? Bodemrapport opzoeken, 2013-meting geen nalevering (door ijzer?), P-absoliuut boven 1000.;De ESF habitatgeschiktheid vormt een probleem: bomen lokaal, stijle oevers (van nature)langs de legakkers.; aal-probleem (Tim) ; graas door ganzen significant, graas door meerkoeten aantoonbaar, door kreeften hypothetish.; ; ;Geen herbegrenzing nodig.;Stichtse Vecht en Wijdemeren;Noord-Holland en Utrecht;;;invullen obv analyse Wi+Bo voor Defosfateren Bethuneoverschot;;LM_20190916;
Ster en zodden;NL11_6_1;3;2;1;3;1;3;3;1;;;;De oorzaak van deze kwaliteit is PM.;;;De ESF productiviteit vormt een probleem: Chlorofyl concentraties zijn zowel in de zomer als winter erg hoog. Er staan her en der wel onderwaterplanten. De sloten zijn lokaal in het Weerslootgebied erg ondiep. De belasting met P is te hoog en komt deels uit het stedelijk gebied van Loosdrecht, (deels bemeste) percelen. In EAG11 is de Drechthoeve/ Boomhoek een stuk omgeving met veel recreatie (camping) waar mogelijke bronnen zitten (foutaansluitingen, septic tanks). De waterbodem levert geen voedingstoffen na. Bomen en bladinval in delen. Verhard oppervlak. Uitspoeling uit de perecelen is de bron.;De ESF lichtklimaat vormt lokaal een probleem:  Er valt voldoende licht op de bodem voor plantengroei. In EAG9 het achterland van de Vuntus valt onvoldoende licht op de bodem in de plassen voor plantengroei. Diepte/ doorzicht is op de meeste locaties en momenten >0.6. Wel veel bomen in gebied ten zuiden van de Drecht die mogelijk beschduwen.;De ESF voedselrijkdom van de waterbodem vormt lokaal een probleem:  Cabomba woekert wel her en der, vooral in EAG9. De waterbodem iswel redelijk voedselarm, ook in het Raaislootgebied waardoor er geen risico bestaat voor woekerende waterplanten.;De ESF habitatgeschiktheid vormt een probleem: Macroionen voor petgaten nodig (waarvoor?) middels polderdoorstroomprincipe.;De ESF verspreiding voldoet omdat de doelsoorten in de omgeving aanwezig zijn en er ook kunnen komen.;De ESF verwijdering is een probleem: Vooral vraat door kreeft en vermoedelijk minder door gans.;De ESF organische belasting staat onder druk. Er zijn geen riooloverstorten die lozen op het waterlichaam, maar bladinval is een lokaal pobleem voor oeverzone.  Plaatselijk komt ook ophoping van bladeren en takken in het water voor. Hierdoor ontstaat rotting en voedselrijkdom.;"Macrofauna scoort goed; ook soorten die gevoelig zijn voor toxines. Er is geen reden om aan te nemen dat de plas te hoog belast is met toxines. ";Begrezing overeenstemmen met NNN. Volgende ster bijeenkomst hebben edwin en jw HET OVER eag GRENZEN.;De Bilt, Hilversum, Stichtse Vecht, Wijdemeren;Noord-Holland en Utrecht;;;;;LM_20190916;
