OWMNAAM;OWL;ESF1;ESF2;ESF3;ESF4;ESF5;ESF6;ESF7;ESF8;Karakterschets;Doelen;Toestand;Oorzaken;Maatregelen;MonitoringAnalyseWensen;ESF1;ESF2;ESF3;ESF4;ESF5;ESF6;ESF7;ESF8;MotiveringBegrenzing;Gemeenten;Provincies;Eigenaren;Status;Literatuurverwijzing;Gebiedspartners;aangepast;Opmerking
Botshol;NL11_7_1;3;3;2;3;1;3;1;1;;;;"De oorzaak van deze kwaliteit is de hoge voedselrijkdom van het waterlichaam. De afgelopen jaren is een teruggang in soorten en bedekking van de ondergedoken watervegetatie te zien. In 2017 en 2018 is dit uitgemond in een toestand waarin kranswieren en andere submerse planten helemaal weg zijn. Het terugveren naar een waterplantenrijk ecosysteem, dat voorheen steeds plaatsvond na een aantal droge jaren met een lagere belasting met voedingstoffen, blijft uit. Verschillende factoren kunnen goede jaren enigermate verstoren: redelijk veel poepende vogels, flexpeil, drainage veenpercelen, graafactiviteit tbv. natuurherstel (mogelijke effecten van grondverzet), minder effectieve defosfatering, niet werkende isolatie Kloosterkolk. 
Het doel is nu lager dan de toestand in goede jaren. Dit klopt niet?";;Het waterpeil in het aangrenzende moerasgebied moet worden geregistreerd om te bepalen of de Kloosterkolk haar wateroverschot via dit gebied en polder Nellestein af kan voeren.;"De ESF productiviteit water vormt een probleem. De ineenstorting van de waterhabitats is in 2012 begonnen, vanaf 2014 zijn bijna alle waterplanten weg.  De directe oorzaak is vertroebeling van het water, vooral veroorzaakt door een toename aan zwevende algen. In 2019 zien we tot juni geen algen meer. In de periode 2012-2018 is brasem toegenomen van 20 naar 60 kg/ha. De externe belasting met fosfaat ligt rond de draagkracht. Op basis van de onderscheiden P-belastingen: de meteorologie veroorzaakt goede en slechte jaren. Recente jaren hebben al een tijdlang erg natte winters / ontberen een droge reeks.  Er zijn ook andere bronnen van fosfor: vogels, veenoxidatie door flexpeil, drainage veenpercelen, graafactiviteit tbv. natuurherstel, minder effectieve defosfatering, niet werkende isolatie Kloosterkolk. 
Erosie door het oxideren van veen bij een laag waterpeil, leidt tot een hoge baggeraanwas en nalevering uit de waterbodem. Petgaten graven was goed (minder veenoppervlak weegt op tegen meer drainage); Drainage (smallere percelen, begreppeling) is een risico doordat er minder perceelswater afstroomt naar het grondwater en dus meer af- en uitspoeling plaats vindt naar het oppervlaktewater; Graafactiviteit ten behoeve van natuurherstel en –verjonging is een tijdelijk risico (voor een rooskleuriger toekomst) door het opwervelen van veel veenbodemdeeltjes + daaraan gebonden P; Goed defosfateren van het aanvoerwater is belangrijk; Flexpeil is een risico vanwege veenoxidatie bij lage waterstanden en daardoor vergroting van Pmobilisatie; Hydrologische isolatie Kloosterkolk herstellen/verbeteren. Het poriewater kent hoge ammonium en daaraan gecorreleerde P-waarden in omgeving van defosfateringsinstallatie: geflocculeerde materiaal flocculant nog reactief? ";De ESF lichtklimaat vormt een probleem. Verticale extinctie (1.8 jaargemiddeld) laat zien dat er tussen 2013-2018  < 4% licht op 2.9 meter waterdiepte valt. In 2019 is extinctie lager, in juni 2016 valt er nog 4% licht op 1.9 meter.  Er valt periodiek (en in de jaren 2013-2018) onvoldoende licht op de waterbodem. Algen zijn een belangrijke oorzaak van een slecht lichtklimaat. ;De ESF voedselrijkdom van de waterbodem vormt lokaal een probleem: Tussen petgaten is bodem voedselrijk en bestaat een risico op woekerende waterplanten. De concentraties ammonium is wel heel hoog en kan toxiciteit in de wortelzone veroorzaken.;De ESF habitatgeschiktheid vormt mogelijk een probleem: De oevers hebben een zeer stijl talud en zijn soortenarm, maar er staan lokaal wel velden met kleine lisdodde en galigaan. Waarschijnlijk zijn de veenmosrietlanden in combinatie met ondergedoken vegetatie voldoende habitat voor fauna. Wanneer de ondergedoken waterplanten robuust zijn, dan de faua ook.; Doelsoorten in omgeving aanwezig, aanwezigen diasporen kunnen kiemen blijkt uit onderzoek van Bware (2018) en kunnen er ook komen.;De ESF verwijdering is een probleem: vraat door ganzen kan een mogelijk knelpunt vormen voor de ontwikkeling van oevervegetatie. Er zijn veel kreeften gevangen tijdens de vismonitoring in dit gebied.; ;SIMONI score < 1 (0.4), dus er is geen toxisch risico voor flora en fauna. Geen risicogebied voor lozingen. ;Geen herbegrenzing nodig.;De Ronde Venen;Utrecht;;;Verslag van de workshop over de problemen met de (ecologische) waterkwaliteit in Botshol. A. Van Leerdam, 2018.;;LM_20190916;
Noorder IJplas;NL11_7_2;3;3;3;1;1;1;1;1;;;;De oorzaak van deze kwaliteit is de hoge voedselrijkdom van het waterlichaam.  Bronnen zijn het achterland en het materiaal dat is gebruikt voor het verondiepen van de plas.;;;De ESF productiviteit water vormt een probleem: Er is sprake van algenbloeien. Sinds 2014 niet meer in de winter en vanaf dat moment is er een dudielijke voorjaars- en najaarsbloei te zien. De plas wordt vooral gestuurd door de actuele (zomer) belasting. In droge zomers zien we minder algen dan in natte zomers. Mogelijk is het achterland voedselrijker dan geschat in de huidge waterbalans: is er voedselrijk materiaal gedumpt in het park, stroomt het wateroverschot uit het park uit naar de plas: in de balans van Jasper stroomt 40% van het park af naar de plas. Het materiaal waarmee verondiept is is waarschijnlijk te voedselrijk, de geschatte nalevering in diepe delen is ongeveer 1.5 mg/m2/dag (tov 0.25-0.70 mg/m2/dag is de totale belasting van de plas). De waterbodem levert na: we zien in het hypolimnion dat het voedselrijker wordt. De zuivering Zaanstad loost op zijkanaal H (HHNK), mogelijk wordt het rendement in de toekomst lager omdat slib niet meer weg kan. Als de Zuidplas verslechtert zou de scheiding tussen Noord en Zuidplas kunnen worden verstevigd om dijkse kwel te verminderen.;"De ESF lichtklimaat vormt een probleem.  Extinctie is tussen 2008 en 2015 lager (jaargemiddeld 0.9-1.1). Vanaf 2016 is de extinctie verhoogd (doorzicht verlaagd); in 2015 en 2016 in de zomer door algenbloeien, in 2017, 2018 en 2019 is de extinctie juist in de winter hoger. Bij de huidige extinctie valt 4%licht tot op 2.2 meter waterdiepte. Opvallend is dat humusextinctie een stijgende trend laat zien sinds 2010 en daarmee een groter aandeel in de uitdoving. De extinctie is in deze periode verdubbelt en stabilisseert sinds begin 2019, maar daalt niet. We willen nog steeds 1 ha ondiep oppervlak in de plas.";De ESF productiviteit bodem vormt een probleem. De waterbodem is te voedselrijk (> 500mg/kg dg). Ook in ondiepe delen van de plas.;De ESF habitatgeschiktheid vormt mogelijk een probleem: Zout is geen beperking voor vegetatie (in Botshol is zowel de fluctuatie als concentratie chloride veel groter).; De bereikbaarheid van het gebied voor gewenste soorten is op dit moment vermoedelijk geen knelpunt. Er is een visspassage tussen de plas en het NZK.; ; ;SIMONI score < 1 (0.6), dus er is geen toxisch risico voor flora en fauna. Geen risicogebied.;Kleine plas staat in open verbinding met NZK. Grote plas is geisoleerd. Wenselijk om te grens aan te passen naar alleen grote plas;Amsterdam;Noord-Holland;;;"Evaluatie verondiepen, Viester 2019; Onderzoek bodemsamenstelling Noorder Ijplas, Stroom 2019";;LM_20190916;
Tussenboezem A;NL11_8_1;1;1;1;1;2;1;1;1;;;;De oorzaak van deze kwaliteit is PM;;Hier is het zinvol om te monitoren of het nieuw ingerichte weidevogelgebied wateroverschot heeft en er voedselrijk water wordt afgelaten richting het reservaat.;De ESF productiviteit water voldoet: Fosfaatbelasting sterk verlaagd door maatregelen als isolatie, defosfatering. Nog een check zou de waterbodem kunnen zijn. Bemestingsafspraken worden aangepast.;De ESF lichtklimaat vormt geen probleem:  Voldoende doorzicht. Er vaklt licht op de bodem.;De ESF voedselrijkdom van de waterbodem vormt geen probleem. Recent gebaggerd, bodem onder de toplaag voedselarm, < 5mg/kg (rapportage waterbodemonderzoek, Bware 2013). De effecten op de ecologie zijn nog niet zichtbaar.;De ESF habitatgeschiktheid vormt mogelijk een probleem: Karpers en brasems komen het gebied in dat belemmert herstel onderwaterplanten. De bootstuwen zijn daarbij een aandachtspunt.;De ESF verspreiding staat onder druk: Het niet kunnen verspreiden is geen knelpunt, het gebrek aan isolatie mogelijk wel. ; ;De ESF organische belasting vormt geen knelpunt voor de kwaliteit van het watersysteem. Geen overstorten voldoende zuurstof nabij de waterbodem.; Geen risicogebied;Geen herbegrenzing nodig.;De Ronde Venen en Stichtse Vecht;Utrecht;;;Evaluatie maatregelen tussenboezem Vinkeveen, 6 januari 2017;;LM_20190916;
Tussenboezem B;NL11_8_2;3;3;3;3;3;1;3;1;;;;De oorzaak van deze kwaliteit is de hoge voedselrijkdom van het waterlichaam. ;;Hier moet goed in de gaten worden gehouden of er geen karpers tussen de oeverlijn en bescherming van de oever bevinden. Deze beperken de effectiviteit van de aangelegde NVO's.;De ESF productiviteit water vormt een probleem en watergangen zijn te ondiep. Fosforbelasting is hoog. Het gebied dient als doorvoersysteem voor diepe droogmakerijen in de omgeving en er is sprake van nalevering uit de waterbodem in zeer ondiepe watergangen. De externe belasting ligt redelijk laag en nabij de kritische grens, maar de interne belasting is dermate hoog dat er zeer veel algen bloeien. In dit gebied bestaat er een risico dat bij het verlagen van de verblijftijd blauw- ipv groenalgen ontstaan.;De ESF lichtklimaat vormt een probleem. Lichtklimaat is slecht bij voldoende waterdiepte. Oorzaak is te veel aan algen. Veel karpers die de bodem omwoelen.;De ESF voedselrijkdom van de waterbodem vormt een probleem: Dikke laag voedselrijke bagger, mogelijk ook sprake van sulfide toxiciteit.;De ESF habitatgeschiktheid vormt een probleem. Karpers belemmeren herstel emerse vegetatie. Weinig vegetatie voor fauna.;De ESF verspreiding voldoet: de doelsoorten zijn in de omgeving aanwezig en kunnen er ook komen.; ; Zuurstofloosheid. Geen overstorten, geen bomen. Mogelijke belasting vanuit de waterbodem.; Geen risicogebied;Het opsplitsen van dit waterlichaam is gewenst omdat ze eigenlijk bestaan uit meer systemen aan twee verschillende zijden van de Amstellandboezem. Deze deelgebieden functioneren anders en hebben vaak verschillende watertypen. Om de huidige toestand en de verbetering of achteruitgang hierin te zien zijn nu kunstgrepen nodig (analyse en toetsing), die tijd kosten en om uitleg vragen. De inspanning qua monitoring hoeft niet gewijzigd te worden, in ieder geval niet voor wat betreft de verplichte monitoring. De inspanning voor de wat betreft maatregelen wordt ook niet anders. ;De Ronde Venen en Nieuwkoop;Utrecht en Zuid-Holland;;;Evaluatie maatregelen tussenboezem Vinkeveen, 6 januari 2017;;LM_20190916;
Gagelweg;2502-EAG-1;0;0;0;0;0;0;0;0;;;;PM;;PM;PM;PM;PM;PM;PM;PM;PM;PM;Geen herbegrenzing nodig.;De Ronde Venen en Nieuwkoop;Utrecht;;;;;LM_20190916;
Diemerpolder Noord;2010-EAG-1;3;2;0;3;1;1;0;0;;;;Fysisch-chemische en hydrobiologische waarnemingen laten zien dat dit een hoogproductief (voedselrijk) systeem is met aanwezigheid van waterplanten. De waterkwaliteit biedt ruimte voor verbetering, totaal fosfor is redelijk hoog. Het lichtklimaat vormt ook een belemmering voor de ecologische kwaliteit. De waterbodem zou een belangrijke bron van voedingstoffen kunnen zijn.;;De huidige water- en stoffenbalansen zijn per afvoergebied gemaakt. De rioleringsgegevens (hoeveelheid en kwaliteit van uitwisseling tussen stelsel en oppervlaktewater en de oppervlakken verhard gebied die afwateren op riool of watersysteem) moeten hier nog in worden verwerkt. Daarnaast is de uitwisseling tussen deelgebieden (EAG's) niet gemoddeleerd: dit heeft wel meerwaarde in een WSA omdat verschillende deelgebieden zich anders gedragen en om beter te bepalen of er mogelijkheden zijn om voedselrijke waterstromen om te leiden (gebieden te zoneren). Het modelleren van verschillende EAG's is vooral zinvol wanneer er maatregelen worden overwogen om de belasting met voedingstsoffen te reduceren. Om de stofstromen goed in beeld te brengen is het nodig om algemene fysisch chemische parameters te bemonsteren op een meetpunt dat zich op het uitwisselingspunt tussen EAG 1 en 2 bevindt. Hiermee wordt in beeld gebracht welke kwaliteit het water heeft dat van 1 naar 2 stroomt (mogelijk is dit DMP004).;De ESF productiviteit water vormt een probleem. De belasting is ongeveer 10 mg P/m2/dag, en bestaat een vrij gelijke verdeling tussen uitspoeling, verhard oppervlak, gedraineerd en doorspoeling. In onderstaande figuur is te zien dat de belasting de laatste jaren is toegenomen, en dat vooral samenhangt met een verhoogde doorspoeling. Uitgaande van een gemiddelde diepte van 0,5 m, een debiet van 38,2 mm/d en respectievelijk een klei- en veenbodem, is de kritische P-belasting 15,37 en 15,2 mg P/m2/dag. Uitgaande van een gemiddelde diepte van 0,5 m, een debiet van 38,2 mm/d en respectievelijk een klei- en veenbodem, is de kritische P-belasting 15,37 en 15,2 mg P/m2/dag. De huidige belasting is dus, uitgaande van de minimumwaarden, voldoende laag, waardoor een helder plantenrijk systeem mag worden verwacht. De huidige  belasting van het systeem bevindt zich echter dicht tegen de kritische grens en met een zichtbare toename staat de kwaliteit onder druk. ESF1 vormt op dit moment geen knelpunt, maar kan dit wel worden. De toestand van het systeem laat een vergelijkbaar beeld zien. Het P-gehalte (in mg/l) schommelt rond de 0,31 mg/l en Chlorofyl a laat pieken zien in het voorjaar en zomer. In 2018 zijn er veel meer algen gemeten dan in eerdere jaren.;Het lichtklimaat in Diemerpolder Noord en Gemeenschapspolder West vormt mogelijk een belemmering voor een goede waterkwaliteit, zeker wanneer watergangen worden verdiept.;Er zijn geen waterbodemgegevens beschikbaar, maar de seizoensdynamiek in fosforconcentraties laat zien dat er in de zomer fosfor uit de waterbodem wordt nageleverd. De waterbodem is waarschijnlijk voedselrijk. Wanneer wordt overwogen om te baggeren, dan is het zinvol om de waterbodem op verschillende diepten te bemonsteren.;De ESF habitatgeschiktheid vormt een probleem. De taluds op de meeste locaties steiler zijn dan 20 graden. Met name in Gemeenschapspolder West ligt het gemiddelde met 60 graden hoog. De inrichting vormt mogelijk een belemmering voor de waterkwaliteit.;PM;PM;PM;Niet bekend.;Geen herbegrenzing nodig.;Diemen;Noord-Holland;;;;;LM_20190916;
Diemerpolder Diemen;2010-EAG-2;3;1;0;3;1;1;0;0;;;;Fysisch-chemische en hydrobiologische waarnemingen laten zien dat dit een hoogproductief (voedselrijk) systeem is met aanwezigheid van waterplanten. De waterkwaliteit biedt ruimte voor verbetering, totaal fosfor is veel te hoog. Het doorzicht voldoet wel. De waterbodem zou een belangrijke bron van voedingstoffen kunnen zijn.;;De huidige water- en stoffenbalansen zijn per afvoergebied gemaakt. De rioleringsgegevens (hoeveelheid en kwaliteit van uitwisseling tussen stelsel en oppervlaktewater en de oppervlakken verhard gebied die afwateren op riool of watersysteem) moeten hier nog in worden verwerkt. Daarnaast is de uitwisseling tussen deelgebieden (EAG's) niet gemoddeleerd: dit heeft wel meerwaarde in een WSA omdat verschillende deelgebieden zich anders gedragen en om beter te bepalen of er mogelijkheden zijn om voedselrijke waterstromen om te leiden (gebieden te zoneren). Om de stofstromen goed in beeld te brengen is het nodig om algemene fysisch chemische parameters te bemonsteren op een meetpunt dat zich op het uitwisselingspunt tussen EAG 1 en 2 bevindt. Hiermee wordt in beeld gebracht welke kwaliteit het water heeft dat van 1 naar 2 stroomt (mogelijk is dit DMP004).;De ESF productiviteit water vormt een probleem. De belasting is ongeveer 10 mg P/m2/dag, en bestaat een vrij gelijke verdeling tussen uitspoeling, verhard oppervlak, gedraineerd en doorspoeling. In onderstaande figuur is te zien dat de belasting de laatste jaren is toegenomen, en dat vooral samenhangt met een verhoogde doorspoeling. Uitgaande van een gemiddelde diepte van 0,5 m, een debiet van 38,2 mm/d en respectievelijk een klei- en veenbodem, is de kritische P-belasting 15,37 en 15,2 mg P/m2/dag. Uitgaande van een gemiddelde diepte van 0,5 m, een debiet van 38,2 mm/d en respectievelijk een klei- en veenbodem, is de kritische P-belasting 15,37 en 15,2 mg P/m2/dag. De huidige belasting is dus, uitgaande van de minimumwaarden, voldoende laag, waardoor een helder plantenrijk systeem mag worden verwacht. De huidige  belasting van het systeem bevindt zich echter dicht tegen de kritische grens en met een zichtbare toename staat de kwaliteit onder druk.P laat vooral pieken zien in de zomer (tot 2 mg/l), deze zijn hoger in het stedelijk gebied (EAG2) dan in het landelijk gebied (EAG1). Deze hoge pieken duiden op nalevering vanuit de waterbodem bij hogere temperaturen. Chlorofyl a is de afgelopen twee droge jaren juist lager in Diemenpolder zuid (EAG2) dan in noord (EAG 1) en altijd vrij laag. Er is dus weinig productie in de vorm van algen.;De ESF lichtklimaat vormt geen probleem:  In Diemerpolder is het lichtklimaat altijd voldoende, ook bij een waterdiepte van 40cm.; Er zijn geen waterbodemgegevens beschikbaar, maar de seizoensdynamiek in fosforconcentraties laat zien dat er in de zomer fosfor uit de waterbodem wordt nageleverd. De waterbodem is waarschijnlijk voedselrijk. Wanneer wordt overwogen om te baggeren, dan is het zinvol om de waterbodem op verschillende diepten te bemonsteren.;De ESF habitatgeschiktheid vormt een probleem. De taluds op de meeste locaties steiler zijn dan 20 graden. Met name in Gemeenschapspolder West ligt het gemiddelde met 60 graden hoog. De inrichting vormt mogelijk een belemmering voor de waterkwaliteit.;PM;PM;PM;Niet bekend.;Geen herbegrenzing nodig.;Diemen;Noord-Holland;;;;;LM_20190916;
Gemeenschapspolder West;2310-EAG-1;3;2;0;3;1;1;3;0;;;;Fysisch-chemische en hydrobiologische waarnemingen laten zien dat dit een hoogproductief (voedselrijk) systeem is met aanwezigheid van waterplanten. De waterkwaliteit biedt ruimte voor verbetering, totaal fosfor en Chlorofyl a (algen) tonen in beperkte mate overschrijdingen. Het lichtklimaat vormt een belemmering voor de ecologische kwaliteit. De waterinlaat zou een belangrijke bron van voedingstoffen kunnen zijn. Het zwevende stof vertoont een tegengesteld patroon en is hoog in de winter en laag in de zomer, wat een indicatie is van uitspoeling van organisch materiaal en humuszuren uit (afbrekende) percelen.;;In de huidige waterbalans is het grootste deel van het oppervlak van de polder onverhard of verhard met een gescheiden stelsel (klop dit?). Dit betekent dat de stoffenbalans voldoende inzicht geeft in de werkelijke situatie. De uitwisseling tussen deelgebieden (EAG's) is niet gemoddeleerd: dit heeft wel meerwaarde in een WSA omdat verschillende deelgebieden zich anders gedragen en om beter te bepalen of er mogelijkheden zijn om voedselrijke waterstromen om te leiden (gebieden te zoneren). Vooral de waterbalans van het deelgebied bij het stedelijk gebied Stammerdijk en GWS008 zijn interessant omdat deze voedselrijker zijn dan (en daarmee een bron van voedingstoffen voor) de rest van de polder.;De ESF productiviteit water vormt een probleem. Hoge fosforconcentraties zijn gemeten op GSW008 (een representatief meetpunt voor een 'natuurgebied' met een hoger peil?).;Het lichtklimaat in Diemerpolder Noord en Gemeenschapspolder West vormt mogelijk een belemmering voor een goede waterkwaliteit, zeker wanneer watergangen worden verdiept.; ;De ESF habitatgeschiktheid vormt een probleem. De taluds op de meeste locaties steiler zijn dan 20 graden. Met name in Gemeenschapspolder West ligt het gemiddelde met 60 graden hoog. De inrichting vormt mogelijk een belemmering voor de waterkwaliteit.;PM;PM; Het zuurstofgehalte is toont een jaarlijkse fluctuatie, met winterpieken van 7,5 mg/l tot tot en met 14,5 mg/l en zomerdalen van 1,8 tot en met 4,5 mg/l. Deze zomerwaarden zijn laag en wijzen op zuurstofverbruik, biologisch (door algen en planten) dan wel organisch (afbraak). Bij dergelijke waardes (onder 5 mg/l) worden geen zuurstofminnende soorten vis meer verwacht en gaat de bodem fosfor naleveren (ESF1).;;Geen herbegrenzing nodig.;Diemen;Noord-Holland;;;;;LM_20190916;
Overdiemerpolder;2300-EAG-1;3;1;0;3;1;1;1;0;;;;Fysisch-chemische en hydrobiologische waarnemingen laten zien dat dit een hoogproductief (voedselrijk) systeem is met aanwezigheid van waterplanten. De waterkwaliteit biedt ruimte voor verbetering, totaal fosfor is veel te hoog terwijl het doorzicht goed is. De waterbodem zou een belangrijke bron van voedingstoffen kunnen zijn.;;De huidige water- en stoffenbalansen zijn per afvoergebied gemaakt. De rioleringsgegevens (hoeveelheid en kwaliteit van uitwisseling tussen stelsel en oppervlaktewater en de oppervlakken verhard gebied die afwateren op riool of watersysteem) moeten hier nog in worden verwerkt. ;De ESF productiviteit water vormt een probleem. Het chlorofylgehalte is vrij hoog en vertoont in het groeiseizoen regelmatig pieken boven 100ug/l. De P-waarden zijn hoog en stijgen constant (vooral in de zomer). Het toenemend gemiddelde van ongeveer 0,7 mg/l is ver boven de KRW-norm van 0,22. Deze toestand wijst samen met het chlorofylgehalte op voesdelrijke en ongunstige omstandigheden voor waterplanten.;De ESF lichtklimaat vormt geen probleem:  Het doorzicht in het systeem is laag (30 cm) in de winter en hoger in de zomer. In Overdiemerpolder is het lichtklimaat altijd voldoende, ook bij een waterdiepte van 40cm.; Er zijn geen waterbodemgegevens beschikbaar, maar de seizoensdynamiek in fosforconcentraties laat zien dat er in de zomer fosfor uit de waterbodem wordt nageleverd. De waterbodem is waarschijnlijk voedselrijk. Wanneer wordt overwogen om te baggeren, dan is het zinvol om de waterbodem op verschillende diepten te bemonsteren.;De ESF habitatgeschiktheid vormt een probleem. De taluds op de meeste locaties steiler zijn dan 20 graden. Met name in Gemeenschapspolder West ligt het gemiddelde met 60 graden hoog. De inrichting vormt mogelijk een belemmering voor de waterkwaliteit.;PM;PM; Het zuurstofgehalte vertoont jaarlijkse fluctuatie van onder 2,5 mg/l in de zomer tot boven 10 mg/l in de winter. Dit patroon is typerend voor een hoogproductief systeem waar in de zomer veel zuurstof wordt verbruikt en niet een systeem waar zuurstofverbruik voornamelijk wordt veroorzaakt door oganische belasting. ;;Geen herbegrenzing nodig.;Diemen;Noord-Holland;;;;;LM_20190916;
Venserpolder;2280-EAG-1;3;1;0;3;1;1;0;0;;;;PM;;De huidige water- en stoffenbalansen zijn per afvoergebied gemaakt. De rioleringsgegevens (hoeveelheid en kwaliteit van uitwisseling tussen stelsel en oppervlaktewater en de oppervlakken verhard gebied die afwateren op riool of watersysteem) moeten hier nog in worden verwerkt. ;De ESF productiviteit water vormt een probleem.;De ESF lichtklimaat vormt geen probleem: ;PM;De ESF habitatgeschiktheid vormt een probleem. De taluds op de meeste locaties steiler zijn dan 20 graden. Met name in Gemeenschapspolder West ligt het gemiddelde met 60 graden hoog. De inrichting vormt mogelijk een belemmering voor de waterkwaliteit.;PM;PM;PM;PM;Geen herbegrenzing nodig.;Diemen;Noord-Holland;;;;;LM_20190916;
