OWMNAAM;OWL;ESF1;ESF2;ESF3;ESF4;ESF5;ESF6;ESF7;ESF8;Karakterschets;Doelen;Toestand;Oorzaken;Maatregelen;MonitoringAnalyseWensen;ESF1;ESF2;ESF3;ESF4;ESF5;ESF6;ESF7;ESF8;MotiveringBegrenzing;Gemeenten;Provincies;Eigenaren;Status;Literatuurverwijzing;Gebiedspartners;aangepast;Opmerking
Amstellandboezem;NL11_1_1;3;3;3;3;1;3;3;3;;;;"De oorzaak van deze kwaliteit zijn diverse (polder)lozingen die licht brak en voedselrijk water lozen in de Amstellandboezem. Om de waterkwaliteit te verbeteren wordt een waterkwaliteitsscherm aangelegd. Dit is een fysiek scherm in de Geer. Dit scherm zorgt ervoor dat licht brak en voedselrijk water niet meer vanaf de Amstel naar het zuidelijk deel van de Amstellandboezem en de Vinkeveense Plassen kan stromen. Hierdoor verbetert ook de waterkwaliteit in de omliggende polders en KRW-waterlichamen omdat daar dan water van betere kwaliteit wordt ingelaten. Ook het reduceren van emissies vanuit de glastuinbouw en agrarische polders zal de waterkwaliteit verbeteren.
Er is een gering begroeibaar areaal aanwezig in de Amstel langs de oevers en dit areaal staat onder druk staat door overkluizingen (steigers), golfslag en opwerveling van bodemdeeltjes. ";;;"Het waterlichaam vertoont een wisselend beeld voor wat betreft de ESF productiviteit water. In de westelijke takken, in het zuiden en het noorden (tot aan Amsterdam) is de algenconcentratie te hoog. Dit geldt ook voor de Bullewijk, waar de algenconcentratie hoger is onder invloed van de Ronde hoep en de Holendrechter- en Bullewijkerpolder. In delen van de Amstellandboezem komen echter wel waterplanten voor. Vooral de oostelijke takken van Angstel en Gein, Gaasp, de Diemen en Weespertrekvaart voldoen al redelijk aan de verwachtingen voor waterkwaliteit en waterplanten. De vegetatie is echter zeer soortenarm en bestaat voornamelijk uit gele plomp. 
De externe belasting met fosfaat is groter dan de draagkracht van het boezemsysteem. Dit gaat gepaard met de ouderdom van het water; hoe ouder het water hoe groter het risico op algenbloeien. Vooral in boezemdelen die onder invloed staan van de polders Zuiderlegmeer en Groot Mijdrecht en de RWZI Amstelveen is de belasting met fosfor een probleem. De Zuiderlegmeerpolder is een grote bron in het zuidelijk deel van de boezem, maar ook de RWZI Amstelveen en polders (meststofverliezen en veenafbraak) hebben een groot aandeel in de totale belasting met fosfor.
Er is een gering begroeibaar areaal aanwezig in de Vecht langs de oevers dat onder druk staat door overkluizingen (steigers), golfslag en opwerveling van bodemdeeltjes. Vegetatie kan hersteld worden door het creeren van vaarluwezones, vooroevers en aanplanten van vegetatie in deze zones.";De ESF lichtklimaat vormt een probleem. Het lichklimaat vormt een probleem voor de groei van waterplanten omdat er minder dan 4% licht valt op de waterbodem. Mogelijk vormt scheepvaart een probleem bij de opwerveling van bodemmateriaal. ;De ESF productiviteit bodem vormt een probleem omdat de bodem waarschijnlijk voedselrijk en toxisch is, vanwege grote bronnen van nutrienten en zwavel. De provincie heeft hier onderzoek naar gedaan in de Amstel (check).;De ESF habitatgeschiktheid vormt een probleem. Er is een gering begroeibaar areaal aanwezig in de Amstel langs de oevers en dit areaal staat onder druk staat door overkluizingen (steigers), golfslag en opwerveling van bodemdeeltjes.;De ESF verspreiding voldoet omdat de doelsoorten in de omgeving aanwezig zijn en er ook kunnen komen.;De ESF verwijdering is een probleem omdat vraat door ganzen een mogelijk knelpunt vormt voor de ontwikkeling van oevervegetatie.;De ESF organische belasting vormt een probleem. Waarom?;De ESF toxiciteit vormt een probleem. Nabij het glastuinbouwgebied wordt een hoge toxische druk door gewasbeschermingsmiddelen gemeten en deze resulteert lokaal in een hoge SIMONI score > 1 (dit geeft aan dat er geen risico wordt verwacht als gevolg van de aanwezigheid van te hoge concentraties microverontreinigingen).;"Er is een wens voor herbegrenzen van dit waterlichaam. Een deel van het waterlichaam zou ecohydrologisch gezien beter passen bij het waterlichaam Vaasten Amsterdam. Het Noorder Amstelkanaal, Zuider Amstelkanaal moeten erbij en van Amsterdam af. 
";Amstelveen, Amsterdam, De Ronde Venen, Diemen, Nieuwkoop, Ouder-Amstel, Stichtse Vecht, Uithoorn en Woerden;Noord-Holland, Utrecht en Zuid-Holland;;;Achtergrondrapport boezemplan, 2018.;;TW_20191003;
Vecht;NL11_1_2;3;3;3;3;1;3;3;1;;;;"De oorzaak van deze kwaliteit is de hoge voedselrijkdom van het waterlichaam. Lokaal bloeien algen waar het water ouder wordt. Op plekken waar het water niet oud wordt komen korstvormige algen voor die het lichtklimaat voor ondergedoken waterplanten belemmeren. Net zuidelijk van de Horstermeer wordt het water oud en daar komen ook de meeste algen voor en is het doorzicht slecht. Belangrijke bronnen van voedingstoffen zijn de RWZI Utrecht en (landbouw)polders. De belasting met voedingstoffen is de afgelopen jaren wel afgenomen door verbeteringen in RWZI`s en het baggeren van de Vecht. Op luwe en ondiepere locaties, zoals het Ballastgat en bij natuurvriendelijke oevers, komen (onder)waterplanten voor. De soortenrijkdom van waterplanten en fauna is beperkt door de hoge voedselrijkdom en het beperkte lichtklimaat.  Er is een gering begroeibaar areaal aanwezig in de Vecht langs de oevers en dit areaal staat onder druk door overkluizingen (steigers), golfslag en opwerveling van bodemdeeltjes.  
Een achteruitgang van de waterkwaliteit in het  IJmeer/ Markermeerwater is een risico voor de kwaliteit van de Vecht omdat dit een grote bron van inlaatwater is in het noorden van de Vecht, die in droge zomers van belang is om te voorkomen dat het water uit de Horstermeer naar het noordelijk deel van de Vecht stroomt. ";;;"De ESF productiviteit water vormt een probleem, lokaal zien we daardoor algen en een voedselrijke vegetatie. Dit komt doordat de externe belasting met fosfaat groter is dan de draagkracht van het boezemsysteem. Net zuidelijk van de Horstermeer wordt het water ouder dan in andere delen van de Vecht. In oud water komen voedingstoffen tot expressie en gaan algen bloeien. Wanneer het water niet oud wordt krijgen vrij zwevende algen geen kans om te bloeien, maar kunnen korstvormige algen (epifyton) in hoge dichtheid groeien en het lichtklimaat voor onderwaterplanten beperken. De belangrijkste bronnen van nutrienten zijn: de RWZI Utrecht en (landbouw)polders. De fosforbelasting op de Vecht is de afgelopen jaren wel verminderd: De RWZI Utrecht loost minder fosfor (10-20% van de totale fosforbelasting) en RWZI Maarssen loost niet meer op de Vecht. Er is een gering begroeibaar areaal aanwezig in de Vecht langs de oevers dat onder druk staat door overkluizingen (steigers), golfslag en opwerveling van bodemdeeltjes. Vegetatie kan hersteld worden door het creeren van vaarluwezones, vooroevers en aanplanten van vegetatie in deze zones.
De achteruitgang van de kwaliteit van het IJmeer- en Markermeerwater is een risico voor de kwaliteit van de Vecht, omdat  dit water wordt ingelaten in het noorden van de Vecht. Het temmen van brakke kwel uit de Horstermeer is ook een risico omdat het voedselrijke water dan niet meer herkend kan worden aan chloride. ";De ESF lichtklimaat is een probleem. Het doorzicht is voldoende voor de groei van ondergedoken waterplanten (er is minstens 70 cm doorzicht). Er valt meer dan 4% licht op 1 meter waterdiepte. Echter, door de hoge concentraties PO4 in het water zijn er veel korstvormige algen en deze doven het licht uit. ;De ESF productiviteit bodem is niet op orde omdat er sprake lijkt te zijn van ammoniumtoxiciteit: Er zijn hoge concentraties ammonium gemeten in de waterbodem van de Vecht. Er wordt namelijk sulfaatrijk water ingelaten bij Muiden. In delen van de Vecht komen wel waterplanten voor, dus dit vormt niet overal een probleem voor de ontwikkeling van oever- en ondergedoken vegetatie.;De ESF habitatgeschiktheid vormt een probleem. Er is een gering begroeibaar areaal aanwezig in de Vecht langs de oevers en dit areaal staat onder druk staat door overkluizingen (steigers), golfslag en opwerveling van bodemdeeltjes. Ook wordt maaisel en tuinafval in de bestaande oevers gedumpt. ;De ESF verspreiding voldoet: de doelsoorten zijn in de omgeving aanwezig en kunnen er ook komen.;De ESF verwijdering is mogelijk een probleem: vraat door ganzen kan een mogelijk knelpunt vormen voor de ontwikkeling van oevervegetatie.;De ESF organische belasting voldoet. ;De ESF toxiciteit vormt geen probleem. Dit is gebaseerd op de kennis dat in het zuidelijk deel van de Vechtboezem geen hoge toxische druk gemeten (SIMONI <1.0 op VEC011, VEC016) en ook niet nabij de RWZI Utrecht.;De Vecht lijkt door alle aanpassingen op geen enkele manier meer op een natuurlijke rivier met voeding vanuit een bovenloop, een flexibel peil, een variabele bedding, enz. De kenmerkende morfologie zoals beschreven voor natuurlijke wateren (R6, R7) kan niet meer voorkomen. ;Diemen, Gooise Meren, Stichtse Vecht, Utrecht, Weesp en Wijde meren;Noord-Holland en Utrecht;;;"Achtergrondrapport boezemplan, 2018; Aanpassen inlaatregime Muiden, ";;TW_20191003;
Vaarten Amsterdam;NL11_2_1;3;3;0;3;1;2;2;3;;;;De oorzaak van deze kwaliteit is de troebele toestand en morfologie van het waterlichaam. De grachten van Amsterdam zijn troebel, met alleen lokaal drijfbladplanten. Scheepvaart veroorzaakt opwerveling van slib. Hoewel er weinig algen bloeien in de grachten is het systeem wel voedselrijk. De kademuren zijn een harde overgang van land naar water waardoor er geen ruimte is voor een goed ontwikkelde oevervegetatie. Ook staat de geringe ondiepe zone in dit water onder druk door een toenemend aantal overkluizingen op het water.;;;De ESF productiviteit water vormt een probleem, het systeem is vrij hoog belast met voedingsstoffen. Er komen echter niet overal algen voor. In 2000-EAG-1 zitten de algen die vanuit de Amstel woren getransporteerd, maar de algenconcentratie is laag in het centrum van het waterlichaam 1000-EAG-1. De reden hiervoor is niet goed bekend, de verblijftijd is lang genoeg voor algen om zich te ontwikkelen. Doodlopenende stilstaande wateren in de buurt van overstorten zijn gevoelig voor algenbloeien. De Amstel is de grootste bron van nutrienten. Hier moet ik mail Erwin verwerken over bijdrage riooloverstorten.;De ESF lichtklimaat vormt een probleem. Er valt niet voldoende licht op de bodem voor ondergedoken waterplanten om te groeien. Dit komt door aanvoer van zwevend stof van buiten en door aanwezige humuszuren. Ook is er een hoge fosfaatconcentratie aanwezig waardoor er veel perifyton groeit en de omstandigheden voor planten verder bemoeilijkt.. De verticale extinctie schommelt tussen de 1.4 en 4.1. Aanvoer allochtoon zwevende stof en humusextinctie. Door de enorm hoge PO4 concentraties groeit perifyton hard en dooft het licht verder uit.  De waterdiepte varieerd tussen de 1.4 meter en 2.90. Bij deze waterdiepte valt er onvoldoende licht op de bodem voor onderwaterplanten.;Het is onbekend of de ESF productiviteit bodem voldoet. Wel is bekend dat de waterbodem waarschijnlijk niet tot een grote zuurstofvraag leidt in het water.;De ESF habitatgeschiktheid vormt een probleem om dat er weinig plekken zijn waar ondergedoken waterplanten en oeverplanten zich kunnen vestigen. Daarmee is er ook weinig habitat voor vis en macrofauna.;De ESF verspreiding voldoet: de doelsoorten zijn in de omgeving aanwezig en kunnen er ook komen.;De ESF verwijdering is geen probleem op het moment. Echter, wanneer de omstandigheden voor planten verbeteren kunnen kreeften het herstel van vegetatie belemmeren.;De ESF organische belasting is mogelijk een probleem. In het meest noordelijke stuk van de Amstel  is de zuurstofvraag groot door organische belasting vanuit de RWZI Amstelveen en het stedelijk gebied van Amstelveen.;De ESF toxiciteit vormt een probleem. Het aantal vervuilingslokaties in Amsterdam is groot en metingen in dieren en planten laten overschrijdingen van de toxische druk zien.;Er is voor dit waterlichaam een wens voor herbegrenzen. Een deel van het waterlichaam zou ecohydrologisch gezien naar Amsterdam moeten. Nieuwe Grens: Bij de Amstelsuizen en Amstelfront.;Amsterdam;Noord-Holland;;;boezemplan?/plan RWZI Amstelveen;;TW_20191003;
Vaarten Vechtstreek;NL11_2_2;3;3;3;3;1;3;2;3;;;;De oorzaak van deze kwaliteit is de hoge voedselrijkdom van het waterlichaam. In het waterlichaam is potentie aanwezig tot verbetering. De waterkwaliteit van de ‘s Gravelandsevaartboezem wordt bepaald door bronnen met hoge nutriëntenconcentraties, de korte verblijftijd en de inrichting met weinig ondiep oppervlak en land-water overgangen. De belangrijkste bronnen van fosfaat zijn afspoeling vanuit percelen, inlaat of doorvoer van water en nalevering vanuit voedselrijke waterbodems. Door delen van dit waterlichaam te zoneren kan de waterkwaliteit verbeterd worden.;;;De ESF productiviteit water vormt een probleem doordat het watersysteem te hoog belast is. De Noordpolder, Zuidpolder en het stedelijk gebied van Bussum zijn grote bronnen van nutrienten. Ook vanuit de kustpolders en andere stedelijke gebieden zijn de nutrientbelastingen hoog. De concentratie aan algen is soms hoog, maar dit is niet altijd het geval. Er is wel veel perifyton aanwezig, aangroei van algen aan bijvoorbeeld planten. Het water in de Karnemelksloot wordt niet oud. Water dat de kans krijgt om ouder te worden vormt een risico op algenbloeien.;De ESF lichtklimaat vormt een probleem. Dit komt door de hoge fosfaatconcentraties (en daardoor soms hoge algenconcentraties) en perifyton (korstvormige algen). Maar ook vaarbewegingen, opwerveling en verduistering door steigers zijn risico's voor het lichtklimaat. ;De ESF productiviteit bodem vormt een probleem. De waterbodem is lokaal (nabij Bussum) voedselrijk. In overige delen van het waterlichaam is dit onbekend. ;De ESF habitatgeschiktheid vormt een probleem door scheepvaart. Scheepvaart zorgt voor golfslag en de bodem is te veel in beweging hierdoor om waterplanten te kunnen laten groeien langs de oever. ;De ESF verspreiding voldoet: de doelsoorten zijn in de omgeving aanwezig en kunnen er ook komen.;De ESF verwijdering vormt een probleem. Schroeven van schepen zijn een groot risico voor verwijdering van ondergedoken waterplanten. Dit geldt ook voor kleinere sloepjes. Dit is te mitigeren door maar op de helft van de lengterichting te varen door een fysieke scheiding aan te brengen (kan alleen als het over de hele lengte gebeurt). Verbreden en verdiepen van watergangen kunnen een risico vormen omdat er wellen kunnen ontstaan. Een andere mogelijke maatregel is alleen trekschuiten toe te staan of door te zoneren (de s'Gravenlandse Vaart Noord en de Karnemelksloot hebben de grootste potentie).;De ESF organische belasting is mogelijk een probleem. ;De ESF toxiciteit vormt een probleem. In Bussum is de SIMONI score > 1, dit geeft aan dat er een risico wordt verwacht als gevolg van de aanwezigheid van te hoge concentraties microverontreinigingen. In stedelijk gebied is de toxische druk hoog, overstorten zijn de bron van deze druk.;Er is geen wens tot herbegrenzen voor dit waterlichaam. Delen van het waterlichaam (Cruysbergen en 's Gravenlandse vaart) zijn geen onderdeel van het watersysteem in de boezem. Vanwege de status die de KRW aan water geeft, willen we waterlichamen niet zomaar kleiner maken.;Gooise Meren, Hilversum, Weesp en Wijde meren;Noord-Holland;;;Rapport varen in de vaart, Deltares.;;TW_20191003;
Vaarten Ronde Venen;NL11_2_3;2;2;3;3;1;1;1;2;;;;De oorzaak van deze kwaliteit is de geringe waterdiepte in de bovenstroomse delen van het waterlichaam: Veel sloten in het gebied zijn zeer ondiep met een sliblaag die makkelijk opwervelt en voedingstoffen nalevert. Nieuwe aanwas van bagger door algen, oeverafkalving en mogelijk ook door veenafbraak in de waterbodem en omliggende percelen belemmert het herstel. Opwerveling door wind of door bijvoorbeeld karpers en kreeften zorgt ervoor dat vegetatie zich niet of moeilijk kan vestigen. Het water is wel helder, dit komt doordat er veel open water aanwezig is in het gebied en daardoor is de belasting met voedingsstoffen relatief laag. ;;;De ESF productiviteit water voldoet soms wel en soms niet in het waterlichaam. Zeer plaatselijk is er te veel kroos, dit is een teken van een te hoge belasting. In de hoofdwatergang is voedselrijke vegetatie aanwezig. In polder Oukoop is de biodiversiteit buiten de hoofdwatergang hoger dan in de rest van het gebied. Het deel dat nu is begrensd als waterlichaam, de hoofwatergang, heeft een hoge algenconcentratie. In de bijbehorende polder is er alleen een lichte algenbloei in de late winter en in het voorjaar. De belasting met fosfaat is over het algemeen lager dan de kritische fosfaatbelasting, alleen niet in Wilnis Veldzijde. De hypothese is dat dit waterlichaam vooral gestuurd wordt door de waterbodem.;De ESF lichtklimaat voldoet op sommige plekken wel en op andere plekken niet. Lokaal, waar het water dieper is, is het lichtklimaat beperkt door algen, flab en/of kroos. ;De ESF productiviteit bodem vormt een probleem. Op veel plaatsen is er veel bagger. Metingen die zijn gedaan in 2013 geven aan dat de bodem voedselrijk is. Aangenomen kan worden dat de samenstelling niet gunstig is voor de aanwezigheid en/of de soortensamenstelling van waterplanten. ;De ESF habitatgeschiktheid vormt een probleem omdat de waterdiepte vaak te gering is. Maatregelen lijken wel te hebben geholpen, het is nu dieper dan eerder. Gek genoeg voor 2014. Talud 22 van de 31 te stijl in Oukoop (KLEI!). 26 van de 58 in GWV-zuid. ;De ESF verspreiding voldoet: de doelsoorten zijn in de omgeving aanwezig en kunnen er ook komen.;De ESF verwijdering lijkt geen probleem te vormen. Plaatselijk is er wel te weinig oevervegetatie, dit kan duiden op te intensief onderhoud, maar ook op te steile oevers.;Er zijn geen aanwijzingen voor problemen door een hoge organische belasting.;Er zijn geen aanwijzingen voor een probleem met de toxische druk van het water.;Het herbegrenzen van dit waterlichaam is gewenst omdat de toestandsbepaling bij de huidige begrenzing geen representatief beeld geeft van de ecologische kwaliteit. Er wordt nu gerapporteerd over het minst represetatieve gedeelt van de polder. Het belangrijkste argument voor de voorgestelde wijzigingen is het vergroten van de transparantie. Wanneer er over de toestand in de gehele polder wordt gerapporteerd zijn verbetering of achteruitgang beter te zien. De inspanning qua monitoring hoeft niet gewijzigd te worden, in ieder geval niet voor wat betreft de verplichte monitoring. De inspanning voor de wat betreft maatregelen wordt ook niet anders. ;De Ronde Venen en Stichtse Vecht;Utrecht;;;WGP Groot Wilnis Vinkeveen;;TW_20191003;
Vaarten Zevenhoven;NL11_2_4;3;2;2;2;1;1;1;1;;;;De oorzaak van deze kwaliteit is de hoge voedselrijkdom van het waterlichaam. Lokaal komen veel (blauw)algen voor, soms in combinatie met eensoortenarme vegetatie. De bron van voedingstoffen zijn de vele onderbemalingen, waar lokaal akkerbouw aanwezig is.;;;De ESF productiviteit water vormt een probleem: Lokaal te veel algen (Groene Jonker), zelfs blauwalgen (EAG 10 hoofdwatergang). Meestal niet te veel kroos/flab, maar in EAG's 3, 4, 5 wel hoge kroosbedekkingen. Vegetatie voedselrijk, in 2017 vegetatie, behalve Nuphar, in EAG 10 verdwenen, maar minder meetpunten :(. Dus een te voedselrijk systeem. Hoog P-tot en orthoP. P-belasting hoog en > Pcrit. Verblijftijd in EAG1/10 is 6 dagen gemiddeld. In droge periodes (zomer) oplopend tot 10 dagen, wat met de leeftijd vanuit de blokbemalingen blauwalgen mogelijk maakt. Belasting vooral 1) vanuit blokbemalingen (met pomp) en 2) de vele drainage.;De ESF lichtklimaat voldoet op sommige plekken wel en op andere plekken niet.  Lokaal, waar water dieper is,  is lichtklimaat beperkt door algen en/of flab/kroos. ;De ESF voedselrijkdom van de waterbodem vormt mogelijk een probleem:  Niet veel bagger (tot 20 in hoofdwatergang) en 0-5 (15) in overig water aanwezig. De samenstelling is onbekend.;De ESF habitatgeschiktheid vormt een probleem: Op veel plaatsen is het water zo ondiep (mediaan 30) dat er weinig of soms geen planten verwacht worden. De oevers zijn plaatselijk te steil voor een goede emerse vegetatie KLEI.;Doelsoorten in omgeving aanwezig en kunnen er ook komen;De ESF verwijdering lijkt geen probleem te vormen. De bedekking met emerse planten (veel groen en blauw) duidt meestal niet op te intensief onderhoud. Oranje in hoofdwatergang,Oranje; Geen aanwijzingen; Geen aanwijzingen;"Het herbegrenzen van dit waterlichaam is gewenst omdat de toestandsbepaling bij de huidige begrenzing geen representatief beeld geeft van de ecologische kwaliteit; Er wordt nu gerapporteerd over het minst represetatieve gedeelt van de polder. Het belangrijkste argument voor de voorgestelde wijzigingen is vergroten van de transparantie: wanneer er over de toestand in de gehele polder wordt gerapporteerd zijn verbetering of achteruitgang beter te zien. De inspanning qua monitoring hoeft niet gewijzigd te worden, in ieder geval niet voor wat betreft de verplichte monitoring. De inspanning voor de wat betreft maatregelen wordt ook niet anders. ";Nieuwkoop;Zuid-Holland;;;;;LM_20190916;
Vaarten Ronde Hoep;NL11_2_5;3;2;2;3;1;1;2;2;;;;De oorzaak van deze kwaliteit is de hoge voedselrijkdom van het waterlichaam. Bovendien zijn veel sloten ondiep. De fosforbelasting bestaat voor een groot deel uit water dat wordt ingelaten door priveinlaten. Dit water is niet nodig om het water in de polder op peil te houden. Het reduceren van waterinlaat, het afkoppelen van het stedelijk gebied (Benningh) en agrarische pakketten om uitspoeling van voedingsstoffen uit de percelen te reduceren bieden handelingsperspectief.;;;"De ESF productiviteit water vormt een probleem: Lokaal te veel algen, te veel kroos/flab. Vegetatie voedselrijk. Dus een te voedselrijk systeem. Hoog P-tot en orthoP. P-belasting > Pcrit, zeer gevoelig voor % open water (% checken!); Andere check: is noord lager belast (minder rijke percelen) dan zuid. De inlaat is in EAG3 (NW) orde gelijk aan de perceelsbelasting. De verblijftijd neemt factor 2 toe als alleen gesuppleerd wordt. De belasting daalt meer dan de Pcrit! Ook lokale effecten van de inlaten zijn beperkt te oordelen naar de waarnemingen in de ecologie. Uit EGV-metingen (UvA) komt het beeld dat overal in de zomer aandeel boezem groot is; er zijn binnen een EAG vrijwel geen ruimtelijke verschillen. Ook waterbalans toont groot aandeel boezemwater in de zomer. Er zijn veel ondiepe plekken, vooral in het reservaat.";De ESF lichtklimaat voldoet op sommige plekken wel en op andere plekken niet.  Zeer plaatselijk, waar water dieper is,  is lichtklimaat beperkt door algen en/of flab/kroos. Opgewerveld en bezinkend slib kan vegetatie bedekken.;De ESF voedselrijkdom van de waterbodem vormt lokaal een probleem:  Op veel plaatsen bagger aanwezig. Aangenomen kan wordendat de samenstelling niet gunstig is voor de aanwezigheid en/of de samenstelling van waterplanten.;De ESF habitatgeschiktheid vormt een probleem. Op veel plaatsen is het water zo ondiep dat er geen planten verwacht worden of zal de bedekking beperkt zijn. Het oevertalud is ook te steil op 6 van de 23 waarnemingen.;De ESF verspreiding voldoet: de doelsoorten zijn in de omgeving aanwezig en kunnen er ook komen.;De ESF verwijdering lijkt geen probleem te vormen.  De bedekking met emerse planten is niet bijzonder laag (EKR rond 0.6), wat niet duidt op te intensief onderhoud. ;De ESF organische belasting lijkt geen probleem in het waterlichaam zelf.  In het stedelijk gebied dat afwaterd via de polder kunnen bladval en overstorten een probleem zijn.;Er zijn geen aanwijzingen voor een probleem met de toxische druk van het water.;"Het herbegrenzen van dit waterlichaam is gewenst omdat de toestandsbepaling bij de huidige begrenzing geen representatief beeld geeft van de ecologische kwaliteit; Er wordt nu gerapporteerd over het minst represetatieve gedeelt van de polder. Het belangrijkste argument voor de voorgestelde wijzigingen is vergroten van de transparantie: wanneer er over de toestand in de gehele polder wordt gerapporteerd zijn verbetering of achteruitgang beter te zien. De inspanning qua monitoring hoeft niet gewijzigd te worden, in ieder geval niet voor wat betreft de verplichte monitoring. De inspanning voor de wat betreft maatregelen wordt ook niet anders. ";Ouder-Amstel;Noord-Holland;;;;;LM_20190916;
