300;71369;NL11;91149;Uitvoeren herstel- en inrichtingsmaatregelen Stichts Ankeveense plassen, fase 1;Open landschap herstellen;;SGBP1 2009-2015;2009-2015;BE06;De maatregel betreft het verwijderen van boom- en groenopslag langs watergangen in het plassengebied.De maatregel wordt als onderdeel van één maatregelpakket met:- Uitvoeren herstel- en inrichtingsmaatregelen Kortenhoefse plassen, fase 1 - effect 1,- Uitvoeren herstel- en inrichtingsmaatregelen Hollands Ankeveense plassen, fase 1 - effect 1en- Uitvoeren herstel- en inrichtingsmaatregelen Tienhovense plassendoor Natuurmonumenten in het kader haar LIFE-subsidiecontract met de EU uitgevoerd.De uitvoering van de maatregel loopt overeenkomstig de duur van het subsidiecontract van 2013 tot en met 2018.;WB;NL11_6_3;NL11_6_3;10.79;km;j;Natuurmonumenten;Beheer en Onderhoud per planperiode=0.00|Investering per planperiode=120000.00;0;0;10.79;0;0;0;ESF4;uitgevoerd;;;;;;78.8;0;70;0;ja;nee;;;;0;% van bebost;;;1;Stichts Ankeveen;2016;LM_20190916;Vecht;;;
301;71371;NL11;91155;Onderzoeken maatregelen Stichts Ankeveense plassen;Onderzoek;;SGBP1 2009-2015;2009-2015;S01;Het gaat om het uitvoeren van twee deelonderzoeken:1 Verbeteren diversiteit vegetatie Stichts Ankeveen2 Verdergaande maatregelen ter beperking invloed GRV op SAP;WB;NL11_6_3;NL11_6_3;2;n;j;Waterschap Amstel Gooi en Vecht;Beheer en Onderhoud per planperiode=0.00|Investering per planperiode=54000.00;0;0;2;0;0;0;ESF1, ESF4;uitgevoerd;Natuurmonumenten;;;;;78.8;0;70;0;ja;nee;;;;0;nvt;;;1;Stichts Ankeveen;2016;LM_20190916;Vecht;;;
302;71380;NL11;NL11_0145;Toepassen ecologisch onderhoud oevers hoofdwateren - fase 1;Natuurvriendelijk onderhouden EMERS;;SGBP1 2009-2015;2009-2015;BE03;Een gebiedsbrede maatregel in alle waterlichamen;MW;NL11_6_3;NL11_6_3;30;n;j;Waterschap Amstel Gooi en Vecht;Investering per planperiode=0.00|Beheer en Onderhoud per planperiode=390000.00;0;0;325;0;0;0;ESF4;uitgevoerd;geen;;;;;78.8;0;70;0;ja;nee;;;;0;1/0;;;1;Stichts Ankeveen;2016;LM_20190916;Vecht;;;
303;71357;NL11;91124;Realiseren P-reductie rwzi Horstermeer (autonoom);P-belasting verlagen;;SGBP1 2009-2015;2009-2015;IM01;Het gaat om het realiseren van maatregelen om de rwzi aan de wettelijke lozingseisen te laten voldoen;MW;NL11_6_3;NL11_6_3;1;n;j;Waterschap Amstel Gooi en Vecht;Investering per planperiode=10500000.00|Beheer en Onderhoud per planperiode=0.00;0;0;1;0;0;0;ESF1;uitgevoerd;geen;;;;;78.8;0;70;0;ja;nee;;;;0;mg/m2/dag;;;1;Stichts Ankeveen;2016;LM_20190916;Vecht;;;
304;71372;NL11;91156;Stoppen bemesten van gronden van NM met kortlopende overeenkomsten;P-belasting verlagen;;SGBP1 2009-2015;2009-2015;IM08;"De oorspronkelijke kwantitatieve doelstelling van de maatregel was het uitvoeren van de beheermaatregel op 154 hectare in het plassengebied opgedeeld in:	Het stoppen van bemesten op 30 hectare in het gebied van Hollands Ankeveense plas	Het stoppen van bemesten op 55 hectare in het gebied van Stichts Ankeveense plas	Het stoppen van bemesten op 69 hectare in het gebied van de Kortenhoefse plassen";MW;NL11_6_3;NL11_6_3;0.0001;km;j;Natuurmonumenten;Investering per planperiode=0.00|Beheer en Onderhoud per planperiode=27900.00;0;0;0;0.0001;0;0;ESF1;gefaseerd naar SGBP2;;;;;2.108254874;78.8;0;70;0;ja;nee;geen landbouw na afkoppelen;;;0;mg/m2/dag;;;1;Stichts Ankeveen;nvt;LM_20190916;Vecht;;;
305;76571;NL11;SAP-xx;Beperken waterstroom vanuit achterland Stichts Ankeveense Plassen;P-belasting verlagen;;SGBP2 2015-2021;2015-2021;IN02;;WB;NL11_6_3;NL11_6_3;1;n;j;Waterschap Amstel Gooi en Vecht;Investering per planperiode=0.00|Beheer en Onderhoud per planperiode=0.00;1;0;0;0;0;0;ESF1;planvorming WGP NVP;geen;;;;0.76287122;78.8;0;70;0;ja;nee;0;;;0.65;mg/m2/dag;;;1;Stichts Ankeveen;2021;LM_20190916;Vecht;;;
306;76541;NL11;GEB-y;Maatregelen landbouw om nutrientenbelasting op de waterlichamen te beperken fase 1;P-belasting verlagen;;SGBP2 2015-2021;2015-2021;BR01;Deze maatregel wordt uitgevoerd in meerdere waterlichamen: Amstellandboezem, Vaarten Ronde Hoep, Vaarten Groot Mijdrecht, Vaarten Westeramstel, Vaarten Ronde Venen, Vaarten Zevenhoven, Tussenboezem Vinkeveen a, TussenboezemVinkeveen b, Vinkeveense Plassen, Vecht, Vaarten Vechtstreek, Stichts nkeveense Plassen, Kortenhoefse Plassen, Spiegelplas, Wijde Blik, Loosdrechtse Plassen, Steren Zodden, Molenpolder en Tienhoven;MW;NL11_6_3;NL11_6_3;1;n;j;Waterschap Amstel Gooi en Vecht;Investering per planperiode=0.00|Beheer en Onderhoud per planperiode=0.00;0;1;0;0;0;0;ESF1;stimuleren;DAW, agrarische collectieven, studieclubs, bedrijven;;;;33.38;78.8;0;70;0;ja;nee;geen landbouw na afkoppelen;;;0;mg/m2/dag;;NMI, 2019;1;Stichts Ankeveen;2021;LM_20190916;Vecht;;;
307;76533;NL11;91147;Onderzoek aankoop landbouwgrond;Onderzoek;;SGBP2 2015-2021;2015-2021;BR01;Onderzoek aankoop landbouwgrond op 1 locatie (iig 3 eigenaren = 20 ha);WB;NL11_6_3;NL11_6_3;1;n;j;Provincie Noord-Holland;Investering per planperiode=0.00|Beheer en Onderhoud per planperiode=0.00;1;0;0;0;0;0;ESF1;?;DAW, agrarische collectieven, studieclubs, bedrijven;;;;0.76287122;78.8;0;70;0;ja;nee;;;;0;nvt;;;1;Stichts Ankeveen;2021;LM_20190916;Vecht;;;
308;76564;NL11;NL11_0157;Vispasseerbaar maken van sluizen, gemalen en stuwen - fase 2;Vis;;SGBP2 2015-2021;2015-2021;IN15;Het gaat om een de Wit-passage (2-zijdig) bij stuw de Googh tussen Stichts Ankeveen en de Spiegelplas. Wordt het gemaal ook visveilig gemaakt?;MW;NL11_6_3;NL11_6_3;4;n;j;Waterschap Amstel Gooi en Vecht;Investering per planperiode=0.00|Beheer en Onderhoud per planperiode=0.00;1;0;0;0;0;0;ESF5;loopt;geen;;;;;78.8;0;70;0;ja;nee;;;;0;nvt;0;;1;Stichts Ankeveen;2021;LM_20190916;Vecht;;;
309;76534;NL11;91149;Uitvoeren herstel- en inrichtingsmaatregelen Stichts Ankeveense plassen, fase 1;Open landschap herstellen;;SGBP2 2015-2021;2015-2021;BE06;De maatregel betreft het verwijderen van boom- en groenopslag langs watergangen in het plassengebied.De maatregel wordt als onderdeel van één maatregelpakket (C10) door Natuurmonumenten uitgevoerd in het kader haar LIFE-subsidiecontract met de EU.De uitvoering van de maatregel loopt overeenkomstig de duur van het subsidiecontract van 2013 tot en met 2018. Deze maatregel heeft ook invloed op ESF4, habitatgeschiktheid.;WB;NL11_6_3;NL11_6_3;10.79;km;j;Natuurmonumenten;Investering per planperiode=0.00|Beheer en Onderhoud per planperiode=0.00;0;0;10.79;0;0;0;ESF2, ESF4;in uitvoering;;;;;;78.8;0;70;0;ja;nee;;55.16;;19.56;% van bebost;;;1;Stichts Ankeveen;2021;LM_20190916;Vecht;;;
310;;;;Uitvoeren herstel- en inrichtingsmaatregelen Stichts Ankeveense plassen;Open landschap herstellen;van de lijst halen. Is gelijk aan andere maatregel;SGBP3 2021-2027;2021-2027;BE06;De maatregel betreft het nog meer verwijderen van boom- en groenopslag langs watergangen in het plassengebied. Deze maatregel heeft ook invloed op ESF4, habitatgeschiktheid.;WB;NL11_6_3;NL11_6_3;10.79;km;j;Natuurmonumenten;Beheer en Onderhoud per planperiode=0.00|Investering per planperiode=120000.00;0;0;0;0;0;0;ESF2, ESF4;concept;;?;;;;78.8;0;70;0;ja;nee;;55.16;;;% van bebost;;;0;Stichts Ankeveen;2027;LM_20190916;Vecht;;;
417;;;;Intensivering van rietbeheer langs de oevers van alle plassen.;Open landschap herstellen;;SGBP3 2021-2027;2021-2027;;"Het gaat hier zowel om een eenmalige investering (aanbrengen bescherming tegen graas, verwijderen en afvoeren van bomen, infrastructurele aanpassingen zoals het aanleggen van een loswal en aanschaf boten) als om een uitbreiding van de stucturele financiering (SNL geld) voor een intensivering van het beheer en onderhoud, zodat hout beter verwijderd kan worden en takken kunnen worden afgevoerd.
Natuurmonumenten werkt uit waar het van belang is rietoevers te herstellen en verbeteren, waar kansrijke locaties liggen (daar waar de graasdruk niet te groot is en legakkers stevig genoeg zijn), waar infrastructurele maatregelen nodig zijn en schat de kosten van investeringen en structureel geintensiveerd rietbeheer.
Uiteindelijke omvang 95%";;NL11_6_3;NL11_6_3;;;;Provincie Noord-Holland;;0;0;0;0;0;0;ESF4;;Natuurmonumenten;?;SGBP3;;;78.8;0;70;0;ja;nee;;55.16;;75.44;% van bebost;;;0;;2027;LM_20191017;;;;
419;;;;Baggeren en aanbrengen voedselarme en slecht doorlatende bodem in het gebied ten zuiden van het Bergse pad (EAG 2).;Niet relevant;laten vervallen, tijdens WGP beoordeeld als NIET kosteneffectief en potentieel schadelijk;SGBP3 2021-2027;2021-2027;BE06;Dit om de voedselrijke waterbodem te verwijderen en wegzijging te verminderen. Een risico is dat de huidige woekernde waterplanten verdwijenen en daarmee een hydrofytenfilter verdwijnd. Deze maatregel kan daarom alleen worden uitgevoerd als er geen voedselrijk water meer uit de achterliggende polder richting EAG2 kan stromen.;WB;NL11_6_3;NL11_6_3;;;n;Waterschap Amstel Gooi en Vecht;Waterschap Amstel, Gooi en Vecht;0;0;0;0;0;0;ESF1, ESF3;vervallen;Natuurmonumenten;SGBP3;;;;78.8;0;70;0;ja;nee;;;;;nvt;;;0;Stichts Ankeveen;2027;LM_20190916;Vecht;;;
464;;NL11;;Ganzen beheren, structureel door populatiebeperking;Ganzen beheren;;SGBP3 2021-2027;2021-2027;BE08;Een maatregel in alle WLen waar een sterke graasdruk op helofyten bestaat. Door ganzenbeheer krijgen met name rietoevers meer kans tot ontwikkeling te komen, wat belangrijk is voor de instandhouding van de populatie Grote Karekiet en andere moerasvogels (Natura2000-doel). De provincie neemt noodmaatregelen (afvangen van ruiende ganzen en plaatsen van rasters bij bedreigde rietkragen), vooruitlopend op een structurele aanpak. Bij de aanleg van natuurvriendelijke oevers is het belangrijk jonge aanplant te beschermen (bijvoorbeeld met gaas) tegen vraat.;;NL11_6_3;NL11_6_3;;;;Provincie Noord-Holland;;0;0;0;0;0;0;ESF6;;Natuurmonumenten;;SGBP3;;;78.8;0;70;0;ja;nee;;;;1;1/0;;;0;;2027;GH_20191210;;;;
489;;;;Leidende principes vastleggen in beleid van het waterschap (KEUR) en omgevingsvisies (gemeenten, provincies) om natuurwaarden te behouden bij vervangen van beschoeiing en onderhoud plus communicatie bewoners;Natuurvriendelijk onderhouden EMERS;;SGBP3 2021-2027;2021-2027;;Geldt voor alle waterlichamen. ;;NL11_6_3;NL11_6_3;;;;Waterschap Amstel Gooi en Vecht;;0;0;0;0;0;0;ESF4, ESF6;;Gemeente Wijdemeren, Provincie Noord-Holland;SGBP3;;;;78.8;0;70;0;ja;nee;;;;1;1/0;;;0;;2027;GH_20191205;;;;
336;71395;;;Vispasseerbaar maken sluizen, gemalen en stuwen - fase 1;Vis;;SGBP1 2009-2015;2009-2015;;2-zijdige passage mogelijk: nieuw gemaal met Manshanden buisvijzels en een retourpomp.;;NL11_6_7;NL11_6_4;;;;Waterschap Amstel Gooi en Vecht;;0;0;1;0;0;0;ESF5;uitgevoerd;Natuurmonumenten;;;;2.115472296;269.1;6;40;0;ja;nee;;;;0;nvt;;;1;Kortenhoefseplassen;nvt;LM_20191017;Vecht;;;
311;71318;NL11;91016;Aanbrengen drempels om migratie bagger vanuit KH-achterland te vermijden (Groenewoud);?;Uitzoeken;SGBP1 2009-2015;2009-2015;IN02;;WB;NL11_6_7;NL11_6_4;1;n;n;Waterschap Amstel Gooi en Vecht;Investering per planperiode=122000.00|Beheer en Onderhoud per planperiode=0.00;0;0;1;0;0;0;ESF1;uitgevoerd;Natuurmonumenten;;;;2.115472296;269.1;6;40;0;ja;nee;;;;0;#N/B;;;1;Kortenhoefseplassen;2016;LM_20190916;Vecht;;;
312;71389;NL11;NL11_0182;Uitvoeren herstel- en inrichtingsmaatregelen Kortenhoefse plassen, fase 1 - effect 2;Baggeren;;SGBP1 2009-2015;2009-2015;BE04;Het gaat om het baggeren van ongeveer 22 hectare waterbodems in de gebieden het Hol en Suikerpot.;WB;NL11_6_6;NL11_6_4;66000;m3;j;Natuurmonumenten;Investering per planperiode=3432000.00|Beheer en Onderhoud per planperiode=0.00;0;0;0;66000;0;0;ESF3;gefaseerd naar SGBP2;Waterschap Amstel Gooi en Vecht;;;;2.115472296;269.1;6;40;0;ja;nee;0;;;0;% van overig ongeschikt;;;1;Kortenhoefseplassen;nvt;LM_20190916;Vecht;;;
313;71319;NL11;91017;Uitvoeren herstel- en inrichtingsmaatregelen Kortenhoefse plassen, fase 1 - effect 1;Open landschap herstellen;;SGBP1 2009-2015;2009-2015;BE02;De maatregel betreft het verwijderen van boom- en groenopslag langs watergangen in het legakkergebied van het centrale deel van de plas en rondom de petgaten.De maatregel wordt als onderdeel van één maatregelpakket met:- Uitvoeren herstel- en inrichtingsmaatregelen Hollands Ankeveense plassen, fase 1 - effect 1,- Uitvoeren herstel- en inrichtingsmaatregelen Stichts Ankeveense plassenen- Uitvoeren herstel- en inrichtingsmaatregelen Tienhovense plassendoor Natuurmonumenten in het kader haar LIFE-subsidiecontract met de EU uitgevoerd.De uitvoering van de maatregel loopt overeenkomstig de duur van het subsidiecontract van 2013 tot en met 2018.;WB;NL11_6_7;NL11_6_4;21.03;km;j;Natuurmonumenten;Beheer en Onderhoud per planperiode=0.00|Investering per planperiode=97000.00;0;0;0;21.03;0;0;ESF4;gefaseerd naar SGBP2;;;;;2.115472296;269.1;6;40;0;ja;nee;0;;;0;% van bebost;;;1;Kortenhoefseplassen;nvt;LM_20190916;Vecht;;;
314;71373;NL11;91161;Onderzoeken verbetering kwaliteit suppletiewater Horstermeer;Onderzoek;;SGBP1 2009-2015;2009-2015;S01;Het gaat om het onderzoeken van de mogelijkheden om de kwaliteit van het suppletiewater naar de Horstermeer te verbeteren, eventueel door het aanleggen van het helofytenfilter Korremof;WB;NL11_6_7;NL11_6_4;1;n;j;Waterschap Amstel Gooi en Vecht;Beheer en Onderhoud per planperiode=0.00|Investering per planperiode=25000.00;0;0;1;0;0;0;ESF1;uitgevoerd;Natuurmonumenten;;;;2.115472296;269.1;6;40;0;ja;nee;;;;0;nvt;;;1;Kortenhoefseplassen;2016;LM_20190916;Vecht;;;
315;71380;NL11;NL11_0145;Toepassen ecologisch onderhoud oevers hoofdwateren - fase 1;Natuurvriendelijk onderhouden EMERS;is deze maatregl wel relevant voor Kortenhoef?;SGBP1 2009-2015;2009-2015;BE03;Een gebiedsbrede maatregel in alle waterlichamen;MW;weg?;NL11_6_4;30;n;j;Waterschap Amstel Gooi en Vecht;Investering per planperiode=0.00|Beheer en Onderhoud per planperiode=390000.00;0;0;325;0;0;0;ESF4;uitgevoerd;Natuurmonumenten;;;;2.115472296;269.1;6;40;0;ja;nee;0;;;0;1/0;;;1;Kortenhoefseplassen;2016;LM_20190916;Vecht;;;
316;71372;NL11;91156;Stoppen bemesten van gronden van NM met kortlopende overeenkomsten;P-belasting verlagen;;SGBP1 2009-2015;ook het hol?;IM08;"De oorspronkelijke kwantitatieve doelstelling van de maatregel was het uitvoeren van de beheermaatregel op 154 hectare in het plassengebied opgedeeld in:	Het stoppen van bemesten op 30 hectare in het gebied van Hollands Ankeveense plas	Het stoppen van bemesten op 55 hectare in het gebied van Stichts Ankeveense plas	Het stoppen van bemesten op 69 hectare in het gebied van de Kortenhoefse plassen";MW;NL11_6_7;NL11_6_4;0.0001;km;j;Natuurmonumenten;Investering per planperiode=0.00|Beheer en Onderhoud per planperiode=27900.00;0;0;0;0.0001;0;0;ESF1;gefaseerd, komt niet meer terug?;;;;;2.115472296;269.1;6;40;0;ja;nee;0;;;0;mg/m2/dag;;;1;Kortenhoefseplassen;nvt;LM_20190916;Vecht;;;
317;71357;NL11;91124;Realiseren P-reductie rwzi Horstermeer (autonoom);P-belasting verlagen;;SGBP1 2009-2015;2009-2015;IM01;Het gaat om het realiseren van maatregelen om de rwzi aan de wettelijke lozingseisen te laten voldoen;MW;NL11_6_7;NL11_6_4;1;n;j;Waterschap Amstel Gooi en Vecht;Investering per planperiode=10500000.00|Beheer en Onderhoud per planperiode=0.00;0;0;1;0;0;0;ESF1;uitgevoerd;geen;;;;2.115472296;269.1;6;40;0;ja;nee;;;;0;mg/m2/dag;;;1;Kortenhoefseplassen;2016;LM_20190916;Vecht;;;
318;76550;NL11;KH-y;Graven petgaten en plaggen t.b.v. jonge verlandingen Kortenhoefse Plassen - Oostzijde;Niet relevant;;SGBP2 2015-2021;2015-2021;IN20;LIFE+ maatregel C5. Deze maatregel heeft ook invloed op ESF4, habitatgeschiktheid.;WB;NL11_6_7;NL11_6_4;1;n;j;Natuurmonumenten;Investering per planperiode=0.00|Beheer en Onderhoud per planperiode=0.00;0;0;1;0;0;0;ESF1, ESF4;uitgevoerd;;;;;2.115472296;269.1;6;40;0;ja;nee;;;;0;nvt;;;1;Kortenhoefseplassen;2021;LM_20190916;Vecht;;;
319;76519;NL11;91017;Uitvoeren herstel- en inrichtingsmaatregelen Kortenhoefse plassen, fase 1 - effect 1;Open landschap herstellen;;SGBP2 2015-2021;2015-2021;BE02;De maatregel betreft het verwijderen van boom- en groenopslag langs watergangen in het legakkergebied van het centrale deel van de plas en rondom de petgaten. De maatregel wordt door Natuurmonumenten in het kader haar LIFE-subsidiecontract met de EU uitgevoerd, als onderdeel van maatregelpakket C.10De uitvoering van de maatregel loopt overeenkomstig de duur van het subsidiecontract van 2013 tot en met 2018. Deze maatregel heeft ook effect op ESF1 en ESF7.;WB;NL11_6_7;NL11_6_4;21.03;km;j;Natuurmonumenten;Investering per planperiode=0.00|Beheer en Onderhoud per planperiode=0.00;0;0;21.03;0;0;0;ESF2, ESF1, ESF7;uitgevoerd;;;;;2.115472296;269.1;6;40;0;ja;nee;0;107.64;;19.54;% van bebost;;;1;Kortenhoefseplassen;2021;LM_20190916;Vecht;;;
320;76547;NL11;KH-x;Beperken externe fosfaatbelasting EAG3 vanuit Anko Zuid;P-belasting verlagen;;SGBP2 2015-2021;2015-2021;IM12;Defosfatering ANKO-zuid: is de uitvoering van deze maatregel SGBP2 of SGBP3? Bij het plan voor de defosfatering wenst Natturmonumenten een aanvullend onderzoek naar de gevolgen voor rietontwikkeling. Dit zou kunnen door bodemchemische metingen in de rietzone uit te voeren. ;WB;NL11_6_7;NL11_6_4;1;n;j;Waterschap Amstel Gooi en Vecht;Investering per planperiode=0.00|Beheer en Onderhoud per planperiode=0.00;1;0;0;0;0;0;ESF1;planvorming;geen;;;;2.115472296;269.1;6;40;0;ja;nee;;;;0.341;mg/m2/dag;;;1;Kortenhoefseplassen;2021;LM_20190916;Vecht;;;
321;76548;NL11;KH-xx;Beperken fosfaatbelasting Hilversums Kanaal;P-belasting verlagen;ook voor plassen?;SGBP2 2015-2021;2015-2021;IM12;Deze maatregel wordt uitgevoerd in waterlichaam Kortenhoefse Plassen, maar heeft ook effect voor waterlichaam Wijde Blik.  ;MW;NL11_6_8;NL11_6_4;1;n;j;Waterschap Amstel Gooi en Vecht;Investering per planperiode=0.00|Beheer en Onderhoud per planperiode=0.00;1;0;0;0;0;0;ESF1;gefaseerd alleen voorbereiding SGBP2;geen;;;;2.115472296;269.1;6;40;0;ja;nee;0;;;0;mg/m2/dag;;;1;Kortenhoefseplassen;2021;LM_20190916;Vecht;;;
322;76517;NL11;91009;Aanpassen RWZI Horstermeer (kwaliteit effluent verdergaand verbeteren na evaluatie);P-belasting verlagen;;SGBP2 2015-2021;2015-2021;IM01;;MW;NL11_6_7;NL11_6_4;1;n;j;Waterschap Amstel Gooi en Vecht;Investering per planperiode=0.00|Beheer en Onderhoud per planperiode=0.00;0;0;1;0;0;0;ESF1;uitgevoerd;geen;;;;2.115472296;269.1;6;40;0;ja;nee;;;;?;mg/m2/dag;;;1;Kortenhoefseplassen;2018;LM_20190916;Vecht;;;
323;76541;NL11;GEB-y;Maatregelen landbouw om nutrientenbelasting op de waterlichamen te beperken fase 1;P-belasting verlagen;voegen we deze toe bij het hol? Zijn hier pakketten?;SGBP2 2015-2021;2015-2021;BR01;Deze maatregel wordt uitgevoerd in meerdere waterlichamen: Amstellandboezem, Vaarten Ronde Hoep, Vaarten Groot Mijdrecht, Vaarten Westeramstel, Vaarten Ronde Venen, Vaarten Zevenhoven, Tussenboezem Vinkeveen a, TussenboezemVinkeveen b, Vinkeveense Plassen, Vecht, Vaarten Vechtstreek, Stichts nkeveense Plassen, Kortenhoefse Plassen, Spiegelplas, Wijde Blik, Loosdrechtse Plassen, Steren Zodden, Molenpolder en Tienhoven;MW;NL11_6_7;NL11_6_4;1;n;j;Waterschap Amstel Gooi en Vecht;Investering per planperiode=0.00|Beheer en Onderhoud per planperiode=0.00;0;1;0;0;0;0;ESF1;stimuleren;DAW, agrarische collectieven, studieclubs, bedrijven;;;;2.115472296;269.1;6;40;0;ja;nee;0;;;0;mg/m2/dag;;NMI, 2019;1;Kortenhoefseplassen;2021;LM_20190916;Vecht;;;
324;76518;NL11;91015;Herstelmaatregelen Kortenhoefse plassen fase 2, effect 1;Baggeren;;SGBP2 2015-2021;niet;BE04;Het baggeren van 37 ha petgaten in het plassengebied. Dit is niet uitgevoerd en staat niet meer op de planning voor SGBP2. Er wordt getwijfeld over nut en noodzaak (de waterbodem levert geen fosfor na en het is onduidelijk of de voedingstoffen in de waterbodem een risico zijn voor woekerende planten) en het is lastig uitvoerbaar gezien er geen geschikte locaties zijn voor een baggerdepot en geen middelen om de bagger verder af te voeren.;WB;NL11_6_7;NL11_6_4;37;m3;j;Natuurmonumenten;Investering per planperiode=0.00|Beheer en Onderhoud per planperiode=0.00;0;0;0;37;0;0;ESF3;moet dit gefaseerd?;Waterschap Amstel Gooi en Vecht;;;;2.115472296;269.1;6;40;0;ja;nee;;;;;% van overig ongeschikt;;;1;Kortenhoefseplassen;2021;LM_20190916;Vecht;;;
325;76549;NL11;KH-xxx;Herstel invloed kwelwater 't Hol en Suikerpot;Kwel herstellen;;SGBP2 2015-2021;2015-2021;IN02;WiBo geeft nu advies. Fase 2 advies komt in april 2020, dat is te laat om resulterende maatregelen op te nemen voor SGBP3.;WB;NL11_6_7;NL11_6_4;1;n;j;Waterschap Amstel Gooi en Vecht;Investering per planperiode=0.00|Beheer en Onderhoud per planperiode=0.00;1;0;0;0;0;0;ESF4, ESF1;gefaseerd alleen voorbereiding SGBP2;Natuurmonumenten;;;;2.115472296;269.1;6;40;0;ja;nee;;;;;ha;;;1;Kortenhoefseplassen;2021;LM_20190916;Vecht;;;
326;76551;NL11;KH-yy;Herstel jonge verlandingen Bruin Joost/ Kerkhof en moerasontwikkeling De Put ;Oeverstructuur verbeteren;;SGBP2 2015-2021;2015-2021;IN20;LIFE+ maatregel C6;WB;NL11_6_7;NL11_6_4;1;n;j;Natuurmonumenten;Investering per planperiode=0.00|Beheer en Onderhoud per planperiode=0.00;0;1;0;0;0;0;ESF4, ESF6;in uitvoering;;;;;2.115472296;269.1;6;40;0;ja;nee;;;;;% van overig ongeschikt;;;1;Kortenhoefseplassen;2021;LM_20190916;Vecht;;;
327;76552;NL11;KH-yyy;Herstel/ kwaliteitsverbetering Galigaanmoeras Het Hol;Oeverstructuur verbeteren;;SGBP2 2015-2021;2015-2021;IN20;LIFE+ maatregel C7;WB;NL11_6_6;NL11_6_4;1;n;j;Natuurmonumenten;Investering per planperiode=0.00|Beheer en Onderhoud per planperiode=0.00;0;0;1;0;0;0;ESF4, ESF6;uitgevoerd;;;;;2.115472296;269.1;6;40;0;ja;nee;;;;;% van overig ongeschikt;;;1;Kortenhoefseplassen;2021;LM_20190916;Vecht;;;
328;76553;NL11;KH-yyyy;Plaggen en herstel sloten t.b.v. jonge verlandingen Het Hol;Oeverstructuur verbeteren;;SGBP2 2015-2021;2015-2021;IN20;LIFE+ maatregel C8;WB;NL11_6_6;NL11_6_4;1;n;j;Natuurmonumenten;Investering per planperiode=0.00|Beheer en Onderhoud per planperiode=0.00;0;0;1;0;0;0;ESF4, ESF6;uitgevoerd;;;;;2.115472296;269.1;6;40;0;ja;nee;;;;;% van overig ongeschikt;;;1;Kortenhoefseplassen;2021;LM_20190916;Vecht;;;
329;76565;NL11;NL11_0182;Uitvoeren herstel- en inrichtingsmaatregelen Kortenhoefse plassen, fase 1 - effect 2;Baggeren;;SGBP2 2015-2021;2015-2021;BE04;Het gaat om het baggeren van ongeveer 22 hectare waterbodems in de gebieden het Hol en Suikerpot. Dit is alleen zinvol als de bagger buiten het gebied kan worden gebracht. Een depot in het gebied is onwenselijk. Winnie kan jij deze tekst aanvullen obv rapport Bware?;WB;NL11_6_6;NL11_6_4;66000;m3;j;Natuurmonumenten;Investering per planperiode=0.00|Beheer en Onderhoud per planperiode=0.00;66000;0;0;0;0;0;ESF3;Baggeren t Hol voor 2021 of faseren?;Provincie Noord-Holland, Waterschap Amstel, Gooi en Vecht;;;;2.115472296;269.1;6;40;0;ja;nee;0;;;0;% van overig ongeschikt;;;1;Kortenhoefseplassen;2021;LM_20190916;Vecht;;;
;;;;Baggeren en of bezanden in EAG 3 (Kortenhoef West).;Baggeren;;SGBP3 2021-2027;2021-2027;BE04;Baggeren is vooral bedoeld voor het op diepte brengen van sloten in t Hol. In de plassen van het Hol is het af te raden. Bovendien is de waterbodem in EAG 1 voedselrijk (totaal P). Dit kan pas als andere maatregelen zijn uitgevoerd en de toestand volgt. Er wordt getwijfeld over nut en noodzaak van baggeren in EAG3 (de waterbodem levert geen fosfor na en het is onduidelijk of de voedingstoffen in de waterbodem een risico zijn voor woekerende planten) en het is lastig uitvoerbaar gezien er geen geschikte locaties zijn voor een baggerdepot en geen middelen om de bagger verder af te voeren. Baggeren van EAG3 schrappen van de lijst met maatregelen?;;NL11_6_6;NL11_6_4;10;n;j;Waterschap Amstel Gooi en Vecht;;0;0;0;0;0;0;ESF3;"Faseren tot andere maatregelen zijn uitgevoerd; Er staat al baggeren 37 ha opgenomen voor SGBP2 (herstelmaatregelen fase1, effect2)";Natuurmonumenten;SGBP3;;;2.115472296;269.1;6;40;0;ja;nee;;;;;% van overig ongeschikt;;;0;Kortenhoefseplassen;2027;LM_20190916;Vecht;;;
;;;;Baggeren en of bezanden in EAG 1 (t Hol).;Baggeren;;SGBP3 2021-2027;2021-2027;BE04;Baggeren is vooral bedoeld voor het op diepte brengen van sloten in t Hol. In de plassen van het Hol is het af te raden. Bovendien is de waterbodem in EAG 1 voedselrijk (totaal P). Dit kan pas als andere maatregelen zijn uitgevoerd en de toestand volgt. Er wordt getwijfeld over nut en noodzaak van baggeren in EAG3 (de waterbodem levert geen fosfor na en het is onduidelijk of de voedingstoffen in de waterbodem een risico zijn voor woekerende planten) en het is lastig uitvoerbaar gezien er geen geschikte locaties zijn voor een baggerdepot en geen middelen om de bagger verder af te voeren. Baggeren van EAG3 schrappen van de lijst met maatregelen?;;NL11_6_7;NL11_6_4;10;n;j;Waterschap Amstel Gooi en Vecht;;0;0;0;0;0;0;ESF3;"Faseren tot andere maatregelen zijn uitgevoerd; Er staat al baggeren 37 ha opgenomen voor SGBP2 (herstelmaatregelen fase1, effect2)";Natuurmonumenten;SGBP3;;;2.115472296;269.1;6;40;0;ja;nee;;;;;% van overig ongeschikt;;;0;Kortenhoefseplassen;2027;LM_20190916;Vecht;;;
331;;;;Beperken externe fosfaatbelasting: Kerkelanden in Hilversums kanaal;P-belasting verlagen;;SGBP3 2021-2027;2021-2027;BR10;Beide bronnen worden gedefosfateerd: capaciteit van technische systemen is een aandachtspunt.;;NL11_6_8;NL11_6_4;9;n;j;Waterschap Amstel Gooi en Vecht;;0;0;0;0;0;0;ESF1;concept;geen;SGBP3;;;2.115472296;269.1;6;40;0;ja;nee;0;;;0.2143;mg/m2/dag;;;0;Kortenhoefseplassen;2027;LM_20190916;Vecht;;;
332;;;;Maatregelen landbouw om nutrientenbelasting op de waterlichamen te beperken in EAG4;P-belasting verlagen;;SGBP3 2021-2027;2021-2027;BR01;De belasting uit EAG 4 naar EAG 5 wordt met 20% verminderd (door afplaggen, uitkopen langjarige pachtcontracten, saneren vuilstort, aankopen en inrichten gronden NNN als nat schraalland in de zuidoost hoek van EAG4, PAS maatregel verminderen bemesting op verpachte gronden, opheffen lokale onderbemalingen).;;NL11_6_7;NL11_6_4;;;;Provincie Noord-Holland;;0;0;0;0;0;0;ESF1;concept;Natuurmonumenten;;SGBP3;;2.115472296;269.1;6;40;0;ja;nee;;;;0.0927;mg/m2/dag;;;0;Kortenhoefseplassen;2027;LM_20190916;Vecht;;;
