205;76570;NL11;NM-xxx;Herstel/ kwaliteitsverbetering t.b.v. veenmosrietlanden Naardermeer;nvt;SGBP2 2015-2021;2015-2021;IN20;LIFE+ maatregel C3;WB;NL11_4_1;1;n;j;Natuurmonumenten;Investering per planperiode=0.00|Beheer en Onderhoud per planperiode=0.00;0;0;1;0;0;0;NVT;;;;0.883261576;107.1180378;;;;;;1;Naardermeer;2021;LM_20190916;Vecht;;;
206;76577;NL11;x;Onderzoek vispasseerbaar maken sluizen, gemalen en stuwen ;nvt;SGBP2 2015-2021;2015-2021;S01;Gemaal Gaasperplas, defosfatering Naardermeer, Spiegelplas: gemaal en pilotproject inzet schutsluizen Spiegelplas ;MW;NL11_4_1;3;n;j;Waterschap Amstel Gooi en Vecht ;Investering per planperiode=0.00|Beheer en Onderhoud per planperiode=0.00;0;1;2;0;0;0;NVT;;;;;107.1180378;;;;0;;1;Naardermeer;2021;LM_20190916;Vecht;;;
207;;;;Aanleggen telemetrie om uitgemalen debiet te registren;p;SGBP3 2021-2027;2021-2027;IM12;om de water en stofstromen beter te kunnen volgen en sturen;WB;NL11_4_1;13;n;j;Waterschap Amstel Gooi en Vecht ;;0;0;0;0;0;0;ESF1;;;;0.883261576;107.1180378;"nog 10 % minder kuubs inl;aat";0.004483147;mg/m2/dag;;;;Naardermeer;2027;LM_20190916;Vecht;;;
208;;;;Verbeteren defosfatering;p;SGBP3 2021-2027;2021-2027;IM12;Het idee is dat de renovatie leidt tot een herstel van het rendement en sturing. Voor de uitvoering/ naleving van DVO is meer capaciteit nodig (bijvoorbeeld een zuiveringstechnoloog bij WSB). Moet dit een gebiedsbrede maatregel worden?;WB;NL11_4_1;12;n;j;Waterschap Amstel Gooi en Vecht ;;0;0;0;0;0;0;ESF1;;;;0.883261576;107.1180378;10 % extra verwijdering van de inlaat;0.004483147;mg/m2/dag;;;;Naardermeer;2027;LM_20190916;Vecht;;;
209;;;;Windonafhankelijke aflaat aanleggen;p;SGBP3 2021-2027;2021-2027;IM12;Deel 1: Om te voorkomen dat het peil niet naar de maximum stijgt en er onnodig water wordt uitgemalen. Dit wordt in eerste instantie gedaan door mindel van een aflaat naar ZBM, maar er is mogelijk ook een electromotor in de Molen nodig.;WB;NL11_4_1;11;n;j;Waterschap Amstel Gooi en Vecht ;;0;0;0;0;0;0;ESF1;;;;0.883261576;107.1180378;"nog 10 % minder kuubs inl;aat";0.004483147;mg/m2/dag;;;;Naardermeer;2027;LM_20190916;Vecht;;;
210;;;;Rooster plaatsen voor de defosfatering ;achteruitgang vermijden;SGBP3 2021-2027;2021-2027;IM12;10 mm spijlbreedte (al dan niet met bewegend scherm, hydrolox) om intrek van volwassen vis te voorkomen en ook om eventuele sterfte in de defosfatering te beperken (huidig traliescherm is 15 mm);;NL11_4_1;;;;Waterschap Amstel Gooi en Vecht ;;1;0;0;0;0;0;ESF5;loopt;;;;107.1180378;;;;;;;Naardermeer;2027;LM_20190916;Vecht;;;
211;;;;Uitrek van Schieraal mogelijk maken.;vis;SGBP3 2021-2027;2021-2027;IM12;Geadviseerd wordt om tijdens de trekperiode van (schier)aal, half augustus t/m november, in de avond te bemalen. Dit kan worden besproken met Natuurmonumenten en met de molenaars. De molenaars staan hiervoor open (tegen zeer geringe vergoeding voor maaltijden). De beste avonden om te malen zijn avonden met veel neerslag en wind, omstandigheden waarbij molenaars vaak moeten malen. Een aantal van zes avonden volstaat waarschijnlijk al om voor een herfstseizoen de uittrek van paling goed te faciliteren, maar meer avonden zijn natuurlijk beter. Ondanks het gegeven dat het malen in de avond (tot nu toe) niet heeft geleid tot het uitmalen van teveel water, moet er op worden gelet dat niet wordt bemaald als dat qua peilbeheer niet nodig is. Het is dan beter om te wachten op neerslag, desnoods een jaar later.;WB;NL11_4_1;;;;Waterschap Amstel Gooi en Vecht ;;1;0;0;0;0;0;ESF5;loopt;;;;107.1180378;;;;;;;Naardermeer;2027;LM_20190916;Vecht;;;
212;;;;Molen electrisch aandrijven (windonafhankelijke bemaling deel 2);p;SGBP3 2021-2027;2021-2027;IM12;Om te voorkomen dat het peil niet naar de maximum stijgt en er onnodig water wordt uitgemalen. Dit wordt in eerste instantie gedaan door mindel van een aflaat naar ZBM, maar er is mogelijk ook een electromotor in de Molen nodig.;WB;NL11_4_1;11;n;j;Waterschap Amstel Gooi en Vecht ;;0;0;0;0;0;0;ESF1;;;;0.883261576;107.1180378;verdiscoteerd in windonafhankelijk deel 1;0;mg/m2/dag;;;;Naardermeer;2027;LM_20190916;Vecht;;;
213;;;;Voorkomen dat aalscholvers buiten de geisoleerde kolonie in het water kunnen poepen.;p;SGBP3 2021-2027;2021-2027;IM06;Maatregelen om te vorkomen dat Aalscholvers broeden buiten de kolonie en langs de rand van het eiland in de Bovenste blik. Lastig in de uitvoering, omdat deze maatregelen in strijd zijn met vogelrichtlijn.;WB;NL11_4_1;;;;Natuurmonumenten;;0;0;0;0;0;0;ESF1;;;;0.883261576;107.1180378;;?;mg/m2/dag;;;;Naardermeer;2027;LM_20190916;Vecht;;;
214;;;;Baggeren Bovenste Blik;p;SGBP3 2021-2027;2021-2027;IM12;De voedselrijke en naleverende waterbodem wordt verwijderd.;;NL11_4_1;;;;Provincie Noord-Holland;;0;0;0;0;0;0;ESF1;;;;0.883261576;107.1180378;Ongeveer 87% van de nalevering wordt gereduceerd in de BB en de BB is 23% van het oppervlak van het NM. Niet in levering PBL.;0.296148;mg/m2/dag;;;;Naardermeer;2027;LM_20190916;Vecht;;;
215;76535;NL11;AMS-x;Beperken juveniele ganzen  (voortzetting);areaal beter;SGBP2 2015-2021;2015-2021;BE08;Deze maatregel wordt uitgevoerd in meerdere waterlichamen: Terra Nova, Loenderveen-Oost en Waterleidingplas. ;MW;NL11_3_9;1;n;j;Amsterdam;Investering per planperiode=0.00|Beheer en Onderhoud per planperiode=0.00;0;1;0;0;0;0;ESF6;;;;;7.459261991;;;;;;1;Waterleidingplas;2021;LM_20190916;Vecht;;;
216;71325;NL11;91046;Uitvoeren rioleringsmaatregelen Loosdrecht;;SGBP1 2009-2015;2009-2015;IM06;"Het gaat om het uitvoeren van 4 deelprojecten:1 Het saneren van ongerioleerde (vakantie)woningen in het deelgebied Egelshoek2 Het saneren van verkeerde aansluitingen rioolwaterafvoer op de hemelwaterafvoer onder de noemer ""Loos Terecht""3 Het saneren van verkeerde aansluitingen hemelwaterafvoer op de rioolwaterafvoer4 Het uitvoeren van een haalbaarheidstudie naar aanleg van verbeterd gescheiden stelsel rondom de Loosdrechtse plassen";WB;NL11_5_1;4;n;j;Gemeente Wijdemeren;Investering per planperiode=0.00|Beheer en Onderhoud per planperiode=0.00;0;0;1;3;0;0;ESF1;uitgevoerd;;;0.553;351.1334616;dit zit al verdisconteerd in huidige balans (mandemakers, 2018);0;mg/m2/dag;;;1;Loosdrechtseplassen;nvt;LM_20190916;Vecht;;;
217;71327;NL11;91052;Baggeren Weerslootgebied;;SGBP1 2009-2015;2009-2015;BE04;;WB;NL11_5_1;9000;m3;j;Natuurmonumenten;Investering per planperiode=124800.00|Beheer en Onderhoud per planperiode=0.00;0;0;9000;0;0;0;ESF1;uitgevoerd;;;0.553;351.1334616;dit zit al verdisconteerd in huidige balans (mandemakers, 2018);0;mg/m2/dag;;;1;Loosdrechtseplassen;2016;LM_20190916;Vecht;;;
218;71388;NL11;NL11_0181;Uitvoeren herstelmaatregelen Loosdrechtse plassen, peilbeheer;;SGBP1 2009-2015;2009-2015;IN14;Het gaat om het uitvoeren van de waterbeheermaatregelen om een flexibel peil tussen -1,05 en -1,2 m NAP in te stellen binnen een gebied van 1470 ha;WB;NL11_5_1;1;n;j;Waterschap Amstel Gooi en Vecht;Investering per planperiode=3262000.00|Beheer en Onderhoud per planperiode=0.00;0;0;1;0;0;0;ESF1;uitgevoerd;;;0.553;351.1334616;dit zit al verdisconteerd in huidige balans (mandemakers, 2018);0;mg/m2/dag;;;1;Loosdrechtseplassen;2016;LM_20190916;Vecht;;;
219;71390;NL11;NL11_0183;Uitvoeren herstelmaatregelen Loosdrechtse plassen, wateraan- en afvoer;;SGBP1 2009-2015;2009-2015;IN02;Het gaat om het uitvoeren van de volgende waterbeheermaatregelen:- Het saneren van bestaande sluislekken bij de Weer- en Kraainestersluis- Het terugpompen van schutwater bij de Weer, Kraainester- en Mijdense sluis- Het onderzoeken van de mogelijkheden om de wateraan- en afvoer van Molenpolder/Westbroek via Breukeleveense plas te verbeteren;WB;NL11_5_1;1;n;j;Waterschap Amstel Gooi en Vecht;Beheer en Onderhoud per planperiode=0.00|Investering per planperiode=1152000.00;0;0;1;0;0;0;ESF1;uitgevoerd;;;0.553;351.1334616;dit zit al verdisconteerd in huidige balans (mandemakers, 2018);0;mg/m2/dag;;;1;Loosdrechtseplassen;2016;LM_20190916;Vecht;;;
220;71394;NL11;NL11_0196;Aanleggen natuurvriendelijke oevers Loosdrechtse plassen;;SGBP1 2009-2015;2009-2015;IN07;Het gaat om de aanleg van natuurvriendelijke oevers langs hoofdwatergangen in polder Muieveld;WB;NL11_5_1;20;km;j;Waterschap Amstel Gooi en Vecht;Investering per planperiode=3232000.00|Beheer en Onderhoud per planperiode=0.00;0;0;13.1;6.9;0;0;ESF4;uitgevoerd;;;0.553;351.1334616;;3;ha;;;1;Loosdrechtseplassen;nvt;LM_20190916;Vecht;;;
221;71323;NL11;91028;Uitvoeren onderzoeken rondom Loosdrechtse plassen;;SGBP1 2009-2015;2009-2015;S01;Het gaat om het uitvoeren van deelonderzoeken:1  Onderzoeken mitigerende maatregelen voor effecten stopzetten onderbemaling vliegveld Hilversum2  Onderzoeken mogelijkheden (verbeterde) defosfatering in Nieuwe polder, Stergebied en rondom wateroverschot Bethunepolder3  Onderzoeken mogelijkheden visstandbeheer (aanleg paaigebieden voor Snoek)4  Onderzoeken mogelijkheden kosteneffectief bagger waterbodems langs westoever plassen5  Onderzoeken mogelijkheden verruimen flexibel peil plassen6  Onderzoeken mogelijkheden voor aanvullende aanleg natuurvriendelijke oevers;WB;NL11_5_1;6;n;j;Waterschap Amstel Gooi en Vecht;Beheer en Onderhoud per planperiode=0.00|Investering per planperiode=801000.00;0;0;1;0;0;5;NVT;;;;0.553;351.1334616;;;;;;1;Loosdrechtseplassen;nvt;LM_20190916;Vecht;;;
222;71379;NL11;NL11_0143;Onderzoeken herstelmaatregelen Loosdrechtse Plassen voor periode 2015-2021;;SGBP1 2009-2015;2009-2015;S01;Het gaat om de verkenning van de mogelijkheden om de natuur- en waterdoelen voor de Loosdrechtse plassen te bereiken.;WB;NL11_5_1;1;n;j;Gemeente X;Investering per planperiode=0.00|Beheer en Onderhoud per planperiode=0.00;0;0;1;0;0;0;NVT;;;;0.553;351.1334616;;;;;;1;Loosdrechtseplassen;2016;LM_20190916;Vecht;;;
223;;;;Instellen polderdoorstroomprincipe, waterbeheermaatregelen;;SGBP1 2009-2015;2009-2015;IN02;Het betreft alle waterbeheer- en inrichtingsmaatregelen die het waterschap in het kader van gebiedsafspraken met gebiedsactoren in het gebied van Ster en Zodden gaat uitvoerenVoorbeelden van maatregelen zijn:- Aanleggen duikers, stuwen- Graven nieuwe watergangen ;WB;NL11_5_1;1;n;j;Waterschap Amstel Gooi en Vecht;Beheer en Onderhoud per planperiode=0.00|Investering per planperiode=1246000.00;0;0;0;0;0;0;ESF1;;;;0.553;351.1334616;dit zit al verdisconteerd in huidige balans (mandemakers, 2018);0;mg/m2/dag;;;;Loosdrechtseplassen;2016;LM_20190916;Vecht;;;
224;71324;NL11;91039;Realiseren 10% minder kwel Bethunepolder;;SGBP1 2009-2015;2009-2015;IN14;Het gaat maatregelen die zowel voor de omliggende oppervlaktewater- als het onderliggde grondwaterlichaam van toepassing zijn. Daartoe is dit een samenwerkingsproject tussen waterschap AGV en de provincie Utrecht, onder regie van de laatstgenoemde organisatie.;MW;NL11_5_1;1;n;j;Provincie Utrecht;Investering per planperiode=3656250.00|Beheer en Onderhoud per planperiode=18000.00;0;0;1;0;0;0;ESF1;uitgevoerd;;;0.553;351.1334616;dit zit al verdisconteerd in huidige balans (mandemakers, 2018);0;mg/m2/dag;;;1;Loosdrechtseplassen;2016;LM_20190916;Vecht;;;
225;71380;NL11;NL11_0145;Toepassen ecologisch onderhoud oevers hoofdwateren - fase 1;;SGBP1 2009-2015;2009-2015;BE03;Een gebiedsbrede maatregel in alle waterlichamen;MW;NL11_5_1;325;km;j;Waterschap Amstel Gooi en Vecht;Investering per planperiode=0.00|Beheer en Onderhoud per planperiode=390000.00;0;0;325;0;0;0;ESF4;uitgevoerd;Uitvoering intern;;;351.1334616;;52.67001924;ha;;;1;Loosdrechtseplassen;2016;LM_20190916;Vecht;;;
226;76554;NL11;L-x;Beperken externe fosfaatbelasting Bethune overschot;p;SGBP2 2015-2021;2015-2021;IM12;Bethunewater via Waterleidingplas. Mandemakers schat effect in op 0.15. Er is een verschil tussen de balans van Mandemakers en die van Jan Willem;WB;NL11_5_1;1;n;j;Waterschap Amstel Gooi en Vecht ;Investering per planperiode=0.00|Beheer en Onderhoud per planperiode=0.00;1;0;0;0;0;0;ESF1;uitgevoerd;;;0.553;351.1334616;0;0.15;mg/m2/dag;;;1;Loosdrechtseplassen;2021;LM_20190916;Vecht;;;
227;76541;NL11;GEB-y;Maatregelen landbouw om nutrientenbelasting op de waterlichamen te beperken fase 1;p;SGBP2 2015-2021;2015-2021;BR01;Deze maatregel wordt uitgevoerd in meerdere waterlichamen: Amstellandboezem, Vaarten Ronde Hoep, Vaarten Groot Mijdrecht, Vaarten Westeramstel, Vaarten Ronde Venen, Vaarten Zevenhoven, Tussenboezem Vinkeveen a, TussenboezemVinkeveen b, Vinkeveense Plassen, Vecht, Vaarten Vechtstreek, Stichts nkeveense Plassen, Kortenhoefse Plassen, Spiegelplas, Wijde Blik, Loosdrechtse Plassen, Steren Zodden, Molenpolder en Tienhoven;MW;NL11_5_1;1;n;j;Waterschap Amstel Gooi en Vecht ;Investering per planperiode=0.00|Beheer en Onderhoud per planperiode=0.00;0;1;0;0;0;0;ESF1;stimuleren;DAW, agrarische collectieven, studieclubs, bedrijven;;33.38;351.1334616;waarschijnlijk bijna geen agrarische percelen die via Loosdrecht: alleen in stergebied. Let op dubbeltelling.;0;mg/m2/dag;;NMI, 2019;1;Loosdrechtseplassen;2021;LM_20190916;Vecht;;;
228;76566;NL11;NL11_0196;Aanleggen natuurvriendelijke oevers Loosdrechtse plassen;;SGBP2 2015-2021;2015-2021;IN07;loopt naar verwachting door vanuit SGBP-1(voortgangsrapportage 28 feb 2014 is nog 6,9 km in voorbereiding) ;WB;NL11_5_1;6.9;km;j;Waterschap Amstel Gooi en Vecht ;Investering per planperiode=0.00|Beheer en Onderhoud per planperiode=0.00;3.9;0;3;0;0;0;ESF4;deels uitgevoerd;;;0.553;351.1334616;;1.035;ha;;;1;Loosdrechtseplassen;2018;LM_20190916;Vecht;;;
229;76564;NL11;NL11_0157;Vispasseerbaar maken van sluizen, gemalen en stuwen - fase 2;vis;SGBP2 2015-2021;2015-2021;IN15;Het Loosdrecht gemaal is niet visveilig: er wordt nu bij voorkeur met een Vijzel gemalen omdat deze veiliger is voor vis dan een andere pomp? Bij de Mijdense sluis is een visvriendelijke Manshanden retourpomp neergezet. ;MW;NL11_5_1;4;n;j;Waterschap Amstel Gooi en Vecht;Investering per planperiode=0.00|Beheer en Onderhoud per planperiode=0.00;0;0;2;0;0;0;ESF5;uitgevoerd;intern onderhoud en beheer;;;351.1334616;;;aantal;0;;1;Loosdrechtseplassen;2021;LM_20190916;Vecht;;;
230;76555;NL11;L-X;Onderzoek drinkwaterwinning Loosdrecht;nvt;SGBP2 2015-2021;2015-2021;S01;Deze maatregel wordt uitgevoerd in meerdere waterlichamen: Loosdrechtse Plassen en Ster en Zodden.  ;MW;NL11_5_1;1;n;j;Provincie Noord-Holland;Investering per planperiode=0.00|Beheer en Onderhoud per planperiode=0.00;0;0;1;0;0;0;ESF1;;;;0.553;351.1334616;;0;mg/m2/dag;;;1;Loosdrechtseplassen;2021;LM_20190916;Vecht;;;
231;;;;Beperken fosfaatbelasting ism polder doorstroomprincipe ;p;SGBP2 2015-2021;2015-2021;IM12;de defosfateringen;WB;NL11_5_1;3;n;j;Waterschap Amstel Gooi en Vecht ;Investering per planperiode=0.00|Beheer en Onderhoud per planperiode=0.00;0;0;0;0;0;0;ESF1;;;;0.553;351.1334616;kwart van achterland;0.05525;mg/m2/dag;;;;Loosdrechtseplassen;nvt;LM_20190916;Vecht;;;
232;76521;NL11;91080;Uitvoeren herstel- en inrichtingsmaatregelen Tienhovense plassen, fase 1;areaal beter;SGBP2 2015-2021;2015-2021;BE06;De maatregel betreft het verwijderen van boom- en groenopslag langs watergangen in het legakkergebied van het centrale deel van de plas en rondom de petgaten.De maatregel wordt als onderdeel van één maatregelpakket (C10) door Natuurmonumenten uitgevoerd in het kader haar LIFE-subsidiecontract met de EU.De uitvoering van de maatregel loopt overeenkomstig de duur van het subsidiecontract van 2013 tot en met 2018. Deze maatregel heeft ook invloed op ESF4, habitatgeschiktheid.;WB;NL11_5_1;3.4;km;j;Natuurmonumenten;Investering per planperiode=0.00|Beheer en Onderhoud per planperiode=0.00;0;0;3.4;0;0;0;ESF2, ESF4;;;;0.553;351.1334616;;0.51;ha;;;1;Loosdrechtseplassen;2021;LM_20190916;Vecht;;;
233;76525;NL11;91093;Uitvoeren herstel- en inrichtingsmaatregelen Tienhovense Plassen, fase 2;baggeren;SGBP2 2015-2021;2015-2021;BE04;Het gaat om het baggeren van een geschatte 8 hectare eutrofe waterbodems in deTienhovense plassen.De maatregel wordt door Natuurmonumenten in het kader van haarLIFE-subsidiecontract met de EU uitgevoerd. (C12)De uitvoering van de maatregel loopt overeenkomstig de duur van hetLIFE-subsidiecontract van 2013 tot en met 2018. Deze maatregel heeft ook invloed op ESF4, habitatgeschiktheid.;WB;NL11_5_1;120000;m3;j;Natuurmonumenten;Investering per planperiode=0.00|Beheer en Onderhoud per planperiode=0.00;0;0;26500;0;0;93500;ESF2, ESF4;;;;0.553;351.1334616;Tienhoven terugbrengen in de balans;0;;;;1;Loosdrechtseplassen;nvt;LM_20190916;Vecht;;;
234;;;;Brasem verwijderen.;abb;SGBP3 2021-2027;2021-2027;BE01;Deze maatregel is pas zinvol nadat alle belastingmaatregelen genomen zijn en de externe belasting lager is dan de kritische grens. Deze maatregel heeft ook invloed op ESF2, lichtklimaat.;;NL11_5_1;1;n;j;Waterschap Amstel Gooi en Vecht ;;0;0;0;0;0;0;ESF1, ESF2;;;;0.553;351.1334616;;400;kg/;;;;Loosdrechtseplassen;2027;LM_20190916;Vecht;;;
235;;;;Frequentie riooloverstorten uit Nieuw en Oud Loosdrecht omlaag brengen door afkoppelen.;p;SGBP3 2021-2027;2021-2027;IM03;Dit is een autonome maatregel die door de gemeente wordt uitgevoerd.;;NL11_5_1;1;n;j;Waterschap Amstel Gooi en Vecht ;;0;0;0;0;0;0;ESF1;;;;0.553;351.1334616;schatting obv WGP Zuidelijke Vechtplassen;0.01;mg/m2/dag;;;;Loosdrechtseplassen;2027;LM_20190916;Vecht;;;
236;;;;Luwtestructuren voor het verkorten van strijklengte en verhogen draagkracht;luwte;SGBP3 2021-2027;2021-2027;IN20;Er wordt ook gekeken of permanente structuren geschikt zijn als nieuw ondiep areaal voor de ontwikkeling van waterriet (oevers). Dit is van groot belang voor de vogeldoelstellingen in dit gebied. Bij aanleg van oevers is een flauw talud van 1:15 van belang voor een goede ontwikkeling. De huidige taluds van 1:5 zijn vaak veel te steil.;;NL11_5_1;1;n;j;Waterschap Amstel Gooi en Vecht ;;0;0;0;0;0;0;ESF1;;;;0.553;351.1334616;verhoging kritische grens;?;mg/m2/dag;;;;Loosdrechtseplassen;2027;LM_20190916;Vecht;;;
237;;;;Zuiveren van afstromend regenwater (en mogelijke foutieve aansluiting);p;SGBP3 2021-2027;2021-2027;IM04;"Gegeven de gemeten fosforconcentraties in dit onderzoek en de door Waternet opgestelde waterbalans is de bijdrage van het verharde oppervlak aan de fosforvracht van de plassen bepaald op twaalf tot zestien procent. Doordat allerlei andere bronnen van fosfor op dit moment door Waternet worden aangepakt (of recent zijn aangepakt) neemt de procentuele bijdrage van het totale verharde oppervlak in het afvoergebied van de plassen toe naar zeventien tot maximaal drieëntwintig procent. De afstroming vanaf verhardingen op en rond het hoefijzer is verantwoordelijk voor negen tot maximaal zestien procent van de totale P-belasting van de Loosdrechtse plassen. De fosforbelasting van de plassen kan substantieel verlaagd worden door maatregelen te treffen waarmee het afstromende hemelwater wordt gezuiverd.
Hiervoor is de volgende combinatie van maatregelen aan te bevelen: 1) bronmaatregelen; 2) bodempassage en 3) op locaties waar een bodempassage niet inpasbaar is
of een onvoldoende rendement levert, wordt een lokale zuivering toegepast in de vorm van een lijngoot met fosforbindend filtermateriaal, een lamellenfilter en/of een hydrodynamische afscheider inclusief een substraatfilter.";;NL11_5_1;1;n;j;Gemeente Wijde meren & Hoogheemraadschap Amstel, Gooi en Vecht ;;0;0;0;0;0;0;ESF1;waarschijnlijk disproportionele kosten;Gemeente Wijdemeren;;0.553;351.1334616;0;0.04;mg/m2/dag;;;;Loosdrechtseplassen;2027;LM_20190916;Vecht;;;
238;;;;Maatregelen landbouw om nutrientenbelasting op de waterlichamen te beperken fase 2;p;SGBP3 2021-2027;2021-2027;BR01;In het stergebied is nog landbouwactiviteit, waarbij geimporteerd mest wordt uitgereden.;MW;NL11_5_1;1;n;j;Waterschap Amstel Gooi en Vecht ;Investering per planperiode=0.00|Beheer en Onderhoud per planperiode=0.00;0;0;0;0;0;0;ESF1;stimuleren;DAW, agrarische collectieven, studieclubs, bedrijven;;0.553;351.1334616;0;0.01;mg/m2/dag;;NMI, 2019;;Loosdrechtseplassen;2027;LM_20190916;Vecht;;;
239;;;;Ontvangstvoorziening vuilwatertanks, varende voorziening;p;SGBP3 2021-2027;2021-2027;IM06;Varend publiek toilet, idem voor Wijde Blik;;NL11_5_1;;;;?;;0;0;0;0;0;0;ESF1;;;;0.553;351.1334616;0;0;mg/m2/dag;;;;Loosdrechtseplassen;2027;LM_20190916;Vecht;;;
240;71337;NL11;91072;Uitvoeren herstelmaatregelen Loenderveen-Oost, fase 0 - effect 4;;SGBP1 2009-2015;2009-2015;BE01;Het gaat om het toepassen van actief biologisch beheer (visstand monitoren en vis wegvangen).De maatregel vormt één pakket met de andere drie maatregelen van fase 0 in dit gebied.;WB;NL11_5_3;230;ha;n;Gemeente Amsterdam;Beheer en Onderhoud per planperiode=0.00|Investering per planperiode=75000.00;0;0;230;0;0;0;ESF1;uitgevoerd;;;;9.499260324;ABB heeft geen effect op belasting of P-krit;0;mg/m2/dag;;;1;Loenderveenoost;2016;LM_20190916;Vecht;;;
241;71338;NL11;91073;Uitvoeren herstelmaatregelen Loenderveen-Oost, fase 1;;SGBP1 2009-2015;2009-2015;BE01;Het gaat om het toepassen van actief biologisch beheer (visstand monitoren en vis wegvangen).Dit is de voortzetting van de maatregel die al in de periode 2007-2009 is uitgevoerd.;WB;NL11_5_3;230;ha;j;Gemeente Amsterdam;Investering per planperiode=0.00|Beheer en Onderhoud per planperiode=12000.00;0;0;230;0;0;0;ESF1;uitgevoerd;;;;9.499260324;ABB heeft geen effect op belasting of P-krit;0;mg/m2/dag;;;1;Loenderveenoost;2016;LM_20190916;Vecht;;;
242;71339;NL11;91074;Uitvoeren waterbeheermaatregelen Loenderveen-Oost;;SGBP1 2009-2015;2009-2015;IN14;Het gaat om het aanpassen van de stuw aan de Lambertszkade en het instellen van flexpeil;WB;NL11_5_3;1;n;j;Waterschap Amstel Gooi en Vecht;Investering per planperiode=73000.00|Beheer en Onderhoud per planperiode=0.00;0;0;1;0;0;0;ESF1;uitgevoerd;;;;9.499260324;Flexpeil, effect al in balans huidige situatie, niet nog eens meerekenen. Effect niet hoog of zelfs negatief door de langere verblijftijd;0;mg/m2/dag;;;1;Loenderveenoost;2016;LM_20190916;Vecht;;;
243;71299;NL11;90170;Uitvoeren herstelmaatregelen Loenderveen-Oost, fase 2 - effect 2;;SGBP1 2009-2015;2009-2015;IN13;Het gaat om het aanvullend aanleggen van extra hectares vooroevers om zo een natuurlijke oevervegetatie (riet) tot ontwikkeling te laten komen.De maatregel is een voortzetting van de maatregel die al in de periode 2007-2009 is uitgevoerd. ;WB;NL11_5_3;0.1;ha;j;Gemeente Amsterdam;Investering per planperiode=73100.00|Beheer en Onderhoud per planperiode=0.00;0;0;0.1;0;0;0;ESF4;uitgevoerd;;;;9.499260324;;0.1;ha;;;1;Loenderveenoost;2016;LM_20190916;Vecht;;;
244;71333;NL11;91067;Uitvoeren herstelmaatregelen Loenderveen-Oost, fase 0 - effect 1;;SGBP1 2009-2015;2009-2015;BE03;Het gaat om een beheer/herstel van 500 m legakkers door het jaarlijks verwijderen van nieuwe boomopslag, maaien en afvoeren van maaisel. De maatregel vormt één pakket met de andere 3 maatregelen van fase 0 in dit gebied;WB;NL11_5_3;0.5;km;n;Gemeente Amsterdam;Investering per planperiode=6825.00|Beheer en Onderhoud per planperiode=0.00;0;0;0.5;0;0;0;ESF4;uitgevoerd;;;;9.499260324;;0.075;ha;;;1;Loenderveenoost;2016;LM_20190916;Vecht;;;
245;71334;NL11;91068;Uitvoeren herstelmaatregelen Loenderveen-Oost, fase 2 - effect 1;;SGBP1 2009-2015;2009-2015;BE03;Het gaat om het beheer van 500 meter legakkers door het jaarlijks verwijderen van nieuwe boom- en groenopslag. maaien, e.d.De maatregel is een voortzetting van de maatregel uit de periode 2007-2009;WB;NL11_5_3;0.5;km;j;Gemeente Amsterdam;Investering per planperiode=0.00|Beheer en Onderhoud per planperiode=0.00;0;0;0.5;0;0;0;ESF4;uitgevoerd;;;;9.499260324;;0.075;ha;;;1;Loenderveenoost;2016;LM_20190916;Vecht;;;
246;71335;NL11;91069;Uitvoeren herstelmaatregelen Loenderveen Oost, fase 0 - effect 2;;SGBP1 2009-2015;2009-2015;IN13;Het gaat om de aanleg van vooroevers om zo een natuurlijke oevervegetatie (riet) tot ontwikkeling te laten komenDe maatregel vormt één pakket met de andere drie maatregelen van fase 0 in dit gebied.;WB;NL11_5_3;0.3;ha;n;Gemeente Amsterdam;Beheer en Onderhoud per planperiode=0.00|Investering per planperiode=600000.00;0;0;0.3;0;0;0;ESF4;uitgevoerd;;;;9.499260324;;0.3;ha;;;1;Loenderveenoost;2016;LM_20190916;Vecht;;;
247;71336;NL11;91071;Uitvoeren herstelmaatregelen Loenderveen-Oost, fase 0 - effect 3;;SGBP1 2009-2015;2009-2015;IN12;Het gaat om de reconstructie van 10 poelen en 5 slenken/eilanden.De maatregel vormt één pakket met de andere drie maatregelen van fase 0 in dit gebied.;WB;NL11_5_3;0.1;ha;n;Gemeente Amsterdam;Investering per planperiode=40000.00|Beheer en Onderhoud per planperiode=0.00;0;0;0.1;0;0;0;ESF4;uitgevoerd;;;;9.499260324;;0.1;ha;;;1;Loenderveenoost;2016;LM_20190916;Vecht;;;
248;71380;NL11;NL11_0145;Toepassen ecologisch onderhoud oevers hoofdwateren - fase 1;;SGBP1 2009-2015;2009-2015;BE03;Een gebiedsbrede maatregel in alle waterlichamen;MW;NL11_5_3;325;km;j;Waterschap Amstel Gooi en Vecht;Investering per planperiode=0.00|Beheer en Onderhoud per planperiode=390000.00;0;0;325;0;0;0;ESF4;uitgevoerd;Uitvoering intern;;;9.499260324;;1.424889049;ha;;;1;Loenderveenoost;2016;LM_20190916;Vecht;;;
249;76535;NL11;AMS-x;Beperken juveniele ganzen  (voortzetting);areaal beter;SGBP2 2015-2021;2015-2021;BE08;Deze maatregel wordt uitgevoerd in meerdere waterlichamen: Terra Nova, Loenderveen-Oost en Waterleidingplas. ;MW;NL11_5_3;1;n;j;Amsterdam;Investering per planperiode=0.00|Beheer en Onderhoud per planperiode=0.00;0;1;0;0;0;0;ESF4;;;;;9.499260324;;?;;;;1;Loenderveenoost;2021;LM_20190916;Vecht;;;
250;76535;NL11;AMS-x;Beperken juveniele ganzen  (voortzetting);areaal beter;SGBP2 2015-2021;2015-2021;BE08;Deze maatregel wordt uitgevoerd in meerdere waterlichamen: Terra Nova, Loenderveen-Oost en Waterleidingplas. ;MW;NL11_5_4;1;n;j;Amsterdam;Investering per planperiode=0.00|Beheer en Onderhoud per planperiode=0.00;0;1;0;0;0;0;ESF6;;;;;35.59744607;;;;;;1;TerraNova;2021;LM_20190916;Vecht;;;
