109;76541;NL11;GEB-y;Maatregelen landbouw om nutrientenbelasting op de waterlichamen te beperken fase 1;P-belasting verlagen;;SGBP2 2015-2021;2015-2021;BR01;Deze maatregel wordt uitgevoerd in meerdere waterlichamen: Amstellandboezem, Vaarten Ronde Hoep, Vaarten Groot Mijdrecht, Vaarten Westeramstel, Vaarten Ronde Venen, Vaarten Zevenhoven, Tussenboezem Vinkeveen a, TussenboezemVinkeveen b, Vinkeveense Plassen, Vecht, Vaarten Vechtstreek, Stichts nkeveense Plassen, Kortenhoefse Plassen, Spiegelplas, Wijde Blik, Loosdrechtse Plassen, Steren Zodden, Molenpolder en Tienhoven;MW;NL11_2_7;NL11_2_7;1;n;j;Waterschap Amstel Gooi en Vecht;Investering per planperiode=0.00|Beheer en Onderhoud per planperiode=0.00;0;1;0;0;0;0;ESF1;stimuleren;DAW, agrarische collectieven, studieclubs, bedrijven;;;;33.38;11.6;0;1;0;nee;ja;0;;;0;mg/m2/dag;;NMI, 2019;1;VaartenGrootMijdrecht;2021;LM_20190916;Amstel;;;
110;76508;NL11;90912;Aanleg natuurvriendelijke oevers Marickenland;Areaal nieuw;;SGBP2 2015-2021;2015-2021;IN07;;WB;NL11_2_7;NL11_2_7;1;km;j;Waterschap Amstel Gooi en Vecht;Investering per planperiode=0.00|Beheer en Onderhoud per planperiode=0.00;1;0;0;0;0;0;ESF4;opzoeken;?;;;;45.66019328;11.6;0;1;0;nee;ja;;;;1;km;;;1;VaartenGrootMijdrecht;2021;LM_20190916;Amstel;;;
111;;;;Maatregelen landbouw om nutrientenbelasting op de waterlichamen te beperken fase 2;P-belasting verlagen;;SGBP3 2021-2027;2021-2027;BR01;Deze maatregel wordt uitgevoerd in meerdere waterlichamen: Amstellandboezem, Vaarten Ronde Hoep, Vaarten Groot Mijdrecht, Vaarten Westeramstel, Vaarten Ronde Venen, Vaarten Zevenhoven, Tussenboezem Vinkeveen a, TussenboezemVinkeveen b, Vinkeveense Plassen, Vecht, Vaarten Vechtstreek, Stichts nkeveense Plassen, Kortenhoefse Plassen, Spiegelplas, Wijde Blik, Loosdrechtse Plassen, Steren Zodden, Molenpolder en Tienhoven;MW;NL11_2_7;NL11_2_7;1;n;j;Waterschap Amstel Gooi en Vecht;Investering per planperiode=0.00|Beheer en Onderhoud per planperiode=0.00;0;0;0;0;0;0;ESF1;stimuleren;DAW, agrarische collectieven, studieclubs, bedrijven;SGBP3;;;33.38;11.6;0;1;0;nee;ja;0;;;3.332019695;mg/m2/dag;;NMI, 2019;0;VaartenGrootMijdrecht;2027;LM_20190916;Amstel;;;
112;;;;Beperking kwel door toepassing granietslijpsel;P-belasting verlagen;;SGBP3 2021-2027;2021-2027;IM12;Autonoom geen bezwaar, maar nog te weinig onderbouwing om dit direct in te zetten.;WB;NL11_2_7;NL11_2_7;1;n;j;Waterschap Amstel Gooi en Vecht;Investering per planperiode=0.00|Beheer en Onderhoud per planperiode=0.00;0;0;0;0;0;0;ESF1;opzoeken;geen;SGBP3;;;45.66019328;11.6;0;1;0;nee;ja;0;;;0.42;mg/m2/dag;;NMI, 2019;0;VaartenGrootMijdrecht;2027;LM_20190916;Amstel;;;
447;;;;Toepassen ecologisch onderhoud oevers hoofdwateren - fase 2;Natuurvriendelijk onderhouden EMERS en SUBMERS;;SGBP3 2021-2027;SGBP3 2021-2028;;Een maatregel in alle waterlichamen waar dat nog relevant is;;NL11_2_7;NL11_2_7;;;;Waterschap Amstel Gooi en Vecht;;0;0;0;0;0;0;ESF6;;Natuurmonumenten;SGBP3;;;;11.6;0;1;0;nee;ja;;;;1;1/0;;;0;VaartenGrootMijdrecht;2027;GH_20191205;;;;
454;;;;Natuurvriendelijk onderhoud lijnvormige secondaire watergangen ;Natuurvriendelijk onderhouden EMERS en SUBMERS;;SGBP3 2021-2027;SGBP3 2021-2028;;Een maatregel in alle EAG's waar dat relevant is;;NL11_2_7;NL11_2_7;;;;DAW;;0;0;0;0;0;0;ESF6;;Waterschap Amstel Gooi en Vecht;;;;;11.6;0;1;0;nee;ja;;;;1;1/0;;;0;VaartenGrootMijdrecht;2032;GH_20191205;;;;
474;;;;Leidende principes vastleggen in beleid van het waterschap (KEUR) en omgevingsvisies (gemeenten, provincies) om natuurwaarden te behouden bij vervangen van beschoeiing en onderhoud plus communicatie bewoners;Natuurvriendelijk onderhouden EMERS en SUBMERS;;SGBP3 2021-2027;2021-2027;;Geldt voor alle waterlichamen. ;;NL11_2_7;NL11_2_7;;;;Waterschap Amstel Gooi en Vecht;;0;0;0;0;0;0;ESF6;;Gemeente De Ronde Venen, Provincie Utrecht;SGBP3;;;;11.6;0;1;0;nee;ja;;;;1;1/0;;;0;VaartenGrootMijdrecht;2027;GH_20191205;;;;
113;71315;NL11;91005;Omleiden van regenwateruitlaten;P-belasting verlagen;;SGBP1 2009-2015;2009-2015;IN02;70-80% is eraf;WB;NL11_3_1;NL11_3_1;1;n;j;Gemeente Amsterdam;Beheer en Onderhoud per planperiode=0.00|Investering per planperiode=1300000.00;0;0;0;0;0;1;ESF1;loopt;Waterschap Amstel Gooi en Vecht;;;;24.85416852;9.1;83.3;16.7;0;nee;nee;0;;;0.24;mg/m2/dag;;;1;Sloterplas;nvt;LM_20190916;Amsterdam;;;
114;71316;NL11;91006;Uitvoeren maatregelen om Sloterplas van externe belasting te isoleren;P-belasting verlagen;;SGBP1 2009-2015;2009-2015;IN02;;WB;NL11_3_1;NL11_3_1;1;n;j;Waterschap Amstel Gooi en Vecht;Investering per planperiode=330000.00|Beheer en Onderhoud per planperiode=0.00;0;0;0;1;0;0;ESF1;in onderzoek;Gemeente Amsterdam;;;;24.85416852;9.1;83.3;16.7;0;nee;nee;;;;17.46;mg/m2/dag;;;1;Sloterplas;nvt;LM_20190916;Amsterdam;;;
115;71317;NL11;91007;Beperken van inlaten vanuit andere gebieden;P-belasting verlagen;;SGBP1 2009-2015;2009-2015;IN02;gemaal nico broekhuizen wordt geknepen, suizen waar doorheen gevaren wordt kunnen we niet tegenhouden door functie staat op vervangen;WB;NL11_3_1;NL11_3_1;1;n;j;Waterschap Amstel Gooi en Vecht;Beheer en Onderhoud per planperiode=0.00|Investering per planperiode=8000.00;0;0;0;0;1;0;ESF1;in onderzoek;Gemeente Amsterdam;;;;24.85416852;9.1;83.3;16.7;0;nee;nee;;;;?;mg/m2/dag;;;1;Sloterplas;nvt;LM_20190916;Amsterdam;;;
116;71301;NL11;90900;Verwijderen drijflagen op en rondom zwemwaterlocatie;Niet relevant;;SGBP1 2009-2015;2009-2015;BE03;Het betreft het verwijderen van drijfalgen op ongeveer 5 hectare in de plas;WB;NL11_3_1;NL11_3_1;0.0001;km;j;Waterschap Amstel Gooi en Vecht;Investering per planperiode=0.00|Beheer en Onderhoud per planperiode=12000.00;0;0;0;0;0;0.0001;NVT;opzoeken;Gemeente Amsterdam;;;;24.85416852;9.1;83.3;16.7;0;nee;nee;;;;0;nvt;;;1;Sloterplas;nvt;LM_20190916;Amsterdam;;;
117;71314;NL11;91002;Onderzoeken maatregelen rondom Sloterplas;Onderzoek;;SGBP1 2009-2015;2009-2015;S01;Het betreft het uitvoeren van drie deelonderzoeken:1 Onderzoeken mogelijkheden visstandbeheer2 Onderzoeken mogelijkheden aanleg helofytenfilter voor zuiveren afstromend hemelwater3 Onderzoeken mogelijkheden en effecten verondiepen Sloterplas met bagger;WB;NL11_3_1;NL11_3_1;3;n;j;Waterschap Amstel Gooi en Vecht;Beheer en Onderhoud per planperiode=0.00|Investering per planperiode=188000.00;0;0;3;0;0;0;ESF1, ESF4;opzoeken;Gemeente Amsterdam;;;;24.85416852;9.1;83.3;16.7;0;nee;nee;;;;0;nvt;;;1;Sloterplas;2016;LM_20190916;Amsterdam;;;
118;71380;NL11;NL11_0145;Toepassen ecologisch onderhoud oevers hoofdwateren - fase 1;Natuurvriendelijk onderhouden EMERS;;SGBP1 2009-2015;2009-2015;BE03;Een gebiedsbrede maatregel in alle waterlichamen;MW;NL11_3_1;NL11_3_1;30;n;j;Waterschap Amstel Gooi en Vecht;Investering per planperiode=0.00|Beheer en Onderhoud per planperiode=390000.00;0;0;325;0;0;0;ESF4;uitgevoerd;geen;;;;;9.1;83.3;16.7;0;nee;nee;;;;0;1/0;;;1;Sloterplas;2016;LM_20190916;Amsterdam;;;
119;76572;NL11;SL-x;Beperken fosfaatbelasting uit park en inliggende watergangen;P-belasting verlagen;;SGBP2 2015-2021;2015-2021;IM12;PLIKO proef (ijzerhoudende drains). Dit heeft alleen maar zin als de plas geisoleerd wordt. Op zichzelf staand levert dit onvoldoende beslating reductie op. In het park zelf is het duurzamer om op te hogen ipv te draineren.;WB;NL11_3_1;NL11_3_1;1;n;j;Waterschap Amstel Gooi en Vecht;Investering per planperiode=0.00|Beheer en Onderhoud per planperiode=0.00;1;0;0;0;0;0;ESF1;in onderzoek;Gemeente Amsterdam;;;;24.85416852;9.1;83.3;16.7;0;nee;nee;0;;;0.26;mg/m2/dag;;;1;Sloterplas;2021;LM_20190916;Amsterdam;;;
120;76573;NL11;SL-xx;Beperken interne belasting Sloterplas (waterbodem);P-belasting verlagen;;SGBP2 2015-2021;2015-2021;IM12;Dit zat ook in pakket, met isolatie en is niet zinvol te doen zonder isolatie.;WB;NL11_3_1;NL11_3_1;1;n;j;Waterschap Amstel Gooi en Vecht;Investering per planperiode=0.00|Beheer en Onderhoud per planperiode=0.00;1;0;0;0;0;0;ESF1;in onderzoek;Gemeente Amsterdam;;;;24.85416852;9.1;83.3;16.7;0;nee;nee;0;;;5.89;mg/m2/dag;;;1;Sloterplas;2021;LM_20190916;Amsterdam;;;
121;76515;NL11;91006;Isoleren Sloterplas van externe belasting;P-belasting verlagen;;SGBP2 2015-2021;2015-2021;IN02;gefaseerd;WB;NL11_3_1;NL11_3_1;1;n;j;Waterschap Amstel Gooi en Vecht;Investering per planperiode=0.00|Beheer en Onderhoud per planperiode=0.00;1;0;0;0;0;0;ESF1;in onderzoek;Gemeente Amsterdam;;;;24.85416852;9.1;83.3;16.7;0;nee;nee;0;;;17.46;mg/m2/dag;;;1;Sloterplas;2021;LM_20190916;Amsterdam;;;
122;76514;NL11;91003;Herstel natuurvriendelijke oevers volgens inrichtingsplan Sloterplas;Open landschap herstellen;maatregel gecorrigeerd;SGBP2 2015-2021;2015-2021;IN08;Dit is een oude maatregel, nooit ingetrokken (?) en geldt als bestaand plan. De oevers, ook die van het moerasgebied, zijn zwaar overgroeid door bomen. Het plan was om het rietland weer te herstellen.;WB;NL11_3_1;NL11_3_1;1;km;j;Gemeente Amsterdam;Investering per planperiode=0.00|Beheer en Onderhoud per planperiode=0.00;1;0;0;0;0;0;ESF2, ESF4;in onderzoek;Waterschap Amstel Gooi en Vecht;;;;24.85416852;9.1;83.3;16.7;0;nee;nee;;1.52152864;;65.7233767;% van bebost;;;1;Sloterplas;2021;LM_20190916;Amsterdam;;;reductie debiet, toename verblijftijd
123;;NL11;;Schutverlies?? Nieuwe doorvaarbare sluizen ;P-belasting verlagen;;SGBP3 2021-2027;2021-2027;IM12;Negatieve maatregel?? : de verwachting is dat dit geen grote impact heeft.;WB;NL11_3_1;NL11_3_1;1;n;j;Gemeente Amsterdam;opzoeken;0;0;0;0;0;0;ESF1;in onderzoek;Waterschap Amstel Gooi en Vecht;SGBP3;SGBP3;;24.85416852;9.1;83.3;16.7;0;nee;nee;0;;;0;mg/m2/dag;;;0;Sloterplas;2027;LM_20190916;Amsterdam;;;
124;;NL11;;Stimuleren filtering door quagga mossels;Mosselen stimuleren;;SGBP3 2021-2027;2021-2027;;Vooral in het westen-midden van de plas: structuur aanbrengen waar mossels op kunnen groeien.;WB;NL11_3_1;NL11_3_1;1;n;j;Waterschap Amstel Gooi en Vecht;opzoeken;0;0;0;0;0;0;ESF2;in onderzoek;Gemeente Amsterdam;SGBP3;;;;9.1;83.3;16.7;0;nee;nee;;;;1;1/0;;;0;Sloterplas;2027;LM_20190916;Amsterdam;;;
125;;;;Verplaatsten gemaal Nico broekhuizen?;P-belasting verlagen;;SGBP3 2021-2027;2021-2027;;Dit levert een zeer grote reductie in de fosforbelasting van de gehele polder (80%?).  Mogelijk onvoldoende om de belasting van de plas te reduceren tot onder de toelaatbare belasting, maar de kwaliteit van de polder en aanvoerwater kan hiermee wel veel verbeteren. ;;NL11_3_1;NL11_3_1;;;;Waterschap Amstel Gooi en Vecht;opzoeken;0;0;0;0;0;0;ESF1;in onderzoek;Gemeente Amsterdam;SGBP3;;;;9.1;83.3;16.7;0;nee;nee;;;;?;mg/m2/dag;;;0;Sloterplas;2027;LM_20190916;Amsterdam;;;
475;;;;Leidende principes vastleggen in beleid van het waterschap (KEUR) en omgevingsvisies (gemeenten, provincies) om natuurwaarden te behouden bij vervangen van beschoeiing en onderhoud plus communicatie bewoners;Natuurvriendelijk onderhouden EMERS;;SGBP3 2021-2027;2021-2027;;Geldt voor alle waterlichamen. ;;NL11_3_1;NL11_3_1;;;;Waterschap Amstel Gooi en Vecht;;0;0;0;0;0;0;ESF6;;Gemeente Amsterdam, Provincie Noord-Holland;SGBP3;;;;9.1;83.3;16.7;0;nee;nee;;;;1;1/0;;;0;;2027;GH_20191205;;;;
499;;;;Verondiepen zuidelijk deel Sloterplas;Verondiepen;"Verondiepen als aparte maatregel beschreven. Losgetrokken van de bovenstaande ""oude"" maatregel nr 122. Is dit SGBP2 of SGBP3?";SGBP2 2015-2021;2021-2027;;Deze maatregel staat in het bestuursvoorstel. Verondiepen van de plas voor vegetaties in het zuidelijk deel van de plas. Er wordt nog gekeken naar ontwerpen die technisch haalbaar zijn in andere delen van de plas. Deze levert alleen in een ondiep deel van de plas winst op. Deze maatregel heeft ook invloed op ESF4, habitatgeschiktheid. Als vooral diepe delen van de plas worden afgedekt, dan kan ook de wegzijging verminderen (ESF1) en de bodem afdekken (ESF1).;WB;NL11_3_1;NL11_3_1;9.02;ha;?;Gemeente Amsterdam;;1;0;0;0;0;0;ESF2, ESF4;in onderzoek;Waterschap Amstel Gooi en Vecht;SGBP2;SGBP2;;24.85416852;9.1;83.3;16.7;0;nee;nee;;;;9.02;ha;;;0;Sloterplas;2027;GtH;Amsterdam;;;
126;71321;NL11;91024;Beperken belasting Gaasperplas;P-belasting verlagen;;SGBP1 2009-2015;2009-2015;IN02;Het gaat om het uitvoeren van twee maatregelen:- Het aanleggen van een bypass voor afvoer van stedelijk water naar het gemaal,- Het verminderen van de afstroom van gebiedsvreemd water naar de plas door de aanleg van een dijk met vrijkomende grond vanuit de aanleg van de bypass.;WB;NL11_3_2;NL11_3_2;2;n;j;Waterschap Amstel Gooi en Vecht;Investering per planperiode=182000.00|Beheer en Onderhoud per planperiode=0.00;0;0;2;0;0;0;ESF1;uitgevoerd;Rijkswaterstaat;;;;3.87;28.8;35;30;0;nee;nee;belasting na Gaaspersingel: ;;;2.7;mg/m2/dag;;;1;Gaasperplas;2016;LM_20190916;Amsterdam;;;
127;71320;NL11;91023;Ecologisch onderhouden oevers Gaasperplas;Open landschap herstellen;;SGBP1 2009-2015;2009-2015;BE06;Het natuurvriendelijk onderhouden van de oevers van de plas door het verwijderen van boom- en groenopslag op de oevers.;WB;NL11_3_2;NL11_3_2;4;km;j;Groengebied Amstelland;Investering per planperiode=0.00|Beheer en Onderhoud per planperiode=0.00;0;0;4;0;0;0;ESF4;uitgevoerd;Waterschap Amstel Gooi en Vecht;;;;3.87;28.8;35;30;0;nee;nee;;;;0;% van bebost;;;1;Gaasperplas;2016;LM_20190916;Amsterdam;;;
128;71322;NL11;91026;Onderzoeken KRW-inrichtingsopgave in combinatie met woningbouw;Onderzoek;;SGBP1 2009-2015;2009-2015;S01;Het uitvoeren van een onderzoek naar de mogelijkheden om de inrichtingsopgave van 6,3 hectare natuurvriendelijke oevers in combinatie met woningbouwopgave;WB;NL11_3_2;NL11_3_2;1;n;n;Waterschap Amstel Gooi en Vecht;Investering per planperiode=0.00|Beheer en Onderhoud per planperiode=0.00;0;0;1;0;0;0;ESF4;opzoeken;geen;;;;3.87;28.8;35;30;0;nee;nee;;;;0;nvt;;;1;Gaasperplas;2016;LM_20190916;Amsterdam;;;
129;71380;NL11;NL11_0145;Toepassen ecologisch onderhoud oevers hoofdwateren - fase 1;Natuurvriendelijk onderhouden EMERS;;SGBP1 2009-2015;2009-2015;BE03;Een gebiedsbrede maatregel in alle waterlichamen;MW;NL11_3_2;NL11_3_2;30;n;j;Waterschap Amstel Gooi en Vecht;Investering per planperiode=0.00|Beheer en Onderhoud per planperiode=390000.00;0;0;325;0;0;0;ESF4;uitgevoerd;geen;;;;;28.8;35;30;0;nee;nee;;;;0;1/0;;;1;Gaasperplas;2016;LM_20190916;Amsterdam;;;
130;76577;NL11;x;Onderzoek vispasseerbaar maken sluizen, gemalen en stuwen ;Onderzoek;;SGBP2 2015-2021;2015-2021;S01;Gemaal Gaasperplas is niet visvriendelijk en niet vispasseerbaar. Het aanbod van vis is wel heel laag. Een viswering in de Gaaspersingel zou een overweging kunnen zijn. Voor aal is de vraag of er verbinding nodig moet zijn.;MW;NL11_3_2;NL11_3_2;3;n;j;Waterschap Amstel Gooi en Vecht;Investering per planperiode=0.00|Beheer en Onderhoud per planperiode=0.00;0;1;2;0;0;0;ESF5;opzoeken;geen;;;;;28.8;35;30;0;nee;nee;;;;0;nvt;;;1;Gaasperplas;2021;LM_20190916;Amsterdam;;;
131;76543;NL11;G-x;Plan structuurversterking Gaasperplas ism gebiedsontwikkeling;Areaal nieuw;;SGBP2 2015-2021;2015-2021;S04;De gemeente Amsterdam heeft in samenwerking met AGV een plan opgesteld voor structuurversterking van de Gaasperplas. Dit houdt onder ander in dat: er ondiepe zones worden aangelegd. Deze worden verbonden met de plas mits er geen bomen langs de waterlijn staan, geen vaarbeweging mogelijk is en dat daar waar er ondiepe zones gegraven moet de voedselrijkdom van de toekomstige bodem worden bepaald. Omvang onbekend, maar vast niet groot.;WB;NL11_3_2;NL11_3_2;1;n;j;Waterschap Amstel Gooi en Vecht;Investering per planperiode=0.00|Beheer en Onderhoud per planperiode=0.00;1;0;0;0;0;0;ESF4;opzoeken;Gemeente Amsterdam;;;;3.87;28.8;35;30;0;nee;nee;;;;1;km;;;1;Gaasperplas;2021;LM_20190916;Amsterdam;;;
132;;;;Afkoppelen Gaasperpark/ woonwijk Nellestein;P-belasting verlagen;;SGBP3 2021-2027;2021-2027;IM12;Zorgen dat er geen voedingsstoffen uit dit gebied komt: korte reactietijd bij storingen rioolgemaal en opsporen foutaansluitingen.;WB;NL11_3_2;NL11_3_2;1;n;j;Waterschap Amstel Gooi en Vecht;opzoeken;0;0;0;0;0;0;ESF1;in onderzoek;Gemeente Amsterdam, Groengebied Amstelland;SGBP3;;;3.87;28.8;35;30;0;nee;nee;Het is de vraag of dit een grote belasting is voor de plas?;;;0.395;mg/m2/dag;;;0;Gaasperplas;2027;LM_20190916;Amsterdam;;;
133;;;;Visvriendelijk maken gemaal;Vis;;SGBP3 2021-2027;2021-2027;;Het gemaal blijkt zeer visonvriendelijk te zijn. Het aanbod van vis is wel heel laag. Een viswering in de Gaaspersingel zou een overweging kunnen zijn. Voor aal is de vraag of er verbinding nodig moet zijn.;WB;NL11_3_2;NL11_3_2;;;j;Waterschap Amstel Gooi en Vecht;opzoeken;0;0;0;0;0;0;ESF5;onderzoeken;Groengebied Amstelland;SGBP3;;;3.87;28.8;35;30;0;nee;nee;;;;0;nvt;;;0;Gaasperplas;2027;LM_20190916;Amsterdam;;;
134;;;;Natuurlijk verloop oevers ipv harde beschoeiing op overgang land-water;Beschoeiing aanpassen;;SGBP3 2021-2027;2021-2027;;Let op Japanse duizendknoop, die zich gemakkelijk via grondverzet kan verspreiden. Omvang nog onbekend. ;;NL11_3_2;NL11_3_2;;;;Gemeente Amsterdam;opzoeken;0;0;0;0;0;0;ESF4;stimuleren;Waterschap Amstel Gooi en Vecht;SGBP3;SGBP3;;;28.8;35;30;0;nee;nee;;10.08;;10;% van beschoeid;;;0;Gaasperplas;2027;LM_20190916;Amsterdam;;;
135;;;;Verwijderen boom-, struik- en groenopslag langs de oevers;Open landschap herstellen;;SGBP3 2021-2027;2021-2027;BE06;We moeten meer kansen grijpen om gezamelijk met gemeente en groengebied het onderhoud te verbeteren. Dit moet worden opgehangen aan de structuurschets. Deze maatregel heeft ook invloed op ESF4, habitatgeschiktheid. Omvang:75% verwijderen, rest past in parklandschap;;NL11_3_2;NL11_3_2;;;;Waterschap Amstel Gooi en Vecht;opzoeken;0;0;0;0;0;0;ESF2, ESF4;stimuleren;Gemeente Amsterdam;SGBP3;;;3.87;28.8;35;30;0;nee;nee;;8.64;;30;% van bebost;;;0;Gaasperplas;2027;LM_20190916;Amsterdam;;;
436;;;;Verplaatsen inlaat polder Zuid Bijlmer;P-belasting verlagen;;SGBP3 2021-2027;2021-2027;;Al het water dat in de zomer wordt ingelaten stroomt nu door het park en de plas. De wens is om de inlaat te verplaatsen naar het zuidwesten van de polder zodat het inlaatwater niet door de plas hoeft te stromen en er alleen water wordt ingelaten om de plas op peil te houden.;;NL11_3_2;NL11_3_2;;;;Waterschap Amstel Gooi en Vecht;opzoeken;0;0;0;0;0;0;ESF1;;Gemeente Amsterdam, Groengebied Amstelland;SGBP3;;;3.87;28.8;35;30;0;nee;nee;;;;;mg/m2/dag;;;0;Gaasperplas;2027;LM_20190916;Amsterdam;;;
476;;;;Leidende principes vastleggen in beleid van het waterschap (KEUR) en omgevingsvisies (gemeenten, provincies) om natuurwaarden te behouden bij vervangen van beschoeiing en onderhoud plus communicatie bewoners;Natuurvriendelijk onderhouden EMERS;;SGBP3 2021-2027;2021-2027;;Geldt voor alle waterlichamen. ;;NL11_3_2;NL11_3_2;;;;Waterschap Amstel Gooi en Vecht;;0;0;0;0;0;0;ESF4, ESF6;;Gemeente Amsterdam, Provincie Noord-Holland;SGBP3;;;;28.8;35;30;0;nee;nee;;;;1;1/0;;;0;;2027;GH_20191205;;;;
136;71313;NL11;90999;Uitvoeren herstelmaatregelen Ouderkerkerplas;P-belasting verlagen;;SGBP1 2009-2015;2009-2015;IN14;Het gaat om het uitvoeren van de volgende waterbeheermaatregelen:- Het optimaliseren van de inlaat vanuit Bullewijk naar de plas- Het toestaan van peilfluctuatie in de plas met als doel het begroeibaar areaal voor waterplanten te vergroten;WB;NL11_3_3;NL11_3_3;2;n;j;Waterschap Amstel Gooi en Vecht;Investering per planperiode=73000.00|Beheer en Onderhoud per planperiode=0.00;0;0;2;0;0;0;ESF4;uitgevoerd;Gemeente Amsterdam, Groengebied Amstelland;;;;0.350153348;12;0;1;0;ja;nee;0;;;0.0976;mg/m2/dag;;;1;Ouderkerkerplas;2016;LM_20190916;Amsterdam;;;
137;71387;NL11;NL11_0179;"Onderzoeken ""Waarom het is, zoals het is?"" in Ouderkerkerplas";Onderzoek;;SGBP1 2009-2015;2009-2015;S01;Het uitvoeren van een watersysteemanalyse met als onderzoeksvragen:- Mogelijkheden voor ontwikkeling water- en oeverplanten- Onderzoeken effecten vogelstand- Onderzoeken mogelijkheden aanpak drijfalgen door herinrichting zwemwaterlocatie;WB;NL11_3_3;NL11_3_3;1;n;j;Waterschap Amstel Gooi en Vecht;Investering per planperiode=60000.00|Beheer en Onderhoud per planperiode=0.00;0;0;1;0;0;0;ESF1;opzoeken;geen;;;;0.350153348;12;0;1;0;ja;nee;;;;0;nvt;;;1;Ouderkerkerplas;2016;LM_20190916;Amsterdam;;;
138;71380;NL11;NL11_0145;Toepassen ecologisch onderhoud oevers hoofdwateren - fase 1;Natuurvriendelijk onderhouden EMERS;;SGBP1 2009-2015;2009-2015;BE03;Een gebiedsbrede maatregel in alle waterlichamen;MW;NL11_3_3;NL11_3_3;30;n;j;Waterschap Amstel Gooi en Vecht;Investering per planperiode=0.00|Beheer en Onderhoud per planperiode=390000.00;0;0;325;0;0;0;ESF4;uitgevoerd;geen;;;;;12;0;1;0;ja;nee;;;;0;1/0;;;1;Ouderkerkerplas;2016;LM_20190916;Amsterdam;;;
143;71395;;;Vispasseerbaar maken sluizen, gemalen en stuwen - fase 1;Vis;;SGBP1 2009-2015;2009-2015;;?;;NL11_3_3;NL11_3_3;;;;Waterschap Amstel Gooi en Vecht;;0;0;1;0;0;0;ESF5;uitgevoerd;Groengebied Amstelland;;;;;12;0;1;0;ja;nee;;;;0;nvt;;;1;Ouderkerkerplas;nvt;LM_20191017;Amsterdam;;;
139;76513;NL11;90999;Uitvoeren herstelmaatregelen Ouderkerkerplas;P-belasting verlagen;;SGBP2 2015-2021;2015-2021;IN14;Het gaat om het verder uitvoeren van de waterbeheermaatregelen (peilbeheer) om de inlaat naar de plas te optimaliseren en daarmee de belasting te verminderen.Het is de voortzetting van de maatregel uit de planperiode van SGBP-1.;WB;NL11_3_3;NL11_3_3;1;n;j;Waterschap Amstel Gooi en Vecht;Investering per planperiode=0.00|Beheer en Onderhoud per planperiode=0.00;0;0;1;0;0;0;ESF1;opzoeken;Gemeente Amsterdam, Groengebied Amstelland;;;;0.350153348;12;0;1;0;ja;nee;0;;;0.0976;mg/m2/dag;;;1;Ouderkerkerplas;2018;LM_20190916;Amsterdam;;;
140;;;;Zuurstoftoedienen bij waterbodem Ouderkerkerplas;P-belasting verlagen;;SGBP2 2015-2021;2015-2021;IM12;Hoe vaak vindt er evaluatie plaats? Wie organiseerdt dit?;WB;NL11_3_3;NL11_3_3;1;n;?;Waterschap Amstel Gooi en Vecht;Investering per planperiode=0.00|Beheer en Onderhoud per planperiode=0.00;0;0;1;0;0;0;ESF1;uitgevoerd;NUON;vastgesteld;;;0.350153348;12;0;1;0;ja;nee;0;;;?;mg/m2/dag;;;0;Ouderkerkerplas;2018;LM_20190916;Amsterdam;;;
141;;;;Het verhogen van flexpeil met 20 cm (maxpeil 20 cm verhogen). ;P-belasting verlagen;;SGBP3 2021-2027;2021-2027;IN14;Hoe hoger het winterpeil, des de minder kwel en inlaatbehoefte later in het jaar. Fundering is geen probleem. Verhogen waterpeil iig max peil weer terug naar -3.80 of liever 3.70. Nu is het peil -4.30 tot -3.90. De waakhoogte en stabiliteit van de dijklichamen moeten onderzocht worden. Veiligheid keringen ligt bij dijkenteam en resultaten komen optijd om deze maateregel op te nemen in SGBP3.;WB;NL11_3_3;NL11_3_3;1;n;j;Waterschap Amstel Gooi en Vecht;Investering per planperiode=0.00|Beheer en Onderhoud per planperiode=0.00;0;0;0;0;0;0;ESF1;initiëren;Gemeente Amsterdam, Groengebied Amstelland;SGBP3;;;0.350153348;12;0;1;0;ja;nee;een kwart van de kwel vermindert door deze maatregel;;;0.019611487;mg/m2/dag;;;0;Ouderkerkerplas;2027;LM_20190916;Amsterdam;;;
142;;;;Onderzoek beperken interne belasting Ouderkerkerplas (waterbodem);Onderzoek;;SGBP3 2021-2027;2021-2027;;;MW;NL11_3_3;NL11_3_3;;;;Waterschap Amstel Gooi en Vecht;;0;0;0;0;0;0;ESF1;initiëren;Groengebied Amstelland;SGBP3;;;;12;0;1;0;ja;nee;;;;0;nvt;;;0;Ouderkerkerplas;2027;LM_20190916;Amsterdam;;;
457;;NL11;;Ganzen beheren, structureel door populatiebeperking;Ganzen beheren;;SGBP3 2021-2027;2021-2027;BE08;Een maatregel in alle WLen waar een sterke graasdruk op helofyten bestaat. Door ganzenbeheer krijgen met name rietoevers meer kans tot ontwikkeling te komen, wat belangrijk is voor de instandhouding van de populatie Grote Karekiet en andere moerasvogels (Natura2000-doel). De provincie neemt noodmaatregelen (afvangen van ruiende ganzen en plaatsen van rasters bij bedreigde rietkragen), vooruitlopend op een structurele aanpak. Bij de aanleg van natuurvriendelijke oevers is het belangrijk jonge aanplant te beschermen (bijvoorbeeld met gaas) tegen vraat.;MW;NL11_3_3;NL11_3_3;;;;Provincie Noord-Holland;;0;0;0;0;0;0;ESF6;;Groengebied Amstelland;;SGBP3;;;12;0;1;0;ja;nee;;;;1;1/0;;;0;Ouderkerkerplas;2027;GH_20191205;;;;
477;;;;Leidende principes vastleggen in beleid van het waterschap (KEUR) en omgevingsvisies (gemeenten, provincies) om natuurwaarden te behouden bij vervangen van beschoeiing en onderhoud plus communicatie bewoners;Natuurvriendelijk onderhouden EMERS;;SGBP3 2021-2027;2021-2027;;Geldt voor alle waterlichamen. ;;NL11_3_3;NL11_3_3;;;;Waterschap Amstel Gooi en Vecht;;0;0;0;0;0;0;ESF4, ESF6;;Gemeente Ouder-Amstel, Provincie Noord-Holland;SGBP3;;;;12;0;1;0;ja;nee;;;;1;1/0;;;0;Ouderkerkerplas;2027;GH_20191205;;;;
144;71352;NL11;91115;Onderzoeken optimalisatie Vinkeveenboezem;Onderzoek;;SGBP1 2009-2015;2009-2015;IN02;Een onderzoek naar de mogelijkheden om de waterafvoer van een deel  van de tussenboezem via nieuw gemaal Mennonietenbuurt naar Amstel af te voeren.Onderzoek heeft geresulteerd in het aanleggen en vispasseerbaar maken van een nieuwe gemaal Pondskoekersluis;WB;NL11_3_4;NL11_3_4;1;n;j;Waterschap Amstel Gooi en Vecht;Investering per planperiode=2295000.00|Beheer en Onderhoud per planperiode=0.00;0;0;1;0;0;0;ESF1;uitgevoerd;Recreatie Midden-Nederland;;;;;296.9;19.4;50;0;ja;nee;geen: sgbp2;;;0;nvt;;;1;Vinkeveenseplassen;2016;LM_20190916;Amstel;;;
145;71353;NL11;91116;Defosfateren Vinkeveense plassen;P-belasting verlagen;;SGBP1 2009-2015;2009-2015;IM12;Het gaat om het toepassen van beheermaatregelen om de wateraanvoer naar de Vinkeveense plassen te defosfateren;WB;NL11_3_4;NL11_3_4;1;n;j;Waterschap Amstel Gooi en Vecht;Beheer en Onderhoud per planperiode=0.00|Investering per planperiode=4483000.00;0;0;1;0;0;0;ESF1;uitgevoerd;geen;;;;1.338040042;296.9;19.4;50;0;ja;nee;vermindering P conc van 0.2 mg/l naar 0.15 mg/l;;;0.284510011;mg/m2/dag;;evaluatie maatregelen tussenboezem Vinkeveen, 2016;1;Vinkeveenseplassen;2016;LM_20190916;Amstel;;;
