ident;DBID;Namespace;LokaalID;Naam;Vertaling naar doelen-model;SGBPPeriode.omschrijving;UitvoeringIn;KRWMaatregel.code;Toelichting;KRWMaatregelNiveau.code;HoortbijKRWWaterlichaam;OmvangNumeriekeWaarde;OmvangEenheid.code;OpnameInSGBPJN;Initiatiefnemer.naam;Kosten;Plan;Uitvoering;Uitgevoerd;Gefaseerd;Vervangen;Ingetrokken;esf;afweging;gebiedspartner (gesprekspartner bij financiering, uitvoering of beleid);kosten;totale belasting;totale oeverlengte;belastingreductie opmerking;omvang tov balansen 2018, ecologische toestand t/m 2017;eenheid;EKR;litteratuurverwijzing;wkp;WL_naam;Effect verwacht vanaf;aangepast;gebiedsteam;;;
1;;;;Aanleg NVO`s door te zoneren en afkalving door karpers te voorkomen.;;WIP 2019;;;;;2140-EAG-1;;;;;;1;0;0;0;0;0;ESF4, ;;;;;;;;;;;;Uithoornse polder;1;;Amstel;;;
2;;;;Verplaatsen inlaat van Bilderdam naar een Noordelijkere locatie in 2140-EAG-1 (Jan Ploegensluis).;;WIP 2019;;;Het inlaatwater legt nu een lange weg af door 2140-EAG-2 (en een deel van 2140-EAG-1) voordat het bij het opvoergemaal Kalslagerpolder komt (die water opvoert van 2140-EAG-1 naar EAG 6 en het Zijdelmeer). Een nieuwe inlaat belast het landbouwgebied minder.;;2140-EAG-2;;;;;;0;1;0;0;0;0;ESF1;;;;;;;;;;;;Westveense polder;2027;;Amstel;;;
3;;;;Verplaatsen inlaat naar het Noorden nabij de aflaatstuw (Varkenskade).;;WIP 2019;;;De inlaat ligt nu dichter bij de aflaat van dit EAG/ peilvak, zodat het inlaatwater minder door het gehele gebied heen trekt.;;2630-EAG-3;;;;;;0;0;1;0;0;0;ESF1, ESF4;;;;;;;;;;;;Sloterplas;2027;;Amsterdam;;;
4;;;;Verbreden en verdiepen watergangen?;;WIP 2019;;;Doel is berging en afvoer, maar ecologie proviteert mogelijk.;;6540-EAG-2;;;;;;0;0;0;0;0;0;ESF4;;;;;;;;;;;;;0;;#N/B;;;
5;71378;NL11;NL11_0142;Onderzoeken gebiedsbrede maatregelen - fase 1;;SGBP1 2009-2015;2009-2015;S01;"Het gaat om het uitvoeren van de volgende deelonderzoeken: Onderzoeken methode exotenbestrijding i.s.m. andere waterbeheerders, Onderzoeken stikstofbelasting AGV op boezem rijkswateren afwenteling, Onderzoeken ""Boeren als waterbeheerders"", Onderzoeken invloed inlaat IJmeerwater.";MA;MA;4;n;j;Waterschap Amstel Gooi en Vecht;Beheer en Onderhoud per planperiode=0.00|Investering per planperiode=1535000.00;0;0;4;0;0;0;NVT;realistisch;;;;;;;;;;1;;2016;LM_20190916;;;;
6;71382;NL11;NL11_0147;Ontwikkelen Volg- en StuurSysteem;;SGBP1 2009-2015;2009-2015;S06;Een gebiedsbreed project voor alle waterlichamen.;MA;MA;1;n;j;Waterschap Amstel Gooi en Vecht;Beheer en Onderhoud per planperiode=500000.00|Investering per planperiode=600000.00;0;0;1;0;0;0;NVT;;;;;;;;;;;1;;2016;LM_20190916;;;;
7;71384;NL11;NL11_0155;Onderzoeken gebiedsbrede maatregelen - fase 2;;SGBP1 2009-2015;2009-2015;S01;"Het gaat om het uitvoeren van de volgende deelonderzoeken: Onderzoeken mogelijkheden flexibel peilbeheer in veenweidegebied (""waarheen met het veen?""), Onderzoeken toestand (veen)bodem o.a. onder invloed van nitraatbelasting.";MA;MA;2;n;j;Waterschap Amstel Gooi en Vecht ;Investering per planperiode=150000.00|Beheer en Onderhoud per planperiode=0.00;0;0;2;0;0;0;NVT;buitenproportionele kosten;;;;;;;;;;1;;2016;LM_20190916;;;;
8;71385;NL11;NL11_0156;"Onderzoeken financiële haalbaarheid ""voorwaardelijk getemporiseerde maatregelen""";;SGBP1 2009-2015;2009-2015;S01;Een gebiedsbreed onderzoek voor alle waterlichamen.;MA;MA;1;n;j;Waterschap Amstel Gooi en Vecht;Beheer en Onderhoud per planperiode=0.00|Investering per planperiode=25000.00;0;0;1;0;0;0;NVT;;;;;;;;;;;1;;2016;LM_20190916;;;;
9;76538;NL11;GEB-xx;Onderzoek achterblijvende soortendiversiteit waterflora (planten);;SGBP2 2015-2021;2015-2021;S01;;MA;MA;1;n;j;Waterschap Amstel Gooi en Vecht ;Investering per planperiode=0.00|Beheer en Onderhoud per planperiode=0.00;0;1;0;0;0;0;NVT;;;;;;;;;;;1;#N/B;2021;LM_20190916;#N/B;;;
10;76539;NL11;GEB-xxx;Onderzoek achterblijven herstel vispopulaties;;SGBP2 2015-2021;2015-2021;S01;;MA;MA;1;n;j;Waterschap Amstel Gooi en Vecht ;Investering per planperiode=0.00|Beheer en Onderhoud per planperiode=0.00;1;0;0;0;0;0;NVT;;;;;;;;;;;1;#N/B;2021;LM_20190916;#N/B;;;
11;76537;NL11;GEB-x;Volgen en sturen;;SGBP2 2015-2021;2015-2021;BE08;;MA;MA;1;n;j;Waterschap Amstel Gooi en Vecht ;Investering per planperiode=0.00|Beheer en Onderhoud per planperiode=0.00;0;1;0;0;0;0;NVT;;;;;;;;;;;1;#N/B;2021;LM_20190916;#N/B;;;
12;76540;NL11;GEB-xxxx;Onderzoek woekeren waterplanten in vaarten en sloten;;SGBP2 2015-2021;2015-2021;S01;;MA;MA;1;n;j;Waterschap Amstel Gooi en Vecht ;Investering per planperiode=0.00|Beheer en Onderhoud per planperiode=0.00;1;0;0;0;0;0;NVT;;;;;;;;;;;1;#N/B;2021;LM_20190916;#N/B;;;
13;76563;NL11;NL11_0150;Ecologische onderhoud oevers hoofdwateren - fase 2;;SGBP2 2015-2021;2015-2021;BE03;Deze maatregel heeft ook invloed op ESF 6 verwijdering.;MA;MA;325;km;j;Waterschap Amstel Gooi en Vecht;Investering per planperiode=0.00|Beheer en Onderhoud per planperiode=0.00;0;325;0;0;0;0;ESF4, ESF6;;;;;;;;;;;1;#N/B;2021;LM_20190916;#N/B;;;
14;;;;Goede lanbouwpraktijk;;SGBP3 2021-2027;2021-2027;BR01;;MA;MA;;;;;;0;0;0;0;0;0;ESF1;afhankelijk van participatie van omgeving;;;;;;?;mg/m2/dag;;;;#N/B;2027;LM_20190916;#N/B;;;
15;;;;Goede waterbeheerpraktijk;;SGBP3 2021-2027;2021-2027;IM12;;MA;MA;;;;Waterschap Amstel Gooi en Vecht ;;0;0;0;0;0;0;ESF1;;;;;;;?;mg/m2/dag;;;;#N/B;2027;LM_20190916;#N/B;;;
16;;;;Goede rioleringspraktijk;;SGBP3 2021-2027;2021-2027;IM06;;MA;MA;;;;Waterschap Amstel Gooi en Vecht ;;0;0;0;0;0;0;ESF1;afhankelijk van participatie van omgeving;;;;;;?;mg/m2/dag;;;;#N/B;2027;LM_20190916;#N/B;;;
17;;;;Aanwezige natuurwaarden van oevers toetsen bij alle werken die door dijkverbetering worden uitgevoerd;;SGBP3 2021-2027;2021-2027;;;MA;MA;;;;;;0;0;0;0;0;0;ESF4;;;;;;;;;;;;;;;;;;
18;71310;NL11;90994;Onderzoeken toepassen andere oeverbeschoeiing;;SGBP1 2009-2015;2009-2015;S01;Het uitvoeren van een onderzoek naar de mogelijkheden om die delen van de boezem, waar geen ruimte in het profiel is voor de aanleg van natuurvriendelijke oevers, toch natuurvriendelijk in te richten.;WB;NL11_1_1;1;n;j;Waterschap Amstel Gooi en Vecht;Beheer en Onderhoud per planperiode=0.00|Investering per planperiode=30000.00;0;0;1;0;0;0;ESF4;opzoeken;intern toepassing zoeken;;;246.4832668;;;;;;1;Amstellandboezem;2016;LM_20190916;Amstel;;;
19;71395;NL11;NL11_0222;Vispasseerbaar maken sluizen, gemalen en stuwen - fase 1;;SGBP1 2009-2015;2009-2015;IN15;Bij de Ipenslotersluis en Diemerdammersluis wordt een vissluis aangelegd.;MW;NL11_1_1;7;n;j;Waterschap Amstel Gooi en Vecht;Investering per planperiode=1324000.00|Beheer en Onderhoud per planperiode=0.00;0;0;0;1;0;0;ESF5;gefaseerd;intern onderhoud en beheer;;14.12754631;246.4832668;;;;0;;1;Amstellandboezem;nvt;LM_20190916;Amstel;;;
20;71380;NL11;NL11_0145;Toepassen ecologisch onderhoud oevers hoofdwateren - fase 1;;SGBP1 2009-2015;2009-2015;BE03;Een gebiedsbrede maatregel in alle waterlichamen;MW;NL11_1_1;325;km;j;Waterschap Amstel Gooi en Vecht;Investering per planperiode=0.00|Beheer en Onderhoud per planperiode=390000.00;0;0;325;0;0;0;ESF4;uitgevoerd;Uitvoering intern;;;246.4832668;;36.97249002;ha;;;1;Amstellandboezem;2016;LM_20190916;Amstel;;;
21;76542;NL11;GEB-yy;Beperken belasting glastuinbouw;p;SGBP2 2015-2021;2015-2021;S05;Deze maatregel wordt genomen in waterlichaam Vaarten Westeramstel, maar heeft ook positief effect voor de Amstellandboezem. ;MW;NL11_1_1;1;n;j;Waterschap Amstel Gooi en Vecht ;Investering per planperiode=0.00|Beheer en Onderhoud per planperiode=0.00;0;1;0;0;0;0;ESF1;loopt;sector glastuinbouw, intern;;33.38;246.4832668;0;3.86;mg/m2/dag;;;1;Amstellandboezem;2021;LM_20190916;Amstel;;;
22;76541;NL11;GEB-y;Maatregelen landbouw om nutrientenbelasting op de waterlichamen te beperken fase 1;p;SGBP2 2015-2021;2015-2021;BR01;Deze maatregel wordt uitgevoerd in meerdere waterlichamen: Amstellandboezem, Vaarten Ronde Hoep, Vaarten Groot Mijdrecht, Vaarten Westeramstel, Vaarten Ronde Venen, Vaarten Zevenhoven, Tussenboezem Vinkeveen a, TussenboezemVinkeveen b, Vinkeveense Plassen, Vecht, Vaarten Vechtstreek, Stichts Ankeveense Plassen, Kortenhoefse Plassen, Spiegelplas, Wijde Blik, Loosdrechtse Plassen, Steren Zodden, Molenpolder en Tienhoven.;MW;NL11_1_1;1;n;j;Waterschap Amstel Gooi en Vecht ;Investering per planperiode=0.00|Beheer en Onderhoud per planperiode=0.00;0;1;0;0;0;0;ESF1;stimuleren;DAW, agrarische collectieven, studieclubs, bedrijven;;33.38;246.4832668;0;0;mg/m2/dag;;;1;Amstellandboezem;2021;LM_20190916;Amstel;;;
23;76536;NL11;AMS-y;Meeliften om luwe zones te creëren tbv vegetatie ontwikkeling;areaal nieuw;SGBP2 2015-2021;2015-2021;IN20;;WB;NL11_1_1;1;n;j;Provincie Noord-Holland;Investering per planperiode=0.00|Beheer en Onderhoud per planperiode=0.00;1;0;0;0;0;0;ESF4;opzoeken;Noord-Holland;;;246.4832668;;?;;;;1;Amstellandboezem;2021;LM_20190916;Amstel;;;
24;76567;NL11;NL11_0222;Vispasseerbaar maken sluizen, gemalen en stuwen - fase 1;;SGBP2 2015-2021;2015-2021;IN15;Bij de Ipenslotersluis en Diemerdammersluis wordt een vissluis aangelegd.;MW;NL11_1_1;2;n;j;Waterschap Amstel Gooi en Vecht ;Investering per planperiode=0.00|Beheer en Onderhoud per planperiode=0.00;1;0;0;0;0;0;ESF5;loopt;intern onderhoud en beheer;;14.12754631;246.4832668;;;;0;;1;Amstellandboezem;2021;LM_20190916;Amstel;;;
25;76564;NL11;NL11_0157;Vispasseerbaar maken van sluizen, gemalen en stuwen - fase 2;vis;SGBP2 2015-2021;2015-2021;IN15;;MW;NL11_1_1;4;n;j;Waterschap Amstel Gooi en Vecht;Investering per planperiode=0.00|Beheer en Onderhoud per planperiode=0.00;0;0;1;0;0;0;ESF5;uitgevoerd;intern onderhoud en beheer;;;246.4832668;;;;0;;1;Amstellandboezem;2021;LM_20190916;Amstel;;;
26;76529;NL11;91103;Omleiden / scheiden waterstromen Amstellandboezem;p;SGBP2 2015-2021;2015-2021;IN02;Voorheen: Aanleggen schoonwaterkering Kromme Mijdrecht. Deze maatregel wordt genomen in de Amstellandboezem, maar heeft ook positief effect voor Vaarten Zevenhoven en Tussenboezem Vinkeveen a en b. ;MW;NL11_1_1;1;n;j;Waterschap Amstel Gooi en Vecht;Investering per planperiode=0.00|Beheer en Onderhoud per planperiode=0.00;1;0;0;0;0;0;ESF1;loopt;geen;;33.38;246.4832668;0;0;mg/m2/dag;;;1;Amstellandboezem;2021;LM_20190916;Amstel;;;
27;;;;Flexibel peilbeheer in boezemwateren;nvt;SGBP2 2015-2021;niet;IM12;;MW;NL11_1_1;;;n;Waterschap Amstel Gooi en Vecht ;;0;0;0;0;0;0;ESF4;verlies functie;NVT;;;246.4832668;;;;;;;Amstellandboezem;nvt;LM_20190916;Amstel;;;
28;;;;Amoveren/ verbeteren zuivering Amstelveen;p;SGBP3 2021-2027;2021-2027;IM01;Verminderen belasting met nutrienten uit de RWZI.;WB;NL11_1_1;Waterschap Amstel Gooi en Vecht;opzoeken;j;Waterschap Amstel Gooi en Vecht;opzoeken;0;0;0;0;0;0;ESF1;loopt;Gemeente Amsterdam?;;33.38;246.4832668;0;5;mg/m2/dag;;;;Amstellandboezem;2027;LM_20190916;Amstel;;;
29;;;;Natuurvriendelijke dijkreconstructie (voldoende ondiep oppervlak, flauw talud, verbinding tussen land en water);areaal beter;SGBP3 2021-2027;2021-2027;IN20;Deze maatregel staat in boezemplan.;;NL11_1_1;1;n;j;Waterschap Amstel Gooi en Vecht ;;0;0;0;0;0;0;ESF4;opstarten;intern;;;246.4832668;;?;ha;;;;Amstellandboezem;2027;LM_20190916;Amstel;;;
30;;;;Beperken van scheepvaart in grote kanalen;nvt;SGBP3 2021-2027;niet;RO03;Scheepvaartluwe zones bieden kansen voor ecologische waterkwaliteit omdat hier minder bodemmateriaal opwerveld en golfslag de ontikkeling van (emerse) vegetatie niet remt. Deze maatregel leidt tot verlies van de functie scheepvaart en wordt daarom niet meegenomen in de doelafleiding.;;NL11_1_1;;;n;Waterschap Amstel Gooi en Vecht ;;0;0;0;0;0;0;ESF4;verlies functie;NVT;;;246.4832668;;;;;;;Amstellandboezem;2027;LM_20190916;Amstel;;;
31;;;;Verwijderen waterkeringen;nvt;SGBP3 2021-2027;niet;IN20;Deze maatregel leidt tot verlies van de functie scheepvaart en wordt daarom niet meegenomen in de doelafleiding.;;NL11_1_1;;;n;Waterschap Amstel Gooi en Vecht ;;0;0;0;0;0;0;ESF4;verlies functie;NVT;;;246.4832668;;;;;;;Amstellandboezem;2027;LM_20190916;Amstel;;;
32;;;;Maatregelen landbouw om nutrientenbelasting op de waterlichamen te beperken fase 2;p;SGBP3 2021-2027;2021-2027;BR01;Deze maatregel leidt tot 10% reductie van fosforbelasting uit polderwater. Wij zijn regionaal uit gegaan van de goede landbouwpraktijk (GLP) in 2027. Belangrijk is verder dat als gevolg van de GLP uitgaan van een grotere diepte van sloten (toename van ca 25 cm naar 40 cm). De uitworp uit een landbouwpolder neemt daardoor 10 % af, voor een belangrijk deel als gevolg van een grotere retentie door een grotere waterdiepte (meer slootonderhoud) en een afname van meststofverliezen. ;MW;NL11_1_1;1;n;j;Waterschap Amstel Gooi en Vecht ;Investering per planperiode=0.00|Beheer en Onderhoud per planperiode=0.00;0;0;0;0;0;0;ESF1;stimuleren;DAW, agrarische collectieven, studieclubs, bedrijven;;33.38;246.4832668;0;2.62;mg/m2/dag;;NMI, 2019;;Amstellandboezem;2027;LM_20190916;Amstel;;;
33;;;;Leidende principes vastleggen in beleid van het waterschap (KEUR) en omgevingsvisies (gemeenten, provincies) om natuurwaarden te behouden bij vervangen van beschoeiing en onderhoud.;areaal beter;SGBP3 2021-2027;2021-2027;BR01;Ook communicatie richting omwonende zou helpen om de beeldvorming over natuurwaarden.;;NL11_1_1;;;;Waterschap Amstel Gooi en Vecht ;;0;0;0;0;0;0;ESF4;stimuleren;Gemeentes rond Amstel;;;246.4832668;;;;;;;Amstellandboezem;2027;LM_20190916;Amstel;;;
34;71356;NL11;91122;Uitvoeren maatregelen voor P-reductie rwzi Maarssen (autonoom);;SGBP1 2009-2015;2009-2015;IM01;;WB;NL11_1_2;1;n;j;Waterschap Amstel Gooi en Vecht;Investering per planperiode=5300000.00|Beheer en Onderhoud per planperiode=0.00;0;0;0;1;0;0;ESF1;opzoeken;geen;;64.23;180.4977619;al verdisconteerd in modellen 2019;0;mg/m2/dag;;;1;Vecht;nvt;LM_20190916;Vecht;;;
35;71360;NL11;91131;Aansluiten ongerioleerde woonboten Vecht;;SGBP1 2009-2015;2009-2015;IM06;Het gaat om het aansluiten van alle ongerioleerde woonboten langs de Vecht;WB;NL11_1_2;1;n;n;Verschillende gemeenten langs de Vecht;Beheer en Onderhoud per planperiode=0.00|Investering per planperiode=6000000.00;0;0;1;0;0;0;ESF1;uitgevoerd;NVT;;;180.4977619;al verdisconteerd in modellen 2019;0;mg/m2/dag;;;1;Vecht;2016;LM_20190916;Vecht;;;
36;71375;NL11;NL11_0139;Onderzoeken verminderen belasting Vecht e.o. door RWZI Utrecht;;SGBP1 2009-2015;2009-2015;IM01;Een onderzoek naar de mogelijke maatregelen om de belasting van de Vecht vanuit de rwzi Utrecht te verminderen. Het onderzoek wordt onder regie van Hoogheemraadschap De Stichtse Rijnlanden uitgevoerd.;WB;NL11_1_2;1;n;j;opzoeken;Investering per planperiode=0.00|Beheer en Onderhoud per planperiode=0.00;0;0;1;0;0;0;ESF1;uitgevoerd;NVT;;64.23;180.4977619;0;0;mg/m2/dag;;;1;Vecht;2016;LM_20190916;Vecht;;;
37;71392;NL11;NL11_0189;Uitvoeren waterbeheermaatregelen Vecht, baggeren waterbodem;;SGBP1 2009-2015;2009-2015;BE04;Het gaat om een langjarig saneringsproject waarbij de gehele Vecht op verschillende locaties wordt gebaggerd van waterkwaliteitsoverwegingenDe omvang is bij de rapportage 2013 op basis van monitoring gegevens naar boven bijgesteld van 2.000.000 m3 naar 2.500.000 m3;WB;NL11_1_2;2500000;m3;j;Waterschap Amstel Gooi en Vecht;Beheer en Onderhoud per planperiode=0.00|Investering per planperiode=45000000.00;0;0;2500000;0;0;0;ESF3;uitgevoerd;NVT;;;180.4977619;;329;ha;;;1;Vecht;2016;LM_20190916;Vecht;;;
38;71358;NL11;91127;Aanleggen en onderhouden natuurvriendelijke oevers Vecht, fase 1;;SGBP1 2009-2015;2009-2015;IN08;Het gaat om zowel het aanleggen van nieuwe natuurvriendelijke oevers op locaties waar dit binnen het bestaande profiel mogelijk is als om het opknappen van bestaande natuurvriendelijke oevers.;WB;NL11_1_2;3;km;j;Waterschap Amstel Gooi en Vecht;Beheer en Onderhoud per planperiode=30000.00|Investering per planperiode=585000.00;0;0;3;0;0;0;ESF4;uitgevoerd;Uitvoering intern;;;180.4977619;;0.45;ha;;;1;Vecht;2016;LM_20190916;Vecht;;;
39;71359;NL11;91128;Uitvoeren beschermingsmaatregelen voor behoud natuurvriendelijke oevers;;SGBP1 2009-2015;2009-2015;RO09;Een set van maatregelen om schade aan oevers door vaarbewegingen boten te beperken;WB;NL11_1_2;1;n;j;Waterschap Amstel Gooi en Vecht;Beheer en Onderhoud per planperiode=120000.00|Investering per planperiode=487500.00;0;0;1;0;0;0;ESF4;uitgevoerd;intern onderhoud en beheer;;;180.4977619;;?;;;;1;Vecht;2016;LM_20190916;Vecht;;;
40;71361;NL11;91132;Aanleggen schuilplaatsen voor Snoek (buizen);;SGBP1 2009-2015;2009-2015;IN17;De maatregel betreft het aanleggen van voldoende paai- en rustlocaties voor Snoek.;WB;NL11_1_2;1;ha;j;Waterschap Amstel Gooi en Vecht;Beheer en Onderhoud per planperiode=0.00|Investering per planperiode=60938.00;0;0;0;0;1;0;ESF4;opzoeken/afvoeren;NVT;;;180.4977619;;1;ha;;;1;Vecht;nvt;LM_20190916;Vecht;;;
41;71362;NL11;91133;Onderzoeken aanpassen spuiregime Muiden;;SGBP1 2009-2015;2009-2015;S01;Een onderzoek naar de mogelijkheden om het spuiregime bij Muiden aan te passen. Dit blijkt niet zinvol;WB;NL11_1_2;1;n;j;Waterschap Amstel Gooi en Vecht;Beheer en Onderhoud per planperiode=0.00|Investering per planperiode=120000.00;0;0;1;0;0;0;NVT;uitgevoerd;geen;;;180.4977619;;;;;;1;Vecht;2016;LM_20190916;Vecht;;;
42;71380;NL11;NL11_0145;Toepassen ecologisch onderhoud oevers hoofdwateren - fase 1;;SGBP1 2009-2015;2009-2015;BE03;Een gebiedsbrede maatregel in alle waterlichamen;MW;NL11_1_2;325;km;j;Waterschap Amstel Gooi en Vecht;Investering per planperiode=0.00|Beheer en Onderhoud per planperiode=390000.00;0;0;325;0;0;0;ESF4;uitgevoerd;Uitvoering intern;;;180.4977619;;27.07466429;ha;;;1;Vecht;2016;LM_20190916;Vecht;;;
43;71357;NL11;91124;Realiseren P-reductie rwzi Horstermeer (autonoom);;SGBP1 2009-2015;2009-2015;IM01;Het gaat om het realiseren van maatregelen om de rwzi aan de wettelijke lozingseisen te laten voldoen;MW;NL11_1_2;1;n;j;Waterschap Amstel Gooi en Vecht;Investering per planperiode=10500000.00|Beheer en Onderhoud per planperiode=0.00;0;0;1;0;0;0;ESF1;uitgevoerd;geen;;;180.4977619;al verdisconteerd in modellen 2019;0;mg/m2/dag;;;1;Vecht;2016;LM_20190916;Vecht;;;
44;76564;NL11;NL11_0157;Vispasseerbaar maken sluizen, gemalen en stuwen - fase 1;;SGBP1 2009-2015;2009-2015;IN15;Bij zeesluis Muiden is het beheer aangepast zodat vis tijdens de trekperiode kan passeren.;MW;NL11_1_2;4;n;j;Waterschap Amstel Gooi en Vecht;Investering per planperiode=0.00|Beheer en Onderhoud per planperiode=0.00;0;0;1;0;0;0;ESF5;uitgevoerd;intern onderhoud en beheer;;;180.4977619;;;;0;;1;Vecht;2016;LM_20190916;Vecht;;;
45;76562;NL11;NL11_0148;Verdergaande P-reductie rwzi Maarssen (na evaluatie);p;SGBP2 2015-2021;2015-2021;IM01;De RWZI is sinds juli 2019 geamoveerd en loost niet meer op de Vecht.;WB;NL11_1_2;1;n;j;Waterschap Amstel Gooi en Vecht;Investering per planperiode=0.00|Beheer en Onderhoud per planperiode=0.00;1;0;0;0;0;0;ESF1;opzoeken;opzoeken;;;180.4977619;;0.79;mg/m2/dag;;;1;Vecht;2021;LM_20190916;Vecht;Reductie vracht Maarssen, eventueel helemaal verwijderen, inclusief debiet.;reductie;reductie debiet, toename verblijftijd
46;76576;NL11;V-xx;Beperken fosfaatbelasting rwzi Utrecht (autonoom);p;SGBP2 2015-2021;2015-2021;IM01;Deze maatregel wordt genomen in waterlichaam Vecht, maar heeft ook een positief effect voor Molenpolder en Tienhoven en Wijde Blik. ;MW;NL11_1_2;1;n;j;HDSR;Investering per planperiode=0.00|Beheer en Onderhoud per planperiode=0.00;0;1;0;0;0;0;ESF1;opzoeken;opzoeken;;;180.4977619;;6;mg/m2/dag;;;1;Vecht;2021;LM_20190916;Vecht;;;
47;76541;NL11;GEB-y;Maatregelen landbouw om nutrientenbelasting op de waterlichamen te beperken fase 1;p;SGBP2 2015-2021;2015-2021;BR01;Deze maatregel wordt uitgevoerd in meerdere waterlichamen: Amstellandboezem, Vaarten Ronde Hoep, Vaarten Groot Mijdrecht, Vaarten Westeramstel, Vaarten Ronde Venen, Vaarten Zevenhoven, Tussenboezem Vinkeveen a, TussenboezemVinkeveen b, Vinkeveense Plassen, Vecht, Vaarten Vechtstreek, Stichts nkeveense Plassen, Kortenhoefse Plassen, Spiegelplas, Wijde Blik, Loosdrechtse Plassen, Steren Zodden, Molenpolder en Tienhoven;MW;NL11_1_2;1;n;j;Waterschap Amstel Gooi en Vecht ;Investering per planperiode=0.00|Beheer en Onderhoud per planperiode=0.00;0;1;0;0;0;0;ESF1;stimuleren;DAW, agrarische collectieven, studieclubs, bedrijven;;33.38;180.4977619;0;0;mg/m2/dag;;;1;Vecht;2021;LM_20190916;Vecht;;;
48;76517;NL11;91009;Aanpassen RWZI Horstermeer (kwaliteit effluent verdergaand verbeteren na evaluatie);p;SGBP2 2015-2021;2015-2021;IM01;;MW;NL11_1_2;1;n;j;Waterschap Amstel Gooi en Vecht;Investering per planperiode=0.00|Beheer en Onderhoud per planperiode=0.00;0;0;1;0;0;0;ESF1;uitgevoerd;geen;;;180.4977619;;?;mg/m2/dag;;;1;Vecht;2018;LM_20190916;Vecht;Reductie toepassen op RWZI Horstermeer (afvangen zout???);;
49;76575;NL11;V-x;Uitvoeren beschermingsmaatregelen voor behoud natuurvriendelijke oevers (voortzetten);achteruitgang vermijden;SGBP2 2015-2021;2015-2021;RO09;;WB;NL11_1_2;1;n;j;Waterschap Amstel Gooi en Vecht ;Investering per planperiode=0.00|Beheer en Onderhoud per planperiode=0.00;0;1;0;0;0;0;ESF4;opzoeken;opzoeken;;;180.4977619;;?;;;;1;Vecht;2021;LM_20190916;Vecht;Profielen uit Boezemmodel halen ???;;
50;76577;NL11;x;Onderzoek vispasseerbaar maken sluizen, gemalen en stuwen ;nvt;SGBP2 2015-2021;2015-2021;S01;Gemaal Gaasperplas, defosfatering Naardermeer, Spiegelplas: gemaal en pilotproject inzet schutsluizen Spiegelplas ;MW;NL11_1_2;3;n;j;Waterschap Amstel Gooi en Vecht ;Investering per planperiode=0.00|Beheer en Onderhoud per planperiode=0.00;0;1;2;0;0;0;NVT;opzoeken;opzoeken;;;180.4977619;;;;0;;1;Vecht;2021;LM_20190916;Vecht;;;
51;;;;Flexibel peilbeheer in boezemwateren;nvt;SGBP2 2015-2021;niet;IM12;;;NL11_1_2;;;n;Waterschap Amstel Gooi en Vecht ;NVT;0;0;0;0;0;0;ESF4;verlies functie;NVT;;;180.4977619;;?;;;;;Vecht;nvt;LM_20190916;Vecht;;;
52;;;;Verwijderen waterkeringen;nvt;SGBP2 2015-2021;niet;IN20;;;NL11_1_2;;;n;Waterschap Amstel Gooi en Vecht ;NVT;0;0;0;0;0;0;ESF4;verlies functie;NVT;;;180.4977619;;;;;;;Vecht;nvt;LM_20190916;Vecht;;;
53;;;;Vervangen inlaat Stenen Beer door sluis Uitermeer of bij Naarden vanuit Ijmeer;p;SGBP3 2021-2027;2021-2027;BR01;door de inlaat te verplaatsen voorkomen we dat nutrientenrijk water uit de kustpolders door de boezem kan stromen;;NL11_1_2;2;n;j;Waterschap Amstel Gooi en Vecht ;opzoeken;0;0;0;0;0;0;ESF1;Initiëren;opzoeken;;64.23;180.4977619;0;0;mg/m2/dag;;;;Vecht;2027;LM_20190916;Vecht;;;
54;;;;Maatregelen landbouw om nutrientenbelasting op de waterlichamen te beperken fase 2;p;SGBP3 2021-2027;2021-2027;BR01;Deze maatregel leidt tot 10% reductie van fosforbelasting uit polderwater. Wij zijn regionaal uit gegaan van de goede landbouwpraktijk (GLP) in 2027. Belangrijk is verder dat als gevolg van de GLP uitgaan van een grotere diepte van sloten (toename van ca 25 cm naar 40 cm). De uitworp uit een landbouwpolder neemt daardoor 10 % af, voor een belangrijk deel als gevolg van een grotere retentie door een grotere waterdiepte (meer slootonderhoud) en een afname van meststofverliezen. ;MW;NL11_1_2;1;n;j;Waterschap Amstel Gooi en Vecht ;Investering per planperiode=0.00|Beheer en Onderhoud per planperiode=0.00;0;0;0;0;0;0;ESF1;stimuleren;DAW, agrarische collectieven, studieclubs, bedrijven;;33.38;180.4977619;0;1.398;mg/m2/dag;;NMI, 2019;;Vecht;2027;LM_20190916;Vecht;;;
55;;;;Scenario-ontwikkeling waterakkoord weerdsluis naar minimaar 2.5 kuub/sec ;p;SGBP2 2015-2021;2015-2021;BR01;Zou iemand deze maatregel kunnen toelichten: wat behelst dit en wat is het effect op de ecologie? Traject loopt al (hilga).;MW;NL11_1_2;1;n;j;Waterschap Amstel Gooi en Vecht ;Investering per planperiode=0.00|Beheer en Onderhoud per planperiode=0.00;0;1;0;0;0;0;ESF1;opzoeken;opzoeken;;33.38;180.4977619;0;1.398;mg/m2/dag;;NMI, 2019;;Vecht;2027;LM_20190916;Vecht;;;
56;;;;Natuurvriendelijke dijkreconstructie (voldoende ondiep oppervlak, flauw talud, verbinding tussen land en water).;areaal beter;SGBP3 2021-2027;2021-2027;BR01;Deze maatregel staat in boezemplan. Hiermee wordt zowel het behoud van bestaande natuurwaarden als het creeren van nieuwe natuurwaarden beoogd.;;NL11_1_2;;;;Waterschap Amstel Gooi en Vecht ;opzoeken;0;0;0;0;0;0;ESF4;opstarten;intern;;;180.4977619;;;;;;;Vecht;2027;LM_20190916;Vecht;;;
57;;;;Leidende principes vastleggen in beleid van het waterschap (KEUR) en omgevingsvisies (gemeenten, provincies) om natuurwaarden te behouden bij vervangen van beschoeiing en onderhoud.;areaal beter;SGBP3 2021-2027;2021-2027;BR01;Ook communicatie richting omwonende zou helpen om de beeldvorming over natuurwaarden. De kwaliteit van de oevers gaat lokaal achteruit door aanleg van steigers, vlonders en vervanging van oude beschoeiingen. De Keur van het waterschap is op dit moment niet afgestemd om deze negatieve ontwikkelingen effectief tegen te gaan.;;NL11_1_2;;;;Waterschap Amstel Gooi en Vecht ;opzoeken;0;0;0;0;0;0;ESF4;stimuleren;Gemeenten rond Vecht;;;180.4977619;;;;;;;Vecht;2027;LM_20190916;Vecht;;;
58;;;;Handhaven op maximum vaarsnelheid.;scheepvaart;SGBP3 2021-2027;2021-2027;;Inclusief communicatie waarom deze maatregel belangrijk is voor de ecologische waterkwaliteit.;;NL11_1_2;;;;Waterschap Amstel Gooi en Vecht ;opzoeken;0;0;0;0;0;0;ESF4;Initiëren;intern;;;180.4977619;;;;;;;Vecht;2027;LM_20190916;Vecht;;;
59;71312;NL11;90996;Aansluiten ongerioleerde woonboten;;SGBP1 2009-2015;2009-2015;IM06;Het gaat om het aansluiten van ongeveer 2300 ongerioleerde woonboten in de watergangen binnen de gemeente Amsterdam;WB;NL11_2_1;1;n;j;Gemeente Amsterdam;Investering per planperiode=30000000.00|Beheer en Onderhoud per planperiode=0.00;0;0;0;1;0;0;ESF1;gefaseerd naar SGBP2;opzoeken;;;194.659227;bezoekers per dag, fractie bezoekers naar wc, P-vracht per plasbeurt;?;mg/m2/dag;;;1;VaartenAmsterdam;nvt;LM_20190916;Amsterdam;;;
60;71311;NL11;90995;Onderzoeken optimalisatiemogelijkheden doorspoelregime;;SGBP1 2009-2015;2009-2015;S01;Een onderzoek naar de mogelijkheden om het doorspoelregime van het Amterdamse grachtenstelsel te optimaliseren;WB;NL11_2_1;1;n;j;Waterschap Amstel Gooi en Vecht;Investering per planperiode=240000.00|Beheer en Onderhoud per planperiode=0.00;0;0;1;0;0;0;NVT;opzoeken;opzoeken;;;194.659227;;;;;;1;VaartenAmsterdam;2016;LM_20190916;Amsterdam;;;
